id,title,dateSigned,description,status,awardID,value_amount,value_currency,period_endDate,period_startDate,period_maxExtentDate,period_durationInDays,main_ocid,main_id
3001,SCMU6-23/24-0002,2025-02-05T15:15:28Z,"Appointment of service provider (s) for rendering of the secure transportation of High security Examination and Assessment material from Provincial office or dispatch premises to and from all Educational District offices, Nodal points and all marking centers",active,30608,0,ZAR,2027-05-21T00:00:00Z,2024-05-15T00:00:00Z,2027-05-21T00:00:00Z,1101,ocds-9t57fa-77670,ocds-9t57fa-77670-2023-12-19T00:00:00Z
949,3100032929,2023-04-25T06:30:40Z,Procurement Sharegate Standard Software Subscription,active,11022,563,ZAR,2023-02-15T00:00:00Z,2023-02-10T00:00:00Z,2023-02-15T00:00:00Z,5,ocds-9t57fa-52712,ocds-9t57fa-52712-2023-02-10T00:00:00Z
3699,SCMU5-23/24-0050,2025-08-19T08:27:25Z,SUPPLY AND INSTALL SOLAR SYSTEM IN MALUTI OFFICE COMPLEX AT ALFRED NZO ,active,46775,5603375,ZAR,2024-02-28T00:00:00Z,2023-11-01T00:00:00Z,2024-02-28T00:00:00Z,119,ocds-9t57fa-60994,ocds-9t57fa-60994-2023-07-21T00:00:00Z
1148,3100034195,2023-08-29T07:04:55Z,ammunition,active,15569,470460,ZAR,2023-10-31T00:00:00Z,2023-08-08T00:00:00Z,2023-10-31T00:00:00Z,84,ocds-9t57fa-64222,ocds-9t57fa-64222-2023-07-07T00:00:00Z
3003,SCMU5-23/24-0073,2025-02-06T10:53:14Z,"TAYLOR BEQUEST HOSPITAL, MOUNT FLETCHER REFURBISHMENT, REPAIRS, AND UPGRADES TO WATER & WASTEWATER TREATMENT WORKS",active,42630,42481329,ZAR,2025-08-24T00:00:00Z,2024-05-23T00:00:00Z,2025-08-24T00:00:00Z,458,ocds-9t57fa-68151,ocds-9t57fa-68151-2023-09-22T00:00:00Z
2875,DTP01599,2025-01-08T12:04:12Z,Appointment of a service provider for an Integrated Document and Records Management System (IDRMS); including maintenance and support for a period of three (3) years,active,31025,15618288,ZAR,2028-02-29T00:00:00Z,2024-12-01T00:00:00Z,2028-02-29T00:00:00Z,1185,ocds-9t57fa-68729,ocds-9t57fa-68729-2023-09-29T00:00:00Z
2054,01,2024-07-24T14:44:48Z,"Refurbishment of ECDC properties in Butterworth, Cluster F1
EVALUATION CRITERIA: THREE PHASES
PHASE1: LOCAL CONTENT AND PRODUCTION
PHASE2: FUNCTIONALITY
PHASE3: PREFERENTIAL PROCUREMENT POINTS",active,20419,53000,ZAR,2025-05-05T00:00:00Z,2024-02-05T00:00:00Z,2025-05-05T00:00:00Z,455,ocds-9t57fa-69554,ocds-9t57fa-69554-2023-10-06T00:00:00Z
1278,58517,2023-10-12T18:06:36Z,Municipal PMS Training,active,17695,479125,ZAR,2023-09-29T00:00:00Z,2021-06-01T00:00:00Z,2023-09-29T00:00:00Z,850,ocds-9t57fa-69572,ocds-9t57fa-69572-2023-07-07T00:00:00Z
1440,ENG018/2023q,2023-12-19T08:45:24Z,"ENG 018 OF 2023 : SUPPLY AND DELIVERY OF A NEW FIBRE OPTIC FUSION SPLICER KIT
",active,20521,30970,ZAR,2024-06-30T00:00:00Z,2023-12-12T00:00:00Z,2024-06-30T00:00:00Z,201,ocds-9t57fa-69613,ocds-9t57fa-69613-2023-10-06T00:00:00Z
1259,3100034244,2023-10-11T13:14:41Z,RFX6000022608 SUPPLY NEW AIRCON: PRETORIA,active,17611,106080,ZAR,2023-12-28T00:00:00Z,2023-08-01T00:00:00Z,2023-12-28T00:00:00Z,149,ocds-9t57fa-70043,ocds-9t57fa-70043-2023-07-07T00:00:00Z
2204,ZNB106/2023/24HSE,2024-09-09T08:11:01Z,"APPOINTMENT OF A SERVICE PROVIDER TO RENDER 24 HOUR SECURITY GUARDING SERVICES FOR THE KZN DEPARTMENT OF HUMAN SETTLEMENTS AT UMKHANYAKUDE DISTRICT OFFICE, JOZINI, FOR A PERIOD OF 36 MONTHS.",active,26104,2018563,ZAR,2027-08-31T00:00:00Z,2024-09-01T00:00:00Z,2027-08-31T00:00:00Z,1094,ocds-9t57fa-71646,ocds-9t57fa-71646-2023-10-27T00:00:00Z
2378,1Z-26049,2024-10-08T11:24:44Z,Appointment of a suitable service provider to undertake a Learnership Programme in Film and Television Production Operations NQF Level 4 (SAQA ID: 61450) for 20 learners for a period of 18 months,active,35034,599800,ZAR,2027-02-26T00:00:00Z,2024-08-12T00:00:00Z,2027-02-26T00:00:00Z,928,ocds-9t57fa-73486,ocds-9t57fa-73486-2023-11-10T00:00:00Z
2442,7E-23406,2024-10-16T09:55:20Z,Request for Proposals for the leasing of a property situated on Erf 12281 Durban as depicted on SJ Plan No. 4805/9 measuring 81m² for commercial purposes for a period of nine years and eleven months with no right of renewal,active,36766,969150,ZAR,2031-06-30T00:00:00Z,2024-07-31T00:00:00Z,2031-06-30T00:00:00Z,2525,ocds-9t57fa-73514,ocds-9t57fa-73514-2023-11-10T00:00:00Z
1356,3600030314,2023-11-16T15:03:27Z,"RFX: 6000022877 DAY TO DAY MAINTENANCE, PoE MPUMALANGA",active,19511,600000,ZAR,2025-03-17T00:00:00Z,2023-10-02T00:00:00Z,2025-03-17T00:00:00Z,532,ocds-9t57fa-74288,ocds-9t57fa-74288-2023-07-28T00:00:00Z
2950,scmu5-23-24-0096,2025-01-28T11:03:05Z,"CONSTRUCTION OF
UPPER CORANA SENIOR SECONDARY SCHOOL, LIBODE – PHASE 1",active,41944,41482050,ZAR,2025-08-18T00:00:00Z,2024-06-19T00:00:00Z,2025-08-18T00:00:00Z,425,ocds-9t57fa-75365,ocds-9t57fa-75365-2023-11-24T00:00:00Z
1468,3600031165,2024-01-26T09:05:51Z,Day to day Maintenance of Giyani & Sibasa Offices,active,21677,500000,ZAR,2024-12-31T00:00:00Z,2023-12-18T00:00:00Z,2024-12-31T00:00:00Z,379,ocds-9t57fa-79151,ocds-9t57fa-79151-2023-11-10T00:00:00Z
3172,P1/IT/SITA/08/23,2025-03-12T10:33:02Z,RENEWAL OF EXINDA LICENSES FOR A PEERIOD OF THREE YEARS,active,44838,2342343,ZAR,2026-05-04T00:00:00Z,2021-05-05T00:00:00Z,2026-05-04T00:00:00Z,1825,ocds-9t57fa-117294,ocds-9t57fa-117294-2023-10-13T00:00:00Z
3720,SCMU5-23/24-0007,2025-08-21T14:11:47Z,"BID FOR THE APPOINTMENT OF SERVICE PROVIDER TO DEVELOP, MAINTAIN AND SUPPORT AN ELECTRONIC CONTRACTS MANAGEMENT SOLUTION FOR DPWI AS PER SPECIFICATION FOR A PERIOD OF 36 MONTHS ",active,53235,2869979,ZAR,2026-12-12T00:00:00Z,2023-12-13T00:00:00Z,2026-12-12T00:00:00Z,1095,ocds-9t57fa-61666,ocds-9t57fa-61666-2023-07-28T00:00:00Z
2325,1M-26463,2024-10-02T10:51:46Z,Maintenance repairs to roads and stormwater infrastructure as and when required in the ABM areas located within the South Region of eThekwini Municipality for a period of 24 months,active,36042,15208083,ZAR,2026-07-31T00:00:00Z,2024-08-12T00:00:00Z,2026-07-31T00:00:00Z,718,ocds-9t57fa-64759,ocds-9t57fa-64759-2023-08-25T00:00:00Z
1138,3100034312,2023-08-25T09:03:36Z,"Supply and deliver Operator Ergonomic Chairs, Doringkloof",active,15505,310500,ZAR,2023-10-31T00:00:00Z,2023-08-24T00:00:00Z,2023-10-31T00:00:00Z,68,ocds-9t57fa-64785,ocds-9t57fa-64785-2023-08-11T00:00:00Z
1448,T65/2023,2024-01-12T12:51:45Z,PIPE WORK ASSOCIATED WITH NEW FUTURE L’AGULHAS RESERVOIR,active,20883,4951543,ZAR,2024-06-28T00:00:00Z,2024-01-10T00:00:00Z,2024-06-28T00:00:00Z,170,ocds-9t57fa-66466,ocds-9t57fa-66466-2023-09-08T00:00:00Z
2534,1H-24659,2024-11-05T10:25:05Z,Provision of engineering services for the Pilgram X Housing Project,active,37871,75940000,ZAR,2027-06-30T00:00:00Z,2024-06-12T00:00:00Z,2027-06-30T00:00:00Z,1113,ocds-9t57fa-67981,ocds-9t57fa-67981-2023-09-22T00:00:00Z
1939,22/09/2023,2024-06-26T10:00:27Z,APPOINTMENT OF A SERVICE PROVIDER TO SUPPLY AND DELIVER FURNITURE FOR THE NEW OFFICES ,active,22150,3195670,ZAR,0001-01-01T00:00:00Z,0001-01-01T00:00:00Z,0001-01-01T00:00:00Z,0,ocds-9t57fa-68149,ocds-9t57fa-68149-2023-09-22T00:00:00Z
1922,IC-22976,2024-06-18T13:25:06Z,Supply and delivery of ammunition for eThekwini Metro Police Services,active,29576,9503025,ZAR,2026-02-20T00:00:00Z,2024-03-20T00:00:00Z,2026-02-20T00:00:00Z,702,ocds-9t57fa-69431,ocds-9t57fa-69431-2023-10-06T00:00:00Z
2143,RLM/DPS/0065/2023/24,2024-08-22T13:25:39Z,"Appointment of a service providers for back-office software contravention system for Rustenburg Traffic Department for a period of 3 years
",active,33416,1750000,ZAR,0001-01-01T00:00:00Z,0001-01-01T00:00:00Z,0001-01-01T00:00:00Z,0,ocds-9t57fa-74612,ocds-9t57fa-74612-2023-11-18T00:00:00Z
1438,3100034739,2023-12-13T14:14:08Z,Supply and deliver of Pro cards,active,20452,133050,ZAR,2024-01-31T00:00:00Z,2023-10-18T00:00:00Z,2024-01-31T00:00:00Z,105,ocds-9t57fa-77216,ocds-9t57fa-77216-2023-09-29T00:00:00Z
1521,P1/AUX/CLN/16/23,2024-02-14T10:18:34Z,Appointment of Service Provider for Cleaning Services at EDTEA ILembe District Office,active,22118,150528,ZAR,2024-05-31T00:00:00Z,2023-12-01T00:00:00Z,2024-05-31T00:00:00Z,182,ocds-9t57fa-80266,ocds-9t57fa-80266-2023-10-28T00:00:00Z
4317,DHS 33/2022,2026-02-05T18:38:27Z,"Construction & Installation of Bulk Infrastructure of Water, Sewer and Treatment Plant (Deemed to include all extra overs) at Kanana ext.15, Connecting Kanana Ext 16: Jouberton South Side, Ext 34 and Kanana Estate and Design and Install 2302 Services for Internal Reticulation (Sewer, Water, Storm Water and Roads) at Kanana Ext .16 on Portions 100 of the Farm Nooitgedacht 434: Matlosana Local Municipality",active,58730,306810610,ZAR,2025-10-31T00:00:00Z,2023-07-18T00:00:00Z,2025-10-31T00:00:00Z,836,ocds-9t57fa-141726,ocds-9t57fa-141726-2023-03-10T00:00:00Z
2154,DARD 15/2023,2024-08-22T21:42:54Z,Appointment of a catering company to provide fixed-price catering for Owen Sithole College for a period of thirty-six (36) months,active,24542,22730450,ZAR,2027-04-30T00:00:00Z,2024-05-01T00:00:00Z,2027-04-30T00:00:00Z,1094,ocds-9t57fa-64570,ocds-9t57fa-64570-2023-08-24T00:00:00Z
2020,P1/AUX/SEC/03/24 UMZINYATHI,2024-07-23T10:55:44Z,"APPOINTMENT OF THE SUITABLE SERVICE PROVIDER TO 
PROVIDE PHYSICAL SECURITY SERVICES AT KZN DEPARTMENT OF ECONOMIC DEVELOPMENT, TOURISM AND ENVIRONMENTAL AFFAIRS (EDTEA): MINISTRY, MKUZE, UMZINYATHI AND AMAJUBA DISTRICT OFFICES AND BULK BUYING OFFICES FOR THE PERIOD OF 36 MONTHS.",active,28641,4780076,ZAR,2027-06-30T00:00:00Z,2024-07-01T00:00:00Z,2027-06-30T00:00:00Z,1094,ocds-9t57fa-64647,ocds-9t57fa-64647-2023-08-24T00:00:00Z
2209,01/2023,2024-09-10T16:27:13Z,"Construction of Boreholes Project for Impendle, Mpofana and uMshwathi Local Municipalities",pending,34962,8999800,ZAR,0001-01-01T00:00:00Z,0001-01-01T00:00:00Z,0001-01-01T00:00:00Z,0,ocds-9t57fa-46897,ocds-9t57fa-46897-2023-02-17T00:00:00Z
4821,NC/SOC/008/2023,2026-03-27T12:32:36Z,"RENDERING OF CLEANING,CAR WASH & GARDEN SERVICES AT THE PIXLEY KA SEME DISTRICT,FOR A PERIOD OF 36 MONTHS",active,66068,10920007,ZAR,2027-01-31T00:00:00Z,2024-02-01T00:00:00Z,2027-01-31T00:00:00Z,1095,ocds-9t57fa-50116,ocds-9t57fa-50116-2023-03-24T00:00:00Z
4781,CDC/87/23,2026-03-26T10:33:17Z,"UPGRADE AND ADDITIONS AT KHANYISANI PRIMARY SCHOOL IN ETHEKWINI METRO, KWAZULU-NATA - 7GB OR HIGHER",active,15155,43930909,ZAR,2026-03-31T00:00:00Z,2023-08-01T00:00:00Z,2026-03-31T00:00:00Z,973,ocds-9t57fa-52512,ocds-9t57fa-52512-2023-04-21T00:00:00Z
4438,PO 01/04/2023,2026-02-18T10:46:42Z,Request for proposal to appoint a capable service provider for the overall administration and project management of the Northern Cape Provincial Government Skills Development Project,active,13572,12500000,ZAR,2027-07-05T00:00:00Z,2023-07-04T00:00:00Z,2027-07-05T00:00:00Z,1462,ocds-9t57fa-52856,ocds-9t57fa-52856-2023-04-28T00:00:00Z
1760,1R-23758,2024-04-26T15:05:23Z,Flood damage remediation – Coedmore Road and bridge construction: Wards 64 & 65,active,27084,49374577,ZAR,2024-06-28T00:00:00Z,2023-09-13T00:00:00Z,2024-06-28T00:00:00Z,289,ocds-9t57fa-56043,ocds-9t57fa-56043-2023-06-02T00:00:00Z
1316,T/ING/002/2023,2023-10-26T16:03:56Z,"Tender T/ING/002/2023 - Appointment of a Service Provider for the Supply, Repair and Maintenance of Camera Units for the Go George Bus Fleet for a period of two (2) years",active,18477,16757710,ZAR,2025-12-15T00:00:00Z,2023-09-16T00:00:00Z,2025-12-15T00:00:00Z,821,ocds-9t57fa-56198,ocds-9t57fa-56198-2023-06-02T00:00:00Z
2591,SCMU15/23/24-001,2024-11-12T09:42:11Z,Supply and delivery of promotional material to the Eastern Cape Department of Community Safety over a period of three(03) years,active,20540,4000000,ZAR,2026-12-31T00:00:00Z,2024-01-01T00:00:00Z,2026-12-31T00:00:00Z,1095,ocds-9t57fa-58986,ocds-9t57fa-58986-2023-06-30T00:00:00Z
1732,TETA23/RESEARCH/0002/IMPACT,2024-04-11T15:15:12Z,REQUEST FOR PROPOSALS FROM SERVICE PROVIDERS TO CONDUCT A COMPREHENSIVE STUDY ON THE IMPACT OF 4IR ON JOB SECURITY/LOSSES IN THE TRANSPORT SECTOR.,active,18152,436080,ZAR,2024-04-19T00:00:00Z,2023-10-19T00:00:00Z,2024-04-19T00:00:00Z,183,ocds-9t57fa-59501,ocds-9t57fa-59501-2023-07-07T00:00:00Z
1227,LMN 01/2023,2023-09-28T12:02:38Z,"Supply , Delivery, Installation and Commissioning of Bakery Machinery , Equipment and Accessories: Standerton Correctional Centre :Department of Correctional Services : LMN Region",active,17070,3894870,ZAR,2024-03-31T00:00:00Z,2023-09-11T00:00:00Z,2024-03-31T00:00:00Z,202,ocds-9t57fa-60223,ocds-9t57fa-60223-2023-07-14T00:00:00Z
4381,NDOH -9/2023-2024,2026-02-10T15:56:00Z,Invitation for call for proposals to non-governmental organizations (NGO's) for health system's research grant for a period of three (03) years.,active,20912,54697000,ZAR,2026-12-20T00:00:00Z,2023-12-20T00:00:00Z,2026-12-20T00:00:00Z,1096,ocds-9t57fa-60271,ocds-9t57fa-60271-2023-07-14T00:00:00Z
4468,BID PO 02/07/2023,2026-02-23T15:05:15Z,"Request for proposals to appoint a capable service provider for the supply, installation and maintenance of a DECT multi-cell VOIP telephone solution at the DSC Building for the Office of the Premier: Northern Cape",active,29812,3447273,ZAR,2028-11-23T00:00:00Z,2023-11-24T00:00:00Z,2028-11-23T00:00:00Z,1826,ocds-9t57fa-61631,ocds-9t57fa-61631-2023-07-28T00:00:00Z
3770,B23040163/1,2025-09-08T11:16:54Z,"Appointment of a Professional Service Provider to Under-take pre-Accreditation Support, Compliance Assessment and capacity support for the accreditation of eight (8) Municipalities in North -West Province to perform housing functions.",active,19775,5402056,ZAR,2024-11-12T00:00:00Z,2023-11-12T00:00:00Z,2024-11-12T00:00:00Z,366,ocds-9t57fa-61705,ocds-9t57fa-61705-2023-07-28T00:00:00Z
1518,RFP 29-2023,2024-02-11T19:12:11Z,APPOINTMENT OF A SERVICE PROVIDER FOR THE PROVISION OF REGULATORY COMPLIANCE MANAGEMENT SOFTWARE TOOL,active,22622,1661679,ZAR,2029-03-31T00:00:00Z,2024-04-01T00:00:00Z,2029-03-31T00:00:00Z,1825,ocds-9t57fa-63220,ocds-9t57fa-63220-2023-08-11T00:00:00Z
3918,SCMU5-23/24-0048,2025-10-29T16:36:05Z,"BID FOR THE APPOINTMENT OF A SERVICE PROVIDER(S) TO PROVIDE
SECURITY SERVICES FOR HEAD OFFICE CLUSTERS FOR A PERIOD OF
36 MONTHS",active,53226,0,ZAR,2027-03-31T00:00:00Z,2024-04-01T00:00:00Z,2027-03-31T00:00:00Z,1094,ocds-9t57fa-64015,ocds-9t57fa-64015-2023-08-18T00:00:00Z
1841,T/ING/025/2023,2024-05-17T11:05:59Z,Tender T/ING/025/2023 - Construction of 40Ml Raw Water Balancing Dam and Associated Works,active,28406,93138840,ZAR,2026-02-18T00:00:00Z,2024-02-19T00:00:00Z,2026-02-18T00:00:00Z,730,ocds-9t57fa-64203,ocds-9t57fa-64203-2023-08-24T00:00:00Z
3061,SCMU3-23/24-0395-HO,2025-02-12T15:11:02Z,"The bid calls for supply of containers (consumables) and the safe and effective handling of HCRW through appropriate segregation, packaging, carting (collection), storage, loading, transportation, treatment and safe disposal of health care risk waste/medical waste from the Eastern Cape hospitals and waste generated from PHC Facilities, Nursing Colleges, EMS, Forensic Pathology Laboratories, and pharmaceutical depots for a period of 36 months.",active,43303,365406444,ZAR,2027-01-31T00:00:00Z,2024-02-01T00:00:00Z,2027-01-31T00:00:00Z,1095,ocds-9t57fa-64857,ocds-9t57fa-64857-2023-08-25T00:00:00Z
5038,CNT 4223,2026-04-17T13:05:56Z,PROVISION OF TREND MICRO DEEP DISCOVERY INSPECTOR LICENCE RENEWAL FOR A PERIOD OF THREE (3) YEARS.,pending,19912,2194984,ZAR,2026-11-30T00:00:00Z,2023-12-01T00:00:00Z,2026-11-30T00:00:00Z,1095,ocds-9t57fa-65667,ocds-9t57fa-65667-2023-09-01T00:00:00Z
4714,CDC/444/23,2026-03-24T10:16:58Z,"REPAIRS AND RENOVATIONS AT DOON HEIGHTS PRIMARY SCHOOL IN UMLAZI DISTRICT, KWAZULU-NATAL - 7 GB OR HIGHER",active,23763,47587666,ZAR,2026-04-30T00:00:00Z,2024-02-16T00:00:00Z,2026-04-30T00:00:00Z,804,ocds-9t57fa-65723,ocds-9t57fa-65723-2023-09-01T00:00:00Z
4052,DTP01572,2025-11-21T16:46:57Z,"Appointment of a service provider to supply and replace parts in heating, ventilation, air conditioning and cooling major equipment at Dube TradePort for a three-year period",active,47402,7247744,ZAR,2027-08-11T00:00:00Z,2024-08-12T00:00:00Z,2027-08-11T00:00:00Z,1094,ocds-9t57fa-67188,ocds-9t57fa-67188-2023-09-14T00:00:00Z
4993,CDC/309/23,2026-04-14T15:45:21Z,"CONSTRUCTION OF ADDITIONS, RENOVATIONS, TEMPORARY STRUCTURES AND DEMOLITIONS OF INAPPROPRIATE STRUCTURES AT ZANEWONGA SENIOR SECONDARY SCHOOL (SSS) ",active,29738,56768690,ZAR,2026-08-10T00:00:00Z,2024-06-24T00:00:00Z,2026-08-10T00:00:00Z,777,ocds-9t57fa-68047,ocds-9t57fa-68047-2023-09-22T00:00:00Z
1891,WS-7598,2024-06-15T11:02:28Z,Supply and delivery of mapping grade handheld GNSS survey devices,active,29595,3946720,ZAR,2026-04-03T00:00:00Z,2024-04-03T00:00:00Z,2026-04-03T00:00:00Z,730,ocds-9t57fa-68103,ocds-9t57fa-68103-2023-09-22T00:00:00Z
1906,WS-7598,2024-06-16T12:15:16Z,Supply and delivery of mapping grade handheld GNSS survey devices,active,29614,3946719,ZAR,2025-04-03T00:00:00Z,2023-04-04T00:00:00Z,2025-04-03T00:00:00Z,730,ocds-9t57fa-68103,ocds-9t57fa-68103-2023-09-22T00:00:00Z
4591,SCMU3-23/24-0491-HO,2026-03-12T16:04:41Z,Schedule maintenance of generators at cluster three (3)– Buffalo City Metro & Amathole District – health facilities.,active,64806,292000000,ZAR,2027-05-23T00:00:00Z,2024-05-24T00:00:00Z,2027-05-23T00:00:00Z,1094,ocds-9t57fa-68911,ocds-9t57fa-68911-2023-09-29T00:00:00Z
4051,DTP01529,2025-11-21T16:42:10Z,"Appointment of a service provider for the provision of ICT Security and Cybersecurity services, Trend Micro and Mimecast licenses and support for DTPC for a period of three (3) years",active,43325,1211995,ZAR,2027-02-25T00:00:00Z,2024-02-26T00:00:00Z,2027-02-25T00:00:00Z,1095,ocds-9t57fa-69659,ocds-9t57fa-69659-2023-10-06T00:00:00Z
4496,PWR 78/23,2026-02-26T15:04:45Z,Leasing of office space (Existing Building) measuring 1022m² with 19 covered parking bays through open tender on behalf of the Department of Social Development (Kagisano Molopo Service Point) in Ganyesa for a period of 36 months.,active,61748,6207532,ZAR,2028-04-30T00:00:00Z,2025-05-01T00:00:00Z,2028-04-30T00:00:00Z,1095,ocds-9t57fa-73551,ocds-9t57fa-73551-2023-11-10T00:00:00Z
4966,CDC/478/23,2026-04-10T12:34:53Z,CONTRACT DESCRIPTION: DEVELOPMENT AND CONSTRUCTION SOLUTION FOR MPUMELELO TECHNICAL HIGH SCHOOL IN KWAZULU-NATAL,active,32625,83222414,ZAR,2026-08-14T00:00:00Z,2024-08-14T00:00:00Z,2026-08-14T00:00:00Z,730,ocds-9t57fa-74379,ocds-9t57fa-74379-2023-11-17T00:00:00Z
4586,SCMU3-23/24-0633-HO,2026-03-12T15:41:17Z,"SCHEDULE MAINTENANCE OFLAUNDRY& ASSOCIATED EQUIPMENT AT CLUSTER TWO (2) – CHRIS
HANI AND JOE GQABI DISTRICT – HEALTH FACILITIES (36 MONTHS)
",active,64802,19206150,ZAR,2027-07-31T00:00:00Z,2024-08-01T00:00:00Z,2027-07-31T00:00:00Z,1094,ocds-9t57fa-74611,ocds-9t57fa-74611-2023-11-18T00:00:00Z
2244,WS-7781,2024-09-12T14:21:00Z,"Refurbishment and commissioning of 
Blackburn Reservoir and minor auxiliary 
works to existing bulk infrastructure: Ward 8, 
35 and 102",active,35120,0,ZAR,2024-12-24T00:00:00Z,2024-04-24T00:00:00Z,2024-12-24T00:00:00Z,244,ocds-9t57fa-77660,ocds-9t57fa-77660-2023-12-19T00:00:00Z
2441,1H-23573,2024-10-15T15:17:41Z,"Construction of 96 new units at Dalton 
Community Residential Units (CRU), Tender 2 
(2 of 2: Blocks C and D)
",active,36796,55757737,ZAR,2027-09-30T00:00:00Z,2024-06-12T00:00:00Z,2027-09-30T00:00:00Z,1205,ocds-9t57fa-77596,ocds-9t57fa-77596-2023-12-18T00:00:00Z
2295,P1/AUX/08/23,2024-09-19T15:49:15Z,LED Light Bulbs @ Ulundi,pending,35570,100000,ZAR,2024-08-31T00:00:00Z,2023-09-01T00:00:00Z,2024-08-31T00:00:00Z,365,ocds-9t57fa-102239,ocds-9t57fa-102239-2023-06-15T00:00:00Z
3230,P1/IT/SITA/02/23,2025-03-22T19:31:12Z,ANNEXURE I: OPTIONAL HOSTING SERVICES,active,45237,2209829,ZAR,2026-03-31T00:00:00Z,2023-04-01T00:00:00Z,2026-03-31T00:00:00Z,1095,ocds-9t57fa-118234,ocds-9t57fa-118234-2023-01-05T00:00:00Z
807,55687,2023-03-02T08:27:53Z,SUPPLY OF UNIFLEX UNIBIND COVERS,active,8879,541125,ZAR,2023-03-03T00:00:00Z,2023-02-27T00:00:00Z,2023-03-03T00:00:00Z,4,ocds-9t57fa-47868,ocds-9t57fa-47868-2023-02-17T00:00:00Z
858,3100032813,2023-03-30T15:23:48Z,Computer consumables,active,9928,184544,ZAR,2023-03-31T00:00:00Z,2023-02-20T00:00:00Z,2023-03-31T00:00:00Z,39,ocds-9t57fa-50835,ocds-9t57fa-50835-2023-01-19T00:00:00Z
1045,BA028/2023q,2023-07-03T14:41:05Z,SUPPLY AND DELVERY OF FURNITURE AT TOUWSRANTEN LIBRARY,active,13059,121297,ZAR,2024-06-30T00:00:00Z,2023-06-20T00:00:00Z,2024-06-30T00:00:00Z,376,ocds-9t57fa-54077,ocds-9t57fa-54077-2023-05-12T00:00:00Z
3609,SCMU10-23/24-0002,2025-07-30T10:43:04Z,"APPOINTMENT OF CIVIL ENGINEERING CONTRACTOR FOR THE UPGRADING OF ROAD DR08125 FROM N2 TO SIPETU HOSPITAL, BETWEEN KM 10 AND KM 24 (14KM) PHASE 4A",active,29217,339544620,ZAR,0001-01-01T00:00:00Z,0001-01-01T00:00:00Z,0001-01-01T00:00:00Z,0,ocds-9t57fa-54117,ocds-9t57fa-54117-2023-05-12T00:00:00Z
3617,SCMU10-23/24-0006,2025-07-30T14:59:15Z,THE MAINTENANCE TO AERONAUTICAL GROUND LIGHTING SYSTEM AT MTHATHA AIRPORT FOR A CONTRACT PERIOD OF 36 MONTHS,active,29190,4030918,ZAR,2026-09-04T00:00:00Z,2023-09-05T00:00:00Z,2026-09-04T00:00:00Z,1095,ocds-9t57fa-54902,ocds-9t57fa-54902-2023-05-19T00:00:00Z
1729,TETA23/RESEARCH/0004/BENEFICIARIES,2024-04-11T15:11:19Z,REQUEST FOR PROPOSALS FROM SERVICE PROVIDERS TO CONDUCT A TRACER STUDY ON BENEFICIARIES OF TETA-FUNDED LEADERSHIP DEVELOPMENT PROGRAMMES ENROLLED IN THE YEARS 2020 TO 2022.,active,18156,342286,ZAR,2024-04-19T00:00:00Z,2023-10-19T00:00:00Z,2024-04-19T00:00:00Z,183,ocds-9t57fa-59505,ocds-9t57fa-59505-2023-07-07T00:00:00Z
1092,T36/2023,2023-07-31T13:26:14Z,VENUE HIRE & CATERING SERVICES TO HOST STATE OF THE MUNICIPALITY ADDRESS (SOMA),active,14273,67022,ZAR,2023-07-31T00:00:00Z,2023-07-26T00:00:00Z,2023-07-31T00:00:00Z,5,ocds-9t57fa-59571,ocds-9t57fa-59571-2023-07-07T00:00:00Z
1066,EX 13/2023,2023-07-20T18:38:00Z,"The renewal of the  biometric fingerprint and ID verification services on a “month to month” from Afiswitch (Pty) Ltd. The deviation is for a period of 5 years from 1 Jan 2024 to 31 December 2028.
The reason for the “month to month” renewal for a period of 5 years is because:
- SAPS has not yet issued a tender for a new service provider to have sole access to the SAPS criminal database
- the “month to month” renewal will allow SARS flexibility to transition to the new service provider at the time when SAPS awards the tender (the timing thereof is unknown at the date of this request)",active,13922,2582849,ZAR,2028-12-31T00:00:00Z,2024-01-01T00:00:00Z,2028-12-31T00:00:00Z,1826,ocds-9t57fa-60821,ocds-9t57fa-60821-2023-07-14T00:00:00Z
3714,SCMU5-23/24-0064,2025-08-20T14:52:48Z,TERM CONTRACTS FOR ELECTRICAL MAINTENANCE AND REPAIRS TO VARIOUS GOVERNMENT BUILDINGS IN JOE GQABI REGION FOR A PERIOD OF TWO (2) YEARS,active,53173,3000000,ZAR,2026-04-10T00:00:00Z,2024-04-11T00:00:00Z,2026-04-10T00:00:00Z,729,ocds-9t57fa-60998,ocds-9t57fa-60998-2023-07-21T00:00:00Z
3712,SCMU5-23/24-0063,2025-08-20T14:29:07Z,TERM CONTRACT FOR HVAC MAINTENANCE AND REPAIRS AT VARIOUS GOVERNMENT BUILDINGS IN JOE GQABI REGION FOR A PERIOD OF TWO (2) YEARS.,active,53172,4350000,ZAR,2026-04-10T00:00:00Z,2024-04-11T00:00:00Z,2026-04-10T00:00:00Z,729,ocds-9t57fa-61003,ocds-9t57fa-61003-2023-07-21T00:00:00Z
1781,CON0026/2023/24,2024-04-30T16:40:16Z,THE APPOINTMENT OF A SERVICE PROVIDER TO PROVIDE NERSA WITH ONLINE LEGAL PUBLICATIONS FOR A PERIOD OF THREE (3) YEARS.,active,18355,864801,ZAR,2027-03-31T00:00:00Z,2024-04-01T00:00:00Z,2027-03-31T00:00:00Z,1094,ocds-9t57fa-61025,ocds-9t57fa-61025-2023-07-21T00:00:00Z
3723,SCMU5-23/24-0044,2025-08-21T15:03:49Z,"BID FOR THE APPOINTMENT OF SERVICE PROVIDER FOR
SUPPLY AND DELIVERY OF 120 LAPTOPS AS PER
SPECIFICATION",active,53223,1890462,ZAR,0001-01-01T00:00:00Z,0001-01-01T00:00:00Z,0001-01-01T00:00:00Z,0,ocds-9t57fa-64013,ocds-9t57fa-64013-2023-08-18T00:00:00Z
3631,SCMU10-23/24-0012,2025-08-05T13:53:22Z,PROVISION OF PROFESSIONAL SECURITY SERVICES FOR A PERIOD OF TWENTY-FOUR (24) FOR COFFEE BAY TO ZITHULELE PROJECT,active,29211,9772887,ZAR,2026-02-28T00:00:00Z,2024-03-01T00:00:00Z,2026-02-28T00:00:00Z,729,ocds-9t57fa-64108,ocds-9t57fa-64108-2023-08-18T00:00:00Z
1842,T/ING/026/2023,2024-05-17T11:15:39Z,"Tender T/ING/026/2023 - Construction of New Pacaltsdorp (East) Reservoir, Water Tower, Pumpstation and Associated Works",active,28379,59995821,ZAR,2026-03-10T00:00:00Z,2024-03-11T00:00:00Z,2026-03-10T00:00:00Z,729,ocds-9t57fa-64209,ocds-9t57fa-64209-2023-08-24T00:00:00Z
3005,SCMU5-23/24-0072,2025-02-06T11:28:07Z,"MADWALENI HOSPITAL: UPGRADING & 
RENOVATIONS",active,42757,560086375,ZAR,2028-05-15T00:00:00Z,2024-05-16T00:00:00Z,2028-05-15T00:00:00Z,1460,ocds-9t57fa-64793,ocds-9t57fa-64793-2023-08-25T00:00:00Z
1554,E7/2023/2024,2024-03-12T08:22:39Z,SUPPLY AND DELIVERY OF THE FREE STATE DEPARTMENT OF EDUCATION INTERMEDIATE PHASE (GRADE 4-7) NATURAL SCIENCES AND TECHNOLOGY MOBILE LABORATORY,active,21217,11791077,ZAR,2026-12-04T00:00:00Z,2023-12-04T00:00:00Z,2026-12-04T00:00:00Z,1096,ocds-9t57fa-64806,ocds-9t57fa-64806-2023-08-25T00:00:00Z
1190,OR-014158,2023-09-17T12:38:36Z,Online Newspaper subscription,active,16071,625019,ZAR,2025-03-31T00:00:00Z,2023-04-01T00:00:00Z,2025-03-31T00:00:00Z,730,ocds-9t57fa-66034,ocds-9t57fa-66034-2023-03-03T00:00:00Z
2107,SCMU3-23/24-0398-HO,2024-08-12T09:10:20Z,"Dora Nginza Hospital - Improvements to existing buildings - Phase 1 Upgrades and Additions to Security and Fencing Infrastructure, and related buildings ",active,32057,32859086,ZAR,2025-07-04T00:00:00Z,2024-07-05T00:00:00Z,2025-07-04T00:00:00Z,364,ocds-9t57fa-66467,ocds-9t57fa-66467-2023-09-08T00:00:00Z
2013,DSDP30/23,2024-07-19T11:36:00Z,Supply and delivery of food parcels to destitute individuals and families in Sekhukhune and Waterberg Districts of the Limpopo Province for a period of thirty-six (36) months,active,31098,12842800,ZAR,2027-06-30T00:00:00Z,2024-07-01T00:00:00Z,2027-06-30T00:00:00Z,1094,ocds-9t57fa-67498,ocds-9t57fa-67498-2023-09-15T00:00:00Z
