id,title,format,language,description,dateModified,documentType,datePublished,main_ocid,main_id,contracts_id
ab7ead6a-1c23-4749-a36f-3c8c40cd75db.pdf,SLA RRN.pdf,pdf,en,"Appointment of service provider (s) for rendering of the secure transportation of High security Examination and Assessment material from Provincial office or dispatch premises to and from all Educational District offices, Nodal points and all marking centers",0001-01-01T00:00:00Z,pdf,2025-02-05T15:15:28Z,ocds-9t57fa-77670,ocds-9t57fa-77670-2023-12-19T00:00:00Z,3001
15b7ddcc-3128-4e26-85a1-86cf6c261947.pdf,Purchaseorder (1).pdf,pdf,en,Procurement Sharegate Standard Software Subscription,0001-01-01T00:00:00Z,pdf,2023-04-25T06:30:40Z,ocds-9t57fa-52712,ocds-9t57fa-52712-2023-02-10T00:00:00Z,949
f1121088-3ae6-45d5-ab04-9d360f620a39.pdf,0050 Ima Nathi.pdf,pdf,en,SUPPLY AND INSTALL SOLAR SYSTEM IN MALUTI OFFICE COMPLEX AT ALFRED NZO ,0001-01-01T00:00:00Z,pdf,2025-08-19T08:27:25Z,ocds-9t57fa-60994,ocds-9t57fa-60994-2023-07-21T00:00:00Z,3699
7a8747ab-df96-4d71-93c6-ede08f74c2fc.pdf,3100034195 Ammunition.pdf,pdf,en,ammunition,0001-01-01T00:00:00Z,pdf,2023-08-29T07:04:55Z,ocds-9t57fa-64222,ocds-9t57fa-64222-2023-07-07T00:00:00Z,1148
625e4f32-fdd2-4552-852f-7eb286ff3efe.pdf,Eyethu 0073.pdf,pdf,en,"TAYLOR BEQUEST HOSPITAL, MOUNT FLETCHER REFURBISHMENT, REPAIRS, AND UPGRADES TO WATER & WASTEWATER TREATMENT WORKS",0001-01-01T00:00:00Z,pdf,2025-02-06T10:53:14Z,ocds-9t57fa-68151,ocds-9t57fa-68151-2023-09-22T00:00:00Z,3003
8978e395-ed3c-4cad-9685-ee4a8bd00036.pdf,DTP01599.pdf,pdf,en,Appointment of a service provider for an Integrated Document and Records Management System (IDRMS); including maintenance and support for a period of three (3) years,0001-01-01T00:00:00Z,pdf,2025-01-08T12:04:12Z,ocds-9t57fa-68729,ocds-9t57fa-68729-2023-09-29T00:00:00Z,2875
b61710fd-a2c7-4624-8ae7-6bbbe54728df.pdf,ECDC CLUSTER F1 CONTRACT DOCUMENT- Transtruct.pdf,pdf,en,"Refurbishment of ECDC properties in Butterworth, Cluster F1
EVALUATION CRITERIA: THREE PHASES
PHASE1: LOCAL CONTENT AND PRODUCTION
PHASE2: FUNCTIONALITY
PHASE3: PREFERENTIAL PROCUREMENT POINTS",0001-01-01T00:00:00Z,pdf,2024-07-24T14:44:48Z,ocds-9t57fa-69554,ocds-9t57fa-69554-2023-10-06T00:00:00Z,2054
1a2165f6-17fe-4049-9f7f-86c123ebd151.pdf,Purchase Order #58517.pdf,pdf,en,Municipal PMS Training,0001-01-01T00:00:00Z,pdf,2023-10-12T18:06:36Z,ocds-9t57fa-69572,ocds-9t57fa-69572-2023-07-07T00:00:00Z,1278
cf4cbac3-b125-467f-9eb2-15e807e6628b.pdf,Final Contract - ENG018 of 2023.pdf,pdf,en,"ENG 018 OF 2023 : SUPPLY AND DELIVERY OF A NEW FIBRE OPTIC FUSION SPLICER KIT
",0001-01-01T00:00:00Z,pdf,2023-12-19T08:45:24Z,ocds-9t57fa-69613,ocds-9t57fa-69613-2023-10-06T00:00:00Z,1440
952f275e-5130-4d05-b98b-9d8b9129d8b7.pdf,Purchaseorder ROR Aircon.pdf,pdf,en,RFX6000022608 SUPPLY NEW AIRCON: PRETORIA,0001-01-01T00:00:00Z,pdf,2023-10-11T13:14:41Z,ocds-9t57fa-70043,ocds-9t57fa-70043-2023-07-07T00:00:00Z,1259
240db78f-5f03-493c-b6e7-0c6cbf9b999c.pdf,Signed SLA - MR6 Security Services uMkhanyakude District Office for 36 Months.pdf,pdf,en,"APPOINTMENT OF A SERVICE PROVIDER TO RENDER 24 HOUR SECURITY GUARDING SERVICES FOR THE KZN DEPARTMENT OF HUMAN SETTLEMENTS AT UMKHANYAKUDE DISTRICT OFFICE, JOZINI, FOR A PERIOD OF 36 MONTHS.",0001-01-01T00:00:00Z,pdf,2024-09-09T08:11:01Z,ocds-9t57fa-71646,ocds-9t57fa-71646-2023-10-27T00:00:00Z,2204
93db53c1-cfda-40ea-8247-afc17c980fd2.zip,1Z 26049.zip,zip,en,Appointment of a suitable service provider to undertake a Learnership Programme in Film and Television Production Operations NQF Level 4 (SAQA ID: 61450) for 20 learners for a period of 18 months,0001-01-01T00:00:00Z,zip,2024-10-08T11:24:44Z,ocds-9t57fa-73486,ocds-9t57fa-73486-2023-11-10T00:00:00Z,2378
541139b1-ddea-4563-b952-6960bf89d0b3.pdf,7E-23406 FULLY SIGNED REPORT.pdf,pdf,en,Request for Proposals for the leasing of a property situated on Erf 12281 Durban as depicted on SJ Plan No. 4805/9 measuring 81m² for commercial purposes for a period of nine years and eleven months with no right of renewal,0001-01-01T00:00:00Z,pdf,2024-10-16T09:55:20Z,ocds-9t57fa-73514,ocds-9t57fa-73514-2023-11-10T00:00:00Z,2442
825ad3b1-89ac-4e0b-b3b0-64aece03590c.pdf,PO 3600030314.pdf,pdf,en,"RFX: 6000022877 DAY TO DAY MAINTENANCE, PoE MPUMALANGA",0001-01-01T00:00:00Z,pdf,2023-11-16T15:03:27Z,ocds-9t57fa-74288,ocds-9t57fa-74288-2023-07-28T00:00:00Z,1356
77cf6591-d5e5-40db-93e4-843d424c208b.pdf,Contract & Award 0096.pdf,pdf,en,"CONSTRUCTION OF
UPPER CORANA SENIOR SECONDARY SCHOOL, LIBODE – PHASE 1",0001-01-01T00:00:00Z,pdf,2025-01-28T11:03:05Z,ocds-9t57fa-75365,ocds-9t57fa-75365-2023-11-24T00:00:00Z,2950
fcd70cd6-c74d-467a-a9bd-9e313aded9cb.pdf,D2D Electrical PLK GYN LBK PO.pdf,pdf,en,Day to day Maintenance of Giyani & Sibasa Offices,0001-01-01T00:00:00Z,pdf,2024-01-26T09:05:51Z,ocds-9t57fa-79151,ocds-9t57fa-79151-2023-11-10T00:00:00Z,1468
7d54e2c1-9cd6-400a-9af3-df1caca3c125.pdf,G0182618 SITA.pdf,pdf,en,RENEWAL OF EXINDA LICENSES FOR A PEERIOD OF THREE YEARS,0001-01-01T00:00:00Z,pdf,2025-03-12T10:33:02Z,ocds-9t57fa-117294,ocds-9t57fa-117294-2023-10-13T00:00:00Z,3172
13e2bcf8-1023-45f7-9114-08816080e1eb.pdf,SCMU-23-24-0007.pdf,pdf,en,"BID FOR THE APPOINTMENT OF SERVICE PROVIDER TO DEVELOP, MAINTAIN AND SUPPORT AN ELECTRONIC CONTRACTS MANAGEMENT SOLUTION FOR DPWI AS PER SPECIFICATION FOR A PERIOD OF 36 MONTHS ",0001-01-01T00:00:00Z,pdf,2025-08-21T14:11:47Z,ocds-9t57fa-61666,ocds-9t57fa-61666-2023-07-28T00:00:00Z,3720
9ab9eb99-6afd-4bcc-8ed1-bde6dce0670d.pdf,1M-25463.pdf,pdf,en,Maintenance repairs to roads and stormwater infrastructure as and when required in the ABM areas located within the South Region of eThekwini Municipality for a period of 24 months,0001-01-01T00:00:00Z,pdf,2024-10-02T10:51:46Z,ocds-9t57fa-64759,ocds-9t57fa-64759-2023-08-25T00:00:00Z,2325
c13dbb70-0aa9-438e-890d-b30ba0c03f1e.pdf,Purchaseorder.pdf,pdf,en,"Supply and deliver Operator Ergonomic Chairs, Doringkloof",0001-01-01T00:00:00Z,pdf,2023-08-25T09:03:36Z,ocds-9t57fa-64785,ocds-9t57fa-64785-2023-08-11T00:00:00Z,1138
9fe6ba67-de87-497a-b464-569f80d6f83f.pdf,SCM11-2023-24 REVISED CAPE AGULHAS CIVILS FINAL LETTER.pdf,pdf,en,PIPE WORK ASSOCIATED WITH NEW FUTURE L’AGULHAS RESERVOIR,0001-01-01T00:00:00Z,pdf,2024-01-12T12:51:45Z,ocds-9t57fa-66466,ocds-9t57fa-66466-2023-09-08T00:00:00Z,1448
0136cdbc-40fc-4519-8a69-a494436b1ee2.pdf,1H-24659 FULLY SIGNED REPORT.pdf,pdf,en,Provision of engineering services for the Pilgram X Housing Project,0001-01-01T00:00:00Z,pdf,2024-11-05T10:25:05Z,ocds-9t57fa-67981,ocds-9t57fa-67981-2023-09-22T00:00:00Z,2534
f8caabae-9376-4f4d-8562-164919f3568d.pdf,16. Letter of Appointment - Versatile Interiors.pdf,pdf,en,APPOINTMENT OF A SERVICE PROVIDER TO SUPPLY AND DELIVER FURNITURE FOR THE NEW OFFICES ,0001-01-01T00:00:00Z,pdf,2024-06-26T10:00:27Z,ocds-9t57fa-68149,ocds-9t57fa-68149-2023-09-22T00:00:00Z,1939
ff77502b-b0eb-46fa-89d5-825d9ae9b9c3.pdf,1C-22976 FULLY SIGNED REPORT.pdf,pdf,en,Supply and delivery of ammunition for eThekwini Metro Police Services,0001-01-01T00:00:00Z,pdf,2024-06-18T13:25:06Z,ocds-9t57fa-69431,ocds-9t57fa-69431-2023-10-06T00:00:00Z,1922
760b364c-5e20-49da-8e0b-8ea3727f353b.pdf,REFEDI SLA20240821.pdf,pdf,en,"Appointment of a service providers for back-office software contravention system for Rustenburg Traffic Department for a period of 3 years
",2024-08-22T13:49:33Z,pdf,2024-08-22T13:25:39Z,ocds-9t57fa-74612,ocds-9t57fa-74612-2023-11-18T00:00:00Z,2143
c360520c-b899-412a-97a7-020f0d570ece.pdf,3100034739.pdf,pdf,en,Supply and deliver of Pro cards,0001-01-01T00:00:00Z,pdf,2023-12-13T14:14:08Z,ocds-9t57fa-77216,ocds-9t57fa-77216-2023-09-29T00:00:00Z,1438
dc7cb759-2c54-4fe6-8a3c-d8c4ebc6ab03.pdf,PSX HOLDINGS PTY LTD.pdf,pdf,en,Appointment of Service Provider for Cleaning Services at EDTEA ILembe District Office,0001-01-01T00:00:00Z,pdf,2024-02-14T10:18:34Z,ocds-9t57fa-80266,ocds-9t57fa-80266-2023-10-28T00:00:00Z,1521
672fd5e8-b352-4666-af16-3d99517f2ea0.pdf,DHS 33-2022- M CIVILS.pdf,pdf,en,"Construction & Installation of Bulk Infrastructure of Water, Sewer and Treatment Plant (Deemed to include all extra overs) at Kanana ext.15, Connecting Kanana Ext 16: Jouberton South Side, Ext 34 and Kanana Estate and Design and Install 2302 Services for Internal Reticulation (Sewer, Water, Storm Water and Roads) at Kanana Ext .16 on Portions 100 of the Farm Nooitgedacht 434: Matlosana Local Municipality",0001-01-01T00:00:00Z,pdf,2026-02-05T18:38:27Z,ocds-9t57fa-141726,ocds-9t57fa-141726-2023-03-10T00:00:00Z,4317
aaf74349-b72f-4f8c-b0d5-b69109e9d2a3.pdf,Appointment letter DARD 15-2023.pdf,pdf,en,Appointment of a catering company to provide fixed-price catering for Owen Sithole College for a period of thirty-six (36) months,0001-01-01T00:00:00Z,pdf,2024-08-22T21:42:54Z,ocds-9t57fa-64570,ocds-9t57fa-64570-2023-08-24T00:00:00Z,2154
f7acd6a9-130a-4285-a2fe-b01b6425aa1b.pdf,Siyejabula uMzinyathi.pdf,pdf,en,"APPOINTMENT OF THE SUITABLE SERVICE PROVIDER TO 
PROVIDE PHYSICAL SECURITY SERVICES AT KZN DEPARTMENT OF ECONOMIC DEVELOPMENT, TOURISM AND ENVIRONMENTAL AFFAIRS (EDTEA): MINISTRY, MKUZE, UMZINYATHI AND AMAJUBA DISTRICT OFFICES AND BULK BUYING OFFICES FOR THE PERIOD OF 36 MONTHS.",0001-01-01T00:00:00Z,pdf,2024-07-23T10:55:44Z,ocds-9t57fa-64647,ocds-9t57fa-64647-2023-08-24T00:00:00Z,2020
68bed8f5-a0db-4fd3-a966-df59da353975.pdf,Pee 4 Eem Awarding Letter.pdf,pdf,en,"Construction of Boreholes Project for Impendle, Mpofana and uMshwathi Local Municipalities",0001-01-01T00:00:00Z,pdf,2024-09-10T16:27:13Z,ocds-9t57fa-46897,ocds-9t57fa-46897-2023-02-17T00:00:00Z,2209
849c4db7-d62f-4521-8fa9-09f5c8770786.pdf,Siphumelele.pdf,pdf,en,"RENDERING OF CLEANING,CAR WASH & GARDEN SERVICES AT THE PIXLEY KA SEME DISTRICT,FOR A PERIOD OF 36 MONTHS",0001-01-01T00:00:00Z,pdf,2026-03-27T12:32:36Z,ocds-9t57fa-50116,ocds-9t57fa-50116-2023-03-24T00:00:00Z,4821
9b464d8e-814d-455b-81da-27f84794fbcc.pdf,1. CDC-87-23 LETTER OF APPOINTMENT - MAKHATHINI.pdf,pdf,en,"UPGRADE AND ADDITIONS AT KHANYISANI PRIMARY SCHOOL IN ETHEKWINI METRO, KWAZULU-NATA - 7GB OR HIGHER",0001-01-01T00:00:00Z,pdf,2026-03-26T10:33:17Z,ocds-9t57fa-52512,ocds-9t57fa-52512-2023-04-21T00:00:00Z,4781
6b609990-065a-4cec-a23d-71f19f7bdc61.pdf,Southhill Trading MerSeta - SLA.pdf,pdf,en,Request for proposal to appoint a capable service provider for the overall administration and project management of the Northern Cape Provincial Government Skills Development Project,0001-01-01T00:00:00Z,pdf,2026-02-18T10:46:42Z,ocds-9t57fa-52856,ocds-9t57fa-52856-2023-04-28T00:00:00Z,4438
d23ca2fc-8fb1-435d-a704-64d8718ee491.zip,1R 23758.zip,zip,en,Flood damage remediation – Coedmore Road and bridge construction: Wards 64 & 65,0001-01-01T00:00:00Z,zip,2024-04-26T15:05:23Z,ocds-9t57fa-56043,ocds-9t57fa-56043-2023-06-02T00:00:00Z,1760
bc401098-41c3-4766-86a5-43357d5a17e6.pdf,SLA Annexure A - Final Award TING002 of 2023.pdf,pdf,en,"Tender T/ING/002/2023 - Appointment of a Service Provider for the Supply, Repair and Maintenance of Camera Units for the Go George Bus Fleet for a period of two (2) years",0001-01-01T00:00:00Z,pdf,2023-10-26T16:03:56Z,ocds-9t57fa-56198,ocds-9t57fa-56198-2023-06-02T00:00:00Z,1316
c539e3a6-9c84-4c68-8a35-6f9711f38dc8.pdf,SLA DOCS AND DESIGNA ADS JV.pdf,pdf,en,Supply and delivery of promotional material to the Eastern Cape Department of Community Safety over a period of three(03) years,0001-01-01T00:00:00Z,pdf,2024-11-12T09:42:11Z,ocds-9t57fa-58986,ocds-9t57fa-58986-2023-06-30T00:00:00Z,2591
e2a1283f-fd7d-4224-a787-879cb5772a2b.pdf,Signed SLA Contract - TETA23-RESEARCH-0002-IMPACT - ZAPPARRATA GERING CC TRADING AS MICHAEL GERING AND ASSOCIATES.pdf,pdf,en,REQUEST FOR PROPOSALS FROM SERVICE PROVIDERS TO CONDUCT A COMPREHENSIVE STUDY ON THE IMPACT OF 4IR ON JOB SECURITY/LOSSES IN THE TRANSPORT SECTOR.,0001-01-01T00:00:00Z,pdf,2024-04-11T15:15:12Z,ocds-9t57fa-59501,ocds-9t57fa-59501-2023-07-07T00:00:00Z,1732
7f648fb9-5f0c-4656-8421-6b14aae9c4bf.pdf,CONTRACT - LMN 01-2023.pdf,pdf,en,"Supply , Delivery, Installation and Commissioning of Bakery Machinery , Equipment and Accessories: Standerton Correctional Centre :Department of Correctional Services : LMN Region",0001-01-01T00:00:00Z,pdf,2023-09-28T12:02:38Z,ocds-9t57fa-60223,ocds-9t57fa-60223-2023-07-14T00:00:00Z,1227
5ae94c97-97ad-4f1a-83e0-29b12debbfc7.pdf,NDOH 09 2023-24 HST Appointment Letter (1).pdf,pdf,en,Invitation for call for proposals to non-governmental organizations (NGO's) for health system's research grant for a period of three (03) years.,0001-01-01T00:00:00Z,pdf,2026-02-10T15:56:00Z,ocds-9t57fa-60271,ocds-9t57fa-60271-2023-07-14T00:00:00Z,4381
5a1a25d2-d3cf-4e96-9344-b689681b0b61.pdf,LINDINO TRADING CC TA NUWCOM WIRESESS.pdf,pdf,en,"Request for proposals to appoint a capable service provider for the supply, installation and maintenance of a DECT multi-cell VOIP telephone solution at the DSC Building for the Office of the Premier: Northern Cape",0001-01-01T00:00:00Z,pdf,2026-02-23T15:05:15Z,ocds-9t57fa-61631,ocds-9t57fa-61631-2023-07-28T00:00:00Z,4468
da7d6472-d89e-42c5-b7c1-0ca943fd3006.pdf,Original Contract.pdf,pdf,en,"Appointment of a Professional Service Provider to Under-take pre-Accreditation Support, Compliance Assessment and capacity support for the accreditation of eight (8) Municipalities in North -West Province to perform housing functions.",0001-01-01T00:00:00Z,pdf,2025-09-08T11:16:54Z,ocds-9t57fa-61705,ocds-9t57fa-61705-2023-07-28T00:00:00Z,3770
e39b689e-501b-414c-9558-44b02667bee6.pdf,RFP 29 2023 NBAC submission - Provision of Regulatory Compliance Management Software Tool-Approved.pdf,pdf,en,APPOINTMENT OF A SERVICE PROVIDER FOR THE PROVISION OF REGULATORY COMPLIANCE MANAGEMENT SOFTWARE TOOL,0001-01-01T00:00:00Z,pdf,2024-02-11T19:12:11Z,ocds-9t57fa-63220,ocds-9t57fa-63220-2023-08-11T00:00:00Z,1518
d0474c50-f953-46dd-8738-6b8f6579c7ba.pdf,23 24 0048.pdf,pdf,en,"BID FOR THE APPOINTMENT OF A SERVICE PROVIDER(S) TO PROVIDE
SECURITY SERVICES FOR HEAD OFFICE CLUSTERS FOR A PERIOD OF
36 MONTHS",0001-01-01T00:00:00Z,pdf,2025-10-29T16:36:05Z,ocds-9t57fa-64015,ocds-9t57fa-64015-2023-08-18T00:00:00Z,3918
6b283c25-9f3a-469a-a930-d6187470fcd9.pdf,Final Contract Acceptance TING025 of 2023.pdf,pdf,en,Tender T/ING/025/2023 - Construction of 40Ml Raw Water Balancing Dam and Associated Works,0001-01-01T00:00:00Z,pdf,2024-05-17T11:05:59Z,ocds-9t57fa-64203,ocds-9t57fa-64203-2023-08-24T00:00:00Z,1841
da34bc53-64cb-4be5-86b6-3f80887bfb0b.pdf,COMPASS WASTE ADDENDUM SIGNED.pdf,pdf,en,"The bid calls for supply of containers (consumables) and the safe and effective handling of HCRW through appropriate segregation, packaging, carting (collection), storage, loading, transportation, treatment and safe disposal of health care risk waste/medical waste from the Eastern Cape hospitals and waste generated from PHC Facilities, Nursing Colleges, EMS, Forensic Pathology Laboratories, and pharmaceutical depots for a period of 36 months.",0001-01-01T00:00:00Z,pdf,2025-02-12T15:11:02Z,ocds-9t57fa-64857,ocds-9t57fa-64857-2023-08-25T00:00:00Z,3061
aeef5e23-017f-4714-8c64-731be0768204.pdf,Nambiti Contract 2024.pdf,pdf,en,PROVISION OF TREND MICRO DEEP DISCOVERY INSPECTOR LICENCE RENEWAL FOR A PERIOD OF THREE (3) YEARS.,0001-01-01T00:00:00Z,pdf,2026-04-17T13:05:56Z,ocds-9t57fa-65667,ocds-9t57fa-65667-2023-09-01T00:00:00Z,5038
531cfdae-1b38-4e4f-adab-16f55e98d1b4.pdf,1.  CDC-444-23 -  LETTER OF APPOINTMENT.pdf,pdf,en,"REPAIRS AND RENOVATIONS AT DOON HEIGHTS PRIMARY SCHOOL IN UMLAZI DISTRICT, KWAZULU-NATAL - 7 GB OR HIGHER",0001-01-01T00:00:00Z,pdf,2026-03-24T10:16:58Z,ocds-9t57fa-65723,ocds-9t57fa-65723-2023-09-01T00:00:00Z,4714
5a486781-9171-44fc-99a3-7f54a6e9a5d4.pdf,DTP01572 - SeaCliffe Trading CC.pdf,pdf,en,"Appointment of a service provider to supply and replace parts in heating, ventilation, air conditioning and cooling major equipment at Dube TradePort for a three-year period",0001-01-01T00:00:00Z,pdf,2025-11-21T16:46:57Z,ocds-9t57fa-67188,ocds-9t57fa-67188-2023-09-14T00:00:00Z,4052
7d302da0-c6ae-46eb-a01a-dc95ff8c7780.pdf,LETTER OF APPOINTMENT - CDC-309-23 - HDM CONSTRUCTION.pdf,pdf,en,"CONSTRUCTION OF ADDITIONS, RENOVATIONS, TEMPORARY STRUCTURES AND DEMOLITIONS OF INAPPROPRIATE STRUCTURES AT ZANEWONGA SENIOR SECONDARY SCHOOL (SSS) ",0001-01-01T00:00:00Z,pdf,2026-04-14T15:45:21Z,ocds-9t57fa-68047,ocds-9t57fa-68047-2023-09-22T00:00:00Z,4993
ac8ff112-7380-4e83-8b68-56c3c67c2ac3.zip,WS 7598.zip,zip,en,Supply and delivery of mapping grade handheld GNSS survey devices,0001-01-01T00:00:00Z,zip,2024-06-15T11:02:28Z,ocds-9t57fa-68103,ocds-9t57fa-68103-2023-09-22T00:00:00Z,1891
0cfbd8c9-f658-45e9-8479-64455ee312c4.zip,WS 7598.zip,zip,en,Supply and delivery of mapping grade handheld GNSS survey devices,0001-01-01T00:00:00Z,zip,2024-06-16T12:15:16Z,ocds-9t57fa-68103,ocds-9t57fa-68103-2023-09-22T00:00:00Z,1906
5c052ab5-1018-481f-b6dc-698b60eafc9d.pdf,0491 signed loa.pdf,pdf,en,Schedule maintenance of generators at cluster three (3)– Buffalo City Metro & Amathole District – health facilities.,0001-01-01T00:00:00Z,pdf,2026-03-12T16:04:41Z,ocds-9t57fa-68911,ocds-9t57fa-68911-2023-09-29T00:00:00Z,4591
3bab5d2b-9091-4f83-b71d-cbd40be382b2.pdf,DTP01529 - Afrocentric Intellectual Property.pdf,pdf,en,"Appointment of a service provider for the provision of ICT Security and Cybersecurity services, Trend Micro and Mimecast licenses and support for DTPC for a period of three (3) years",0001-01-01T00:00:00Z,pdf,2025-11-21T16:42:10Z,ocds-9t57fa-69659,ocds-9t57fa-69659-2023-10-06T00:00:00Z,4051
bee7b333-83fb-4e2b-b2ae-ba9262c89c0a.pdf,PWR 78-23 GosegoM Enterprise PTY LTD.pdf,pdf,en,Leasing of office space (Existing Building) measuring 1022m² with 19 covered parking bays through open tender on behalf of the Department of Social Development (Kagisano Molopo Service Point) in Ganyesa for a period of 36 months.,0001-01-01T00:00:00Z,pdf,2026-02-26T15:04:45Z,ocds-9t57fa-73551,ocds-9t57fa-73551-2023-11-10T00:00:00Z,4496
0e30e80e-4a6f-4c27-9552-3341752dec8d.pdf,CDC-478-23 - KONTINENTAL ENGINEERING  - APPOINTMENT LETTER.pdf,pdf,en,CONTRACT DESCRIPTION: DEVELOPMENT AND CONSTRUCTION SOLUTION FOR MPUMELELO TECHNICAL HIGH SCHOOL IN KWAZULU-NATAL,0001-01-01T00:00:00Z,pdf,2026-04-10T12:34:53Z,ocds-9t57fa-74379,ocds-9t57fa-74379-2023-11-17T00:00:00Z,4966
39c042b2-2f18-4be1-9800-a78db02d30ca.pdf,0633 LOA.pdf,pdf,en,"SCHEDULE MAINTENANCE OFLAUNDRY& ASSOCIATED EQUIPMENT AT CLUSTER TWO (2) – CHRIS
HANI AND JOE GQABI DISTRICT – HEALTH FACILITIES (36 MONTHS)
",0001-01-01T00:00:00Z,pdf,2026-03-12T15:41:17Z,ocds-9t57fa-74611,ocds-9t57fa-74611-2023-11-18T00:00:00Z,4586
4491bb57-d52c-452e-aa1d-1dc9f477e3e9.zip,WS 7781.zip,zip,en,"Refurbishment and commissioning of 
Blackburn Reservoir and minor auxiliary 
works to existing bulk infrastructure: Ward 8, 
35 and 102",0001-01-01T00:00:00Z,zip,2024-09-12T14:21:00Z,ocds-9t57fa-77660,ocds-9t57fa-77660-2023-12-19T00:00:00Z,2244
1314cc48-6ad5-47ae-a5e4-6d73d8b622c4.pdf,1H-23573 FULLY SIGNED REPORT.pdf,pdf,en,"Construction of 96 new units at Dalton 
Community Residential Units (CRU), Tender 2 
(2 of 2: Blocks C and D)
",0001-01-01T00:00:00Z,pdf,2024-10-15T15:17:41Z,ocds-9t57fa-77596,ocds-9t57fa-77596-2023-12-18T00:00:00Z,2441
d37fbc1c-653d-40c3-800c-00b698768234.pdf,APPLICATION FOR AWARD.pdf,pdf,en,LED Light Bulbs @ Ulundi,0001-01-01T00:00:00Z,pdf,2024-09-19T15:49:15Z,ocds-9t57fa-102239,ocds-9t57fa-102239-2023-06-15T00:00:00Z,2295
669cc525-f9b9-449e-a6d6-0deb74961307.pdf,SITA 1416991.pdf,pdf,en,ANNEXURE I: OPTIONAL HOSTING SERVICES,0001-01-01T00:00:00Z,pdf,2025-03-22T19:31:12Z,ocds-9t57fa-118234,ocds-9t57fa-118234-2023-01-05T00:00:00Z,3230
7de017d7-0f63-4d3a-8ef0-060486214e58.pdf,PO# 55687-signed.pdf,pdf,en,SUPPLY OF UNIFLEX UNIBIND COVERS,0001-01-01T00:00:00Z,pdf,2023-03-02T08:27:53Z,ocds-9t57fa-47868,ocds-9t57fa-47868-2023-02-17T00:00:00Z,807
d20db72e-95ba-4b4b-94af-48bc9ba0103c.pdf,3100032813.pdf,pdf,en,Computer consumables,0001-01-01T00:00:00Z,pdf,2023-03-30T15:23:48Z,ocds-9t57fa-50835,ocds-9t57fa-50835-2023-01-19T00:00:00Z,858
8c38fc02-469f-492a-b0f2-c3735201f388.pdf,Full Contract BA028 of 2023q.pdf,pdf,en,SUPPLY AND DELVERY OF FURNITURE AT TOUWSRANTEN LIBRARY,0001-01-01T00:00:00Z,pdf,2023-07-03T14:41:05Z,ocds-9t57fa-54077,ocds-9t57fa-54077-2023-05-12T00:00:00Z,1045
13f0208a-7911-4bad-99c8-28fe0482b514.pdf,SKM_301i25073010270 (3).pdf,pdf,en,"APPOINTMENT OF CIVIL ENGINEERING CONTRACTOR FOR THE UPGRADING OF ROAD DR08125 FROM N2 TO SIPETU HOSPITAL, BETWEEN KM 10 AND KM 24 (14KM) PHASE 4A",0001-01-01T00:00:00Z,pdf,2025-07-30T10:43:04Z,ocds-9t57fa-54117,ocds-9t57fa-54117-2023-05-12T00:00:00Z,3609
4a087130-32d6-473c-8b9c-49b2e982f880.pdf,CYA Systems SCMU1023240006 AGL Mthatha Airport.pdf,pdf,en,THE MAINTENANCE TO AERONAUTICAL GROUND LIGHTING SYSTEM AT MTHATHA AIRPORT FOR A CONTRACT PERIOD OF 36 MONTHS,0001-01-01T00:00:00Z,pdf,2025-07-30T14:59:15Z,ocds-9t57fa-54902,ocds-9t57fa-54902-2023-05-19T00:00:00Z,3617
73e222cc-c434-4a1e-84b6-ed91d721350c.pdf,Signed SLA Contract - TETA23-RESEARCH-0004-BENEFICIARIES - AKWETHU ENGINEERING AND DEVELOPMENT.pdf,pdf,en,REQUEST FOR PROPOSALS FROM SERVICE PROVIDERS TO CONDUCT A TRACER STUDY ON BENEFICIARIES OF TETA-FUNDED LEADERSHIP DEVELOPMENT PROGRAMMES ENROLLED IN THE YEARS 2020 TO 2022.,0001-01-01T00:00:00Z,pdf,2024-04-11T15:11:19Z,ocds-9t57fa-59505,ocds-9t57fa-59505-2023-07-07T00:00:00Z,1729
328f7a7d-93c3-41fc-a131-676266cc6c7b.pdf,Q1-2023-24 ANTOINETTE EVENTS MANAGEMENT CC - TENDER DOCUMENT.pdf,pdf,en,VENUE HIRE & CATERING SERVICES TO HOST STATE OF THE MUNICIPALITY ADDRESS (SOMA),0001-01-01T00:00:00Z,pdf,2023-07-31T13:26:14Z,ocds-9t57fa-59571,ocds-9t57fa-59571-2023-07-07T00:00:00Z,1092
599e6288-53e7-45d3-9c79-9be583c30218.pdf,Signed V3 - Deviation - Afiswitch_LM.pdf,pdf,en,"The renewal of the  biometric fingerprint and ID verification services on a “month to month” from Afiswitch (Pty) Ltd. The deviation is for a period of 5 years from 1 Jan 2024 to 31 December 2028.
The reason for the “month to month” renewal for a period of 5 years is because:
- SAPS has not yet issued a tender for a new service provider to have sole access to the SAPS criminal database
- the “month to month” renewal will allow SARS flexibility to transition to the new service provider at the time when SAPS awards the tender (the timing thereof is unknown at the date of this request)",0001-01-01T00:00:00Z,pdf,2023-07-20T18:38:00Z,ocds-9t57fa-60821,ocds-9t57fa-60821-2023-07-14T00:00:00Z,1066
53a60989-386a-4ab4-b1ae-5a1a5d4fd36d.pdf,SCMU-23-24-0064.pdf,pdf,en,TERM CONTRACTS FOR ELECTRICAL MAINTENANCE AND REPAIRS TO VARIOUS GOVERNMENT BUILDINGS IN JOE GQABI REGION FOR A PERIOD OF TWO (2) YEARS,0001-01-01T00:00:00Z,pdf,2025-08-20T14:52:48Z,ocds-9t57fa-60998,ocds-9t57fa-60998-2023-07-21T00:00:00Z,3714
41f415d1-c427-4652-9a5b-330429c30a7e.pdf,SCMU-23-24-0063.pdf,pdf,en,TERM CONTRACT FOR HVAC MAINTENANCE AND REPAIRS AT VARIOUS GOVERNMENT BUILDINGS IN JOE GQABI REGION FOR A PERIOD OF TWO (2) YEARS.,0001-01-01T00:00:00Z,pdf,2025-08-20T14:29:07Z,ocds-9t57fa-61003,ocds-9t57fa-61003-2023-07-21T00:00:00Z,3712
ed34d769-19ce-4f57-a2a3-caef53481dfa.pdf,LexisNexis (Pty) Ltd - Service Agreement.pdf,pdf,en,THE APPOINTMENT OF A SERVICE PROVIDER TO PROVIDE NERSA WITH ONLINE LEGAL PUBLICATIONS FOR A PERIOD OF THREE (3) YEARS.,0001-01-01T00:00:00Z,pdf,2024-04-30T16:40:16Z,ocds-9t57fa-61025,ocds-9t57fa-61025-2023-07-21T00:00:00Z,1781
56971fcd-77db-41e3-b329-0c5ac0cad33f.pdf,SCMU5-23-24-0044.pdf,pdf,en,"BID FOR THE APPOINTMENT OF SERVICE PROVIDER FOR
SUPPLY AND DELIVERY OF 120 LAPTOPS AS PER
SPECIFICATION",0001-01-01T00:00:00Z,pdf,2025-08-21T15:03:49Z,ocds-9t57fa-64013,ocds-9t57fa-64013-2023-08-18T00:00:00Z,3723
5dd03274-911c-49d9-9046-5d027c6d5cf9.pdf,Whispers Appointment Letter 28.02.2024.pdf,pdf,en,PROVISION OF PROFESSIONAL SECURITY SERVICES FOR A PERIOD OF TWENTY-FOUR (24) FOR COFFEE BAY TO ZITHULELE PROJECT,0001-01-01T00:00:00Z,pdf,2025-08-05T13:53:22Z,ocds-9t57fa-64108,ocds-9t57fa-64108-2023-08-18T00:00:00Z,3631
d82d7f3c-0c04-4078-a127-f1857e5f16d0.pdf,Final Contract & Acceptance - TING026 of 2023.pdf,pdf,en,"Tender T/ING/026/2023 - Construction of New Pacaltsdorp (East) Reservoir, Water Tower, Pumpstation and Associated Works",0001-01-01T00:00:00Z,pdf,2024-05-17T11:15:39Z,ocds-9t57fa-64209,ocds-9t57fa-64209-2023-08-24T00:00:00Z,1842
d2e8d9aa-25be-4861-93cf-72cb0cdc4fec.pdf,GVK 0072.pdf,pdf,en,"MADWALENI HOSPITAL: UPGRADING & 
RENOVATIONS",0001-01-01T00:00:00Z,pdf,2025-02-06T11:28:07Z,ocds-9t57fa-64793,ocds-9t57fa-64793-2023-08-25T00:00:00Z,3005
a7e9546d-1311-4e9a-a703-145911da47eb.pdf,E7-2023-2024 LETTER OF ACCEPTANCE.pdf,pdf,en,SUPPLY AND DELIVERY OF THE FREE STATE DEPARTMENT OF EDUCATION INTERMEDIATE PHASE (GRADE 4-7) NATURAL SCIENCES AND TECHNOLOGY MOBILE LABORATORY,0001-01-01T00:00:00Z,pdf,2024-03-12T08:22:39Z,ocds-9t57fa-64806,ocds-9t57fa-64806-2023-08-25T00:00:00Z,1554
69a45d83-98ed-4630-9b02-9f9e8e30578e.pdf,M2M.pdf,pdf,en,Online Newspaper subscription,0001-01-01T00:00:00Z,pdf,2023-09-17T12:38:36Z,ocds-9t57fa-66034,ocds-9t57fa-66034-2023-03-03T00:00:00Z,1190
5a000524-23d9-4374-bff2-ff5714170202.pdf,DOC045.pdf,pdf,en,"Dora Nginza Hospital - Improvements to existing buildings - Phase 1 Upgrades and Additions to Security and Fencing Infrastructure, and related buildings ",0001-01-01T00:00:00Z,pdf,2024-08-12T09:10:20Z,ocds-9t57fa-66467,ocds-9t57fa-66467-2023-09-08T00:00:00Z,2107
c901a9a5-42f9-422a-a785-5c60a5a06709.pdf,ACCEPTANCE OF OFFER DSDP 30-23 TSHEMOLLO TRADING SEKHUKHUNE AND WATERBERG DISTRICT.pdf,pdf,en,Supply and delivery of food parcels to destitute individuals and families in Sekhukhune and Waterberg Districts of the Limpopo Province for a period of thirty-six (36) months,0001-01-01T00:00:00Z,pdf,2024-07-19T11:36:00Z,ocds-9t57fa-67498,ocds-9t57fa-67498-2023-09-15T00:00:00Z,2013
