id,title,format,language,description,dateModified,documentType,datePublished,main_ocid,main_id,contracts_id
3f44bbf7-4d03-4ca7-9e31-f202d54c2b73.pdf,JBCC 6.2 Principal Building Agreement.pdf,pdf,en,"REFURBISHMENT OF BUILDING, MECHANICAL AND ELECTRICAL INFRASTRUCTURE AT THE DIMBAZA WASTEWATER TREATMENT WORKS –PHASE 1
REQUIRED GRADING 6 GB OR HIGHER
The Evaluation Criteria is as follows:

MANDATORY REQUIREMENT
STAGE 1: LOCAL CONTENT
STAGE 2: FUNCTIONALITY
STAGE 3: PREFERENTIAL PROCUREMENT POINTS
",0001-01-01T00:00:00Z,pdf,2024-07-05T11:32:11Z,ocds-9t57fa-64779,ocds-9t57fa-64779-2023-08-25T00:00:00Z,1963
1d20cfe3-4d62-46ba-b5a9-4253280d2fd5.pdf,ACCEPTANCE OF OFFER DSDP  29-23 J AND R ACCOUNTANTS CAPRICORN DISTRICT.pdf,pdf,en,Supply and delivery of food parcels to destitute individuals and families in Capricorn District of the Limpopo Province for a period of thirty-six (36) months,0001-01-01T00:00:00Z,pdf,2024-07-19T11:39:45Z,ocds-9t57fa-67494,ocds-9t57fa-67494-2023-09-15T00:00:00Z,2014
2220e04d-21e7-4833-b10c-64ecccf6530b.pdf,Purchaseorder Office  Chairs.pdf,pdf,en,"RFX: 6000022934 SUPPLY AND DELIVER OFFICE CHAIRS, BROOKLYN",0001-01-01T00:00:00Z,pdf,2023-09-26T12:33:00Z,ocds-9t57fa-68390,ocds-9t57fa-68390-2023-08-04T00:00:00Z,1203
1259f5b7-4194-4ffa-b00c-4b31ab8b34b8.pdf,Contract - ENG017 of 2023q.pdf,pdf,en,ENG017 OF 2023 :SUPPLY AND DELIVERY OF ARC FLASH SUIT ATPV,0001-01-01T00:00:00Z,pdf,2024-02-26T15:47:41Z,ocds-9t57fa-69607,ocds-9t57fa-69607-2023-10-06T00:00:00Z,1541
07db21e0-ef9d-416d-9a0c-8e791bfdd0fd.pdf,Newspaper Direct SA - PressReader MOA.pdf,pdf,en,"The appointment of a service provider to provide the National Energy Regulator of South Africa (NERSA) with National, international Electronic Newspapers, and Magazines for a period of four (4) years.",0001-01-01T00:00:00Z,pdf,2025-10-28T09:12:34Z,ocds-9t57fa-69656,ocds-9t57fa-69656-2023-10-06T00:00:00Z,3913
fb675311-a958-4a07-a4c2-dcbc92a139a5.pdf,SCM16-2023-24 FIREWIRE SYSTEM SOLUTIONS FINAL LETTER.pdf,pdf,en,"SUPPLY, REPLACE AND SERVICE OF FIRE EXTINGUISHERS S FOR A PERIOD OF 3 YEARS",2024-03-14T11:21:36Z,pdf,2024-03-14T11:18:24Z,ocds-9t57fa-72032,ocds-9t57fa-72032-2023-10-27T00:00:00Z,1571
0c6af7d8-8d9d-4bc3-acbe-4b24e2d40fbe.pdf,SCM21-2023-24 POTTS DEVCO FINAL LETTER.pdf,pdf,en,CONSTRUCTION OF A NEW ABLUTION UNIT AND EXTENTION OF EXISTING PAVILION AT THE GLASKASTEEL IN BREDASDORP,0001-01-01T00:00:00Z,pdf,2024-03-14T11:25:20Z,ocds-9t57fa-73578,ocds-9t57fa-73578-2023-11-10T00:00:00Z,1575
71624428-e31e-4f25-8c9c-4bd77a73684d.pdf,Lebone Litho SLA.pdf,pdf,en,"PROVISIONING OF PROJECT MANAGEMENT SERVICE(S) WHICH SHALL INCLUDE
PROCUREMENT, WAREHOUSING, INVENTORY MANAGEMENT (FURNITURE) AND DELIVERY OF 
BOTH ELECTRONIC AND PAPER LEARNING AND TEACHING SUPPORT MATERIAL (LTSM AND E-
LTSM) FOR A PERIOD OF THREE (3) YEARS WITH AN OPTION TO RENEW THE CONTRACT FOR
A PERIOD NOT LONGER THAN TWO YEARS AT THE DISCRETION OF THE EASTERN CAPE
DEPARTMENT OF EDUCATION “ECDoE” INFORMED BY BUDGET AVAILABILITY, THE NEED
INCLUDING THE PERFORMANCE OF THE SERVICE PROVIDER.
",0001-01-01T00:00:00Z,pdf,2025-10-31T14:41:06Z,ocds-9t57fa-122839,ocds-9t57fa-122839-2023-02-03T00:00:00Z,3951
419f7a19-477a-4256-8bff-87b38b39b53e.pdf,Contract FIN010 of 2023 - Office Furniture for CFO Boardroom.pdf,pdf,en,"SUPPLY AND DELIVERY OFFICE FURNITURE FOR COMMITTEE ROOM, FINANCIAL SERVICES, GEORGE MUNICIPALITY",0001-01-01T00:00:00Z,pdf,2023-06-23T10:47:54Z,ocds-9t57fa-51888,ocds-9t57fa-51888-2023-04-14T00:00:00Z,1028
28252e75-b1f9-418a-b4a0-a9b22b35eedc.pdf,ACCEPTANCE- DIDO SA.pdf,pdf,en,"CALL FOR EXPRESSION OF INTEREST FOR THE ESTABLISHMENT OF A PANEL OF BUILT ENVIRONMENT PROFESSIONAL SERVICE PROVIDERS AND CONTRACTORS FOR THE DESIGN, MANUFACTURE, SUPPLY, DELIVERY, ERECTION, INSTALLATION AND COMMISSIONING OF HEALTH FACILITIES IN EIGHT (8) DISTRICTS IN THE EASTERN CAPE PROVINCE UTILIZING ALTERNATIVE BUILDING TECHNOLOGIES(ABT) FOR A PERIOD OF THIRTY-SIX (36) MONTHS",0001-01-01T00:00:00Z,pdf,2025-02-06T11:16:24Z,ocds-9t57fa-52595,ocds-9t57fa-52595-2023-04-22T00:00:00Z,3004
fe621381-5bb0-4426-a09b-a121abb970bb.pdf,APPLICATION FOR AWARD.pdf,pdf,en,"SUPPLY, DELIVERY, REMOVAL AND INSTALLATION OF LED LIGHT BULBS @ LADYSMITH, NEWCASTLE, VRYHEID & DUNDEE",0001-01-01T00:00:00Z,pdf,2024-10-08T17:06:15Z,ocds-9t57fa-53585,ocds-9t57fa-53585-2023-05-06T00:00:00Z,2383
b7d94653-f761-4cf0-8fc6-22ab99a8f4cf.pdf,SLA CAVALDO Solar Training.pdf,pdf,en,"APPOINTMENT OF A SERVICE PROVIDER TO CONDUCT TRAINING IN THE INSTALLATION, MAINTENANCE, AND MONITORING OF SOLAR PHOTOVOLTAIC (PV) PANELS",0001-01-01T00:00:00Z,pdf,2023-10-25T11:26:52Z,ocds-9t57fa-57137,ocds-9t57fa-57137-2023-06-10T00:00:00Z,1315
64fbcde9-71bf-4fdc-b971-fc98633efc42.pdf,1M 25714 FULLY SIGNED REPORT.pdf,pdf,en,"Surface repairs to roads, sidewalks, and trench reinstatements as and when required in the West Region of eThekwini Municipality for 24 months",0001-01-01T00:00:00Z,pdf,2025-01-17T13:26:40Z,ocds-9t57fa-62874,ocds-9t57fa-62874-2023-08-11T00:00:00Z,2898
f5573af3-611b-416b-b076-a70c74febd6f.pdf,Contract FIN023 of 2023.pdf,pdf,en,"PURCHASE OF OFFICE CONTAINERS AND STORAGE CONTAINERS, AS AND WHEN REQUIRED, FROM DATE OF APPOINTMENT UNTIL 30 JUNE 2026",0001-01-01T00:00:00Z,pdf,2024-05-17T13:39:53Z,ocds-9t57fa-64674,ocds-9t57fa-64674-2023-08-24T00:00:00Z,1844
72a3e7e8-ddcc-42c6-96dd-7116d185b92b.pdf,SLA Between DSBD and Mthente_ Signed 04 March 2024 (003) OR_001338 Mthente.pdf,pdf,en,"APPOINTMENT OF SERVICE PROVIDER TO UNDERTAKE RESEARCH ON CHALLENGES, BUSINESS OPPORTUNITIES, AND SUPPORT REQUIRED BY MSMEs AND CO-OPERATIVES IN THE NATIONAL PRIORITY SECTORS FOCUSING ON THE SHORT, MEDIUM AND LONG TERMS.",2024-07-16T10:16:38Z,pdf,2024-07-16T10:14:35Z,ocds-9t57fa-65703,ocds-9t57fa-65703-2023-09-01T00:00:00Z,2003
08bab295-7c28-42c4-a99d-b0e121b37db4.pdf,SBD 7.2.pdf,pdf,en,"The appointment of a service provider for the supply of backup generators, uninterrupted power supply units (ups), air conditioners, solar system, inverters, general electrical works and water tanks in the Department of Home Affairs (DHA) offices including health facilities, digitisation sites, ports of entry of the Border Management Authority (BMA), and refugee centres in all nine (9) provinces for a period of three (3) years, as and when required, with an option to extend and /renew the contract for further two (2) years subject to satisfactory performance and availability of funds.",0001-01-01T00:00:00Z,pdf,2026-02-09T10:27:43Z,ocds-9t57fa-66461,ocds-9t57fa-66461-2023-09-08T00:00:00Z,4340
c1bad38c-1a6f-463a-bb6a-515496a4335f.pdf,SLA DOCS AND GEMPRINT.pdf,pdf,en,Rendering of printing service and specific promotional items for the Eastern Cape Department of Community Safety over a period of three (3) years (Re-advertisement) ,0001-01-01T00:00:00Z,pdf,2024-11-12T09:58:09Z,ocds-9t57fa-69639,ocds-9t57fa-69639-2023-10-06T00:00:00Z,2592
4c4b0d14-3748-4f6d-9791-ab9301cfdec1.pdf,Final Contract - BA064 of 2023q.pdf,pdf,en,"BA064/2023q – Supply, Delivery and Installation of Wall and Floor Tiles and Related Work for the Upgrading of Restrooms at Blanco Community Hall, George",0001-01-01T00:00:00Z,pdf,2023-12-19T15:59:53Z,ocds-9t57fa-72053,ocds-9t57fa-72053-2023-10-27T00:00:00Z,1442
e20d3057-bcf6-4c57-bb83-f9d5aebe8dc3.pdf,JBCC Contract - Funezakho (1).pdf,pdf,en,"CONSTRUCTION OF ZWELIHLE MULTIPURPOSE COMMUNITY CENTRE AT GOSS HILL
REQUIRED GRADING 6GB OR HIGHER
",0001-01-01T00:00:00Z,pdf,2024-11-15T09:38:22Z,ocds-9t57fa-76828,ocds-9t57fa-76828-2023-12-08T00:00:00Z,2623
ec13a8ad-652d-47cb-9fd2-7358ca02edfe.pdf,Chomaz JTG cleaning.pdf,pdf,en,"RENDERING OF CLEANING,CAR WASH & GARDEN SERVICES AT THE JOHN TAOLO GAETSEWE DISTRICT,FOR A PERIOD OF 36 MONTHS",0001-01-01T00:00:00Z,pdf,2026-03-27T12:26:23Z,ocds-9t57fa-50119,ocds-9t57fa-50119-2023-03-24T00:00:00Z,4818
113eb824-a1b3-4318-86d5-4f5f5ba53b72.zip,1R 24551.zip,zip,en,"Flood damage remediation - Str 120183, Phoenix Industrial Park, roadworks and bridge superstructure: Ward 46 & 48",0001-01-01T00:00:00Z,zip,2024-04-26T15:20:24Z,ocds-9t57fa-56045,ocds-9t57fa-56045-2023-06-02T00:00:00Z,1763
d0a813ac-d992-4ae7-84c7-dccc66a10759.pdf,O - Final Award Letter - EZ Trade 536 (004).pdf,pdf,en,"PROVISION TO PROVIDE HOUSEKEEPING, HYGIENE, AND LAUNDRY SERVICES AT DIDIMA RESORT FOR A PERIOD OF FIVE (05) YEARS",0001-01-01T00:00:00Z,pdf,2026-01-28T11:55:03Z,ocds-9t57fa-56228,ocds-9t57fa-56228-2023-06-02T00:00:00Z,4254
376d5811-3ec2-4f5c-8c32-a9b58afa984d.pdf,SCMU3-2324-0219-CMH ACCEPTANCE LETTER.pdf,pdf,en,"Appointment of service providers for the provision of Security Services at Cecilia Makiwane Regional Hospital, in the Eastern Cape Department of Health for a period of 36 months",0001-01-01T00:00:00Z,pdf,2025-02-12T14:58:12Z,ocds-9t57fa-60302,ocds-9t57fa-60302-2023-07-14T00:00:00Z,3058
73543b33-4bdb-4fed-aa8b-e96db34814d5.pdf,SLA Zimele.pdf,pdf,en,TERMS OF REFERENCE TO APPOINT A SERVICE PROVIDER TO CONDUCT A TECHNICAL AND APPLICATION ASSESSMENT AND MAINTENANCE FOR THE GAUTENG LIQUOR BOARD AUTOMATION SYSTEM FOR A PERIOD OF THIRTY SIX (36) MONTHS ,0001-01-01T00:00:00Z,pdf,2026-03-31T19:07:09Z,ocds-9t57fa-60424,ocds-9t57fa-60424-2023-07-21T00:00:00Z,4901
9fa44c65-4b9b-4dee-9d3a-a9b52d806e48.pdf,CDC-299-23 -  LETTER OF APPOINTMENT.pdf,pdf,en,"REPAIRS & RENOVATIONS AT IZIKO PRIMARY SCHOOL IN AMAJUBA DISTRICT, KWAZULU-NATAL",0001-01-01T00:00:00Z,pdf,2026-04-07T15:15:56Z,ocds-9t57fa-61627,ocds-9t57fa-61627-2023-07-28T00:00:00Z,4938
34d320fe-75d8-4e1e-8a1c-b61757c82836.pdf,PO 31-33991 - KALRIK CONTRACTING.pdf,pdf,en,Installation of Blinds,2023-10-15T11:09:50Z,pdf,2023-10-04T09:43:48Z,ocds-9t57fa-61791,ocds-9t57fa-61791-2023-07-28T00:00:00Z,1232
0f5e8863-7f25-4882-8c65-6141fc984d2a.pdf,1C-25098 BEC REPORT.pdf,pdf,en,Supply and delivery of x70 pistols for eThekwini Metro Police Services,0001-01-01T00:00:00Z,pdf,2024-06-18T11:57:31Z,ocds-9t57fa-67998,ocds-9t57fa-67998-2023-09-22T00:00:00Z,1918
ee6a4e0f-cc22-4039-ae68-0c3d0d590a30.zip,LoT WS 7740.zip,zip,en,"Southern Aqueduct Upgrade: Work package #01
Southern Aqueduct Upgrade: Work package #02",0001-01-01T00:00:00Z,zip,2024-05-06T14:38:37Z,ocds-9t57fa-68111,ocds-9t57fa-68111-2023-09-22T00:00:00Z,1808
c9116655-7908-4b22-89fa-bcda0f7e2ef8.pdf,WS-7424 FULLY SIGNED REPORT.pdf,pdf,en,Helen Joseph Sewer Replacement,0001-01-01T00:00:00Z,pdf,2024-09-11T08:38:39Z,ocds-9t57fa-69435,ocds-9t57fa-69435-2023-10-06T00:00:00Z,2215
5f829308-ae92-4c1c-9290-4784f08110c2.pdf,SBD 7.1_ (002) - signed.pdf,pdf,en,APPOINTMENT OF A SERVICE PROVIDER FOR THE PROVISION OF ADOBE LICENSES FOR TCTA (TRANS CALEDON TUNNEL AUTHORITY) FOR A PERIOD OF 36 MONTHS,0001-01-01T00:00:00Z,pdf,2026-05-14T10:07:17Z,ocds-9t57fa-72742,ocds-9t57fa-72742-2023-11-03T00:00:00Z,5371
4e28053f-f669-44ee-9e36-648010b78c13.pdf,1T-26451 FULLY SIGNED REPORT.pdf,pdf,en,Pinetown Transit Oriented Development (TOD) Implementation Plan,0001-01-01T00:00:00Z,pdf,2024-09-11T08:25:45Z,ocds-9t57fa-74489,ocds-9t57fa-74489-2023-11-17T00:00:00Z,2211
1ec61bd0-0492-40b8-a5b9-fa553a6d258a.pdf,Signed LOA - Travel with Flair.pdf,pdf,en,"PROVISION OF TRAVEL MANAGEMENT SERVICES FOR THE NATIONAL HERITAGE COUNCIL FOR A PERIOD OF 36 MONTHS (Date extended)
Pricing schedule added.",0001-01-01T00:00:00Z,pdf,2025-04-23T15:03:22Z,ocds-9t57fa-75089,ocds-9t57fa-75089-2023-11-23T00:00:00Z,3339
6b0f6612-9765-4138-8181-c2c725147b34.pdf,20240326 6.1 RFP 30-2023 -NBAC submission report.pdf,pdf,en,Appointment of a Service Provider for the Provision of Digital Forensics Review Platform Software Solution,0001-01-01T00:00:00Z,pdf,2024-04-10T18:10:20Z,ocds-9t57fa-77436,ocds-9t57fa-77436-2023-12-14T00:00:00Z,1723
6565491e-8979-4a57-80b4-bcf2f9ae73e6.pdf,Onyx Media- Award Letter.pdf,pdf,en,"APPOINTMENT OF A SERVICE PROVIDER FOR THE PROVISION OF LIVESTREAMING & AUDIOVISUAL
SERVICES FOR A PERIOD OF TWENTY-FOUR (24) MONTHS
",0001-01-01T00:00:00Z,pdf,2024-06-20T12:12:11Z,ocds-9t57fa-91682,ocds-9t57fa-91682-2023-04-06T00:00:00Z,1931
dd0f9437-66e5-4189-bdc7-2de15e5a441d.pdf,Onyx Media- Award Letter.pdf,pdf,en,"APPOINTMENT OF A SERVICE PROVIDER FOR THE PROVISION OF LIVESTREAMING & AUDIOVISUAL
SERVICES FOR A PERIOD OF TWENTY-FOUR (24) MONTHS
",0001-01-01T00:00:00Z,pdf,2024-06-20T11:23:49Z,ocds-9t57fa-91682,ocds-9t57fa-91682-2023-04-06T00:00:00Z,1930
5471c388-fcb0-4443-8ac1-6e4253ad5d64.pdf,1R-26966 FULLY SIGNED REPORT.pdf,pdf,en,Old Richmond Road Sidewalk: Wards 13 and 17,0001-01-01T00:00:00Z,pdf,2024-10-02T10:43:09Z,ocds-9t57fa-77592,ocds-9t57fa-77592-2023-12-18T00:00:00Z,2321
88c2c9f3-fd0a-4909-9c04-1f54753ddce0.pdf,MATHS & SCIENCE SLA (1) 10 JULY 2024.pdf,pdf,en,"Supply of expert Mathematics and Physical Science Grade 10, 11 and 12 teachers to teach in the identified schools and provide tutoring and revision classes. The teacher will equally be of use to support vacation classes and incubation centers until the completion of the NSC Grade12final examinations in the Eastern Cape Department of Education (ECDoE) for a period contract of three (3) years. The model of support will be resident based.
",0001-01-01T00:00:00Z,pdf,2025-02-05T12:37:40Z,ocds-9t57fa-77672,ocds-9t57fa-77672-2023-12-19T00:00:00Z,3000
690e4fbe-8f8c-4f5f-be0a-2d3ceb7e02fe.pdf,AWARD LETTER.pdf,pdf,en,Fumigation & Pest Control services,0001-01-01T00:00:00Z,pdf,2024-09-19T15:39:21Z,ocds-9t57fa-102213,ocds-9t57fa-102213-2023-06-15T00:00:00Z,2294
3044030f-2041-4037-b2b5-62be19bb71e9.pdf,Letter of Comfort -DOE Eastern Cape.pdf,pdf,en,"SCMU6_22/23-0019: REQUEST FOR PROPOSAL FROM REPUTABLY QUALIFIED SERVICE PROVIDER FOR PROVISIONING OF PROJECT MANAGEMENT SERVICES, WHICH SHALL INCLUDE PROCUREMENT, WAREHOUSING, INVENTORY MANAGEMENT (FURNITURE) AND DELIVERY OF BOTH ELECTRONIC AND PAPER LEARNING AND TEACHING SUPPORT MATERIAL (LTSM AND ELTSM) FOR A PERIOD OF THREE(3) YEARS WITH AN OPTION TO EXTEND THE CONTRACT FOR A PERIOD OF NOT MORE THAN 2 YEARS AT THE DESCRETION OF THE EASTERN CAPE DEPARTMENT OF EDUCATION,INFORMED BY THE BUDGET AVAILABILITY , THE NEED , INCLUDING THE PERFOMANCE OF THE SERVICE PROVIDER.",0001-01-01T00:00:00Z,pdf,2025-03-06T13:34:24Z,ocds-9t57fa-116690,ocds-9t57fa-116690-2023-03-03T00:00:00Z,3149
18673110-3d62-4799-b3ee-0335eb4b00b7.pdf,SCM32-2022-23 TESS ENGINEERS RSA (PTY) LTD FINAL LETTER.pdf,pdf,en,UPGRADING OF BREDASDORP WATER TREATMENT WORKS,0001-01-01T00:00:00Z,pdf,2023-05-29T07:14:36Z,ocds-9t57fa-45250,ocds-9t57fa-45250-2023-01-26T00:00:00Z,995
33a01d74-623f-495f-924d-109239527df4.pdf,Order for Busainess Connexion.pdf,pdf,en,APPOINTMENT OF A SERVICE PROVIDER FOR THE DEVELOPMENT OF AN AUTOMATED JOB EVALUATION AND JOB GRADING SYSTEM FOR THE PUBLIC SERVICE.,0001-01-01T00:00:00Z,pdf,2023-08-24T13:46:12Z,ocds-9t57fa-45295,ocds-9t57fa-45295-2023-01-27T00:00:00Z,1127
8e71693b-de3e-4b8c-b0ff-d4ed11c39938.pdf,SCM39-2022-23 TMT SERVICES AND SUPPLIES PTY LTD FINAL LETTER.pdf,pdf,en,THE PROVISION OF SOFTWARE LICENCES AND RENTAL OF EQUIPMENT FOR TRAFFIC- AND LAW ENFORCEMENT CONTRAVENTION SYSTEM,0001-01-01T00:00:00Z,pdf,2023-07-27T08:20:16Z,ocds-9t57fa-50753,ocds-9t57fa-50753-2023-03-30T00:00:00Z,1089
22fc3e03-3ab3-4076-9b0a-501b6dc56093.pdf,STG 2 documets for the pole legs and brackets.pdf,pdf,en,"Supply and delivery of Eco pole legs, link plates and self tapping screws ",0001-01-01T00:00:00Z,pdf,2023-04-05T11:13:59Z,ocds-9t57fa-51264,ocds-9t57fa-51264-2023-02-24T00:00:00Z,873
6198e26b-7ae7-4c5b-8e63-c23723f065f3.pdf,Full Contract BA076 of 2022q.pdf,pdf,en,RENTING OF OFF-SITE STORAGE FOR GEORGE MUNICIPALITY FOR A PERIOD OF SIX (6) MONTHS FROM DATE OF APPOINTMENT,0001-01-01T00:00:00Z,pdf,2023-07-03T10:13:55Z,ocds-9t57fa-51893,ocds-9t57fa-51893-2023-04-14T00:00:00Z,1043
bb0afb3b-2157-4bdf-a0b7-b0af244cebf8.pdf,Checklist - OA Day to Day maintenance Hvac Free State for 2 years.pdf,pdf,en,Day To Day Maintenace H-Vac,2023-07-25T08:03:49Z,pdf,2023-04-25T11:55:50Z,ocds-9t57fa-52451,ocds-9t57fa-52451-2023-02-10T00:00:00Z,960
7e711a1d-a8d5-4fdf-99db-fa6a45a95039.pdf,LoA.pdf,pdf,en,Provision of ICT Audits and automated vulnerability risk assessments ( IT infrastructure and network discovery) for a period of five (5) years for various Eastern Cape Departments,0001-01-01T00:00:00Z,pdf,2024-07-11T16:21:33Z,ocds-9t57fa-53952,ocds-9t57fa-53952-2023-05-12T00:00:00Z,1979
91fb186f-513f-4629-977f-0fc75c0d3437.pdf,SCM5-2023-24 CAPE AGULHAS CIVILS FINAL LETTER.pdf,pdf,en,UPGRADING OF SUIDERSTRAND ROAD PHASE 3,0001-01-01T00:00:00Z,pdf,2023-10-03T07:44:59Z,ocds-9t57fa-57660,ocds-9t57fa-57660-2023-06-15T00:00:00Z,1231
9bd84493-8d00-40c7-9276-54f588a280b9.pdf,The first plan protection services _28022024084744.pdf,pdf,en,PROVISION OF PROFESSIONAL SECURITY SERVICES OF CANZIBE HOSPITAL ROAD FOR A PERIOD OF 36 MONTHS,0001-01-01T00:00:00Z,pdf,2025-08-05T12:34:40Z,ocds-9t57fa-64106,ocds-9t57fa-64106-2023-08-18T00:00:00Z,3624
563858de-780b-4fbf-a9ff-493d7efc4a1a.pdf,Akili IT Services.pdf,pdf,en,"APPOINTMENT OF SERVICE PROVIDER TO PROVIDE SERVICES FOR MIGRATION OF ON-PREMISES FILE SERVER TO MICROSOFT SHAREPOINT ONLINE AND 
IMPLEMENTATION OF MICROSOFT SHAREPOINT ONLINE FOR DOCUMENT MANAGEMENT AND SUPPORT",0001-01-01T00:00:00Z,pdf,2024-03-19T09:57:46Z,ocds-9t57fa-64580,ocds-9t57fa-64580-2023-08-25T00:00:00Z,1639
09e1ec2d-de7d-40a3-a263-e56b80dbeca8.pdf,Award letter -  RFX6000022360.pdf,pdf,en,D2D Electrical maintenance to Sars KZN Northern offices.,0001-01-01T00:00:00Z,pdf,2023-08-25T10:31:56Z,ocds-9t57fa-64825,ocds-9t57fa-64825-2023-06-15T00:00:00Z,1141
25c75ca2-3547-4bbb-bc29-01cff22ffc8f.pdf,0397-KUFANIKWA- LETTER OF AWARD.pdf,pdf,en,"PROCUREMENT OF A PROJECT MANAGEMENT UNIT (PMU) SERVICE PROVIDER TO 
PROVIDE PROGRAM & PROJECT MANAGEMENT SERVICES FOR 
PLANNED AND UNPLANNED BUILDINGS RELATED MAINTENANCE 
SERVICES",0001-01-01T00:00:00Z,pdf,2025-02-06T10:47:40Z,ocds-9t57fa-64937,ocds-9t57fa-64937-2023-08-25T00:00:00Z,3002
f4241a7d-49d3-4e84-8231-520b4951dec2.pdf,3100033704 Plumbing.pdf,pdf,en,Day to day Plumbing maintenance,0001-01-01T00:00:00Z,pdf,2023-08-29T05:47:18Z,ocds-9t57fa-65132,ocds-9t57fa-65132-2023-05-05T00:00:00Z,1143
eb7d52f4-f6e4-4de6-ba8b-cee1a43786d3.pdf,SLA MR6 - ZNB101 - Security Services Empangeni.pdf,pdf,en,"PROVISION OF 24-HOUR SECURITY GUARDING SERVICES TO THE DEPARTMENT OF HUMAN SETTLEMENTS, KING CETSHWAYO DISTRICT OFFICE, 17 TURNBULL STREET EMPANGENI, FOR A PERIOD OF THIRTY-SIX (36) MONTHS.  ",2024-06-04T10:07:43Z,pdf,2024-04-30T10:26:10Z,ocds-9t57fa-67460,ocds-9t57fa-67460-2023-09-15T00:00:00Z,1777
8ddb5189-485e-4c22-a00d-cfcfdad4e6aa.pdf,Vhuso 0085.pdf,pdf,en,"WATER INFRASTRUCTURE AUGMENTATION, BOREHOLE DRILLING AND EQUIPPING AT BEDFORD ORTHOPEDIC HOSPITAL, MTHATHA",0001-01-01T00:00:00Z,pdf,2025-02-11T15:51:28Z,ocds-9t57fa-68153,ocds-9t57fa-68153-2023-09-22T00:00:00Z,3046
12725cb8-cc9f-4218-ae4e-e22f0b84e63e.pdf,PO 58118.pdf,pdf,en,Placement Fee for Portfolio Head Municipal Services ,0001-01-01T00:00:00Z,pdf,2023-10-05T13:30:29Z,ocds-9t57fa-69371,ocds-9t57fa-69371-2023-08-11T00:00:00Z,1245
f00ac44d-d6c3-441e-97a0-beea3f4864ac.pdf,PO56512.pdf,pdf,en,Hygiene services for National Office : 1 May 2023 to 31 October 2025 (18 Months),2024-03-18T11:45:02Z,pdf,2023-10-09T08:51:56Z,ocds-9t57fa-69397,ocds-9t57fa-69397-2023-04-28T00:00:00Z,1247
9693b9f2-193c-4873-a90d-70887782bca9.pdf,Full Contract - COM035 of 2023q.pdf,pdf,en,COM035 OF 2023 : the SUPPLY AND DELIVERY OF VARIOUS FIRE FIGHTING AND RESCUE EQUIPMENT FOR OPERATIONAL PURPOSES,0001-01-01T00:00:00Z,pdf,2023-11-23T11:03:01Z,ocds-9t57fa-69619,ocds-9t57fa-69619-2023-10-06T00:00:00Z,1371
69d2016e-eec7-46f9-8c52-e838e1c6292f.pdf,Appointment Letter Tyeks Security Bhisho Airport.pdf,pdf,en,"APPOINTMENT OF A PROFESSIONAL SECURITY SERVICE PROVIDER FOR THE PROVISION OF SECURITY SERVICES AT MTHATHA AIRPORT FOR A CONTRACT PERIOD OF 36
MONTHS.",0001-01-01T00:00:00Z,pdf,2025-08-05T14:43:16Z,ocds-9t57fa-69658,ocds-9t57fa-69658-2023-10-06T00:00:00Z,3634
2c90c5c9-b08a-44c9-8a4d-62123bb02998.pdf,SCM19-2023-24 CPG SERVICES FINAL LETTER.pdf,pdf,en,UPGRADING OF EXISTING WATER & SEWER INFRASTRUCTURE,0001-01-01T00:00:00Z,pdf,2024-03-14T11:23:51Z,ocds-9t57fa-72035,ocds-9t57fa-72035-2023-10-27T00:00:00Z,1573
c9b2b246-44ce-4f40-94f9-ba2c2cf926bf.pdf,7E-23409 FULLY SIGNED REPORT.pdf,pdf,en,Request for Proposals for the leasing of a building (kiosk) situated on Proposed Lease on Remainder of Erf 1 Durban as depicted on SJ Plan No. 4769/3 measuring 56m² for commercial purposes for a period of nine years and eleven months with no right of renewal,0001-01-01T00:00:00Z,pdf,2024-10-16T09:57:55Z,ocds-9t57fa-73518,ocds-9t57fa-73518-2023-11-10T00:00:00Z,2443
16892482-9415-4a49-a157-1319cf0abcce.pdf,JBCC Contract Data - Queenstown - Cosy Rock.pdf,pdf,en,Upgrade And Renovation Of ECDC Office In Queenstown,0001-01-01T00:00:00Z,pdf,2024-07-24T14:55:03Z,ocds-9t57fa-73618,ocds-9t57fa-73618-2023-11-10T00:00:00Z,2056
de92cfa9-e723-4571-8e47-dbe7d97fa411.pdf,"Avumile - Dimbaza Site 8,12 and 21.pdf",pdf,en,"REPAIRS, REFURBISHMENT OF SITE 8, 12 AND 21 IN DIMBAZA INDUSTRIAL PARK.",0001-01-01T00:00:00Z,pdf,2024-07-24T15:02:43Z,ocds-9t57fa-75381,ocds-9t57fa-75381-2023-11-24T00:00:00Z,2058
3363df0d-8b4a-4b73-9de7-999218c7c7ac.pdf,Keilake 0089.pdf,pdf,en,RENOVATIONS AND UPGRADE OF OFFICE SPACE AND COMMON AREAS IN BOTHA SIGCAU,0001-01-01T00:00:00Z,pdf,2025-02-19T11:15:39Z,ocds-9t57fa-76770,ocds-9t57fa-76770-2023-12-08T00:00:00Z,3083
029bb43c-f7ce-4174-98b4-9d38b4817ccb.pdf,Contract FIN032 of 2023.pdf,pdf,en,"APPOINTMENT OF A SERVICE PROVIDER TO MANAGE, RENEW AND PURCHASE SOFTWARE LICENSING AND HARDWARE ON AN AD-HOC BASIS FROM DATE OF APPOINTMENT UNTIL 30 JUNE 2026",0001-01-01T00:00:00Z,pdf,2024-04-25T22:09:27Z,ocds-9t57fa-77303,ocds-9t57fa-77303-2023-12-14T00:00:00Z,1756
c78104d1-33ed-4247-9f64-2f1cff62956b.pdf,Signed Agreement - EDTEA   BICSA in re provision of bakery mentorship  coaching for Vuka Uyibambe Bakery Co-operative_.pdf,pdf,en,APPOINTMENT A SERVICE PROVIDER TO PROVIDE BAKERY MENTORSHIP AND COACHING TO VUKA UYIBAMBE BAKERY,0001-01-01T00:00:00Z,pdf,2024-02-04T13:20:04Z,ocds-9t57fa-80254,ocds-9t57fa-80254-2023-09-15T00:00:00Z,1503
72439e3e-471b-4d83-a9ce-8088d1fd8426.pdf,Purchase Order #59873.pdf,pdf,en,Appointment of a service provider for the provision Municipal assistance: Joe Marolong,0001-01-01T00:00:00Z,pdf,2024-04-02T13:09:04Z,ocds-9t57fa-85264,ocds-9t57fa-85264-2023-09-15T00:00:00Z,1690
a485852a-7afc-4373-8932-b71bfa9c5ff1.pdf,SKM_C550i26012908300.pdf,pdf,en,REQUEST FOR QUOTATION (RFQ): HYGIENE SERVIRCES AT DCS OFFICE BLOCK,0001-01-01T00:00:00Z,pdf,2026-01-29T13:26:47Z,ocds-9t57fa-143807,ocds-9t57fa-143807-2023-09-15T00:00:00Z,4270
a703137b-1f57-425a-9064-0e8c6ff86248.pdf,CSD & REQUISITION.pdf,pdf,en,"SUPPLY, DELIVERY, REMOVAL AND INSTALLATION LED LIGHT BULBS @IXOPO AND PORT SHEPSTONE",0001-01-01T00:00:00Z,pdf,2024-08-27T11:20:58Z,ocds-9t57fa-53580,ocds-9t57fa-53580-2023-05-06T00:00:00Z,2167
dc694699-ddda-448e-8981-0da35fde4a0d.pdf,Appointment letter.pdf,pdf,en,HIRE OF HELICOPTER COMPLETE WITH PILOT FOR THE CAPTURE AND MANAGEMENT OF GAME FOR FIVE (5) YEAR PERIOD,0001-01-01T00:00:00Z,pdf,2026-01-28T13:16:29Z,ocds-9t57fa-59614,ocds-9t57fa-59614-2023-07-07T00:00:00Z,4260
f9730610-50c4-46ae-be54-e1d307faa55c.pdf,RFP 19 2023 Provision of Graph Database Management Software Tool.pdf,pdf,en,Provision of Graph Database Management Software Tool with Maintenance and Support,0001-01-01T00:00:00Z,pdf,2023-12-19T08:41:54Z,ocds-9t57fa-59701,ocds-9t57fa-59701-2023-07-07T00:00:00Z,1439
93dafe67-e305-412f-a6f0-2fac4627428b.pdf,Busi  Ntuli Communication promotional material.pdf,pdf,en,The appointment of a service provider to assist the National Energy Regulator with the Production of Promotional material for a period of three (3) years,0001-01-01T00:00:00Z,pdf,2024-04-30T17:10:51Z,ocds-9t57fa-61809,ocds-9t57fa-61809-2023-07-28T00:00:00Z,1786
6ca9082b-db51-427b-8a1f-96e732ddc050.pdf,1M 25713 FULLY SIGNED REPORT.pdf,pdf,en,"Surface repairs to roads, sidewalks, and trench reinstatements as and when required in the South Central Region of eThekwini Municipality for 24 months",0001-01-01T00:00:00Z,pdf,2025-01-17T13:37:59Z,ocds-9t57fa-62872,ocds-9t57fa-62872-2023-08-11T00:00:00Z,2899
1b17993a-be7b-4530-b69b-8eb951e8eec9.docx,Doc1.docx,docx,en,"Maintenance and support services of Erwin Enterprise Architecture (EA) Software Suite, for a period of five (5) years effective from 01 January 2024 to 31 December 2028 for an estimated amount of R 17 882 022.14 at 15% VAT inclusive.",0001-01-01T00:00:00Z,docx,2023-08-24T10:46:08Z,ocds-9t57fa-64614,ocds-9t57fa-64614-2023-08-11T00:00:00Z,1125
74160005-3b69-4476-8eb1-76105f05cd93.pdf,1M-25291.pdf,pdf,en,Maintenance repairs to roads and stormwater infrastructure as and when required in the ABM areas located within the North Region of eThekwini Municipality for a period of 24 months,0001-01-01T00:00:00Z,pdf,2024-11-05T10:28:03Z,ocds-9t57fa-64746,ocds-9t57fa-64746-2023-08-25T00:00:00Z,2535
33ab20b5-1942-4841-98a3-bf2cb6774d9c.docx,Doc1.docx,docx,en,"The renewal of the Enterprise License Agreement for the current VMWARE software support, subscription and the procurement of additional VMWARE software licenses through the SITA/DELL Framework Agreement",0001-01-01T00:00:00Z,docx,2023-09-27T12:04:12Z,ocds-9t57fa-68494,ocds-9t57fa-68494-2023-09-23T00:00:00Z,1223
ab09335c-beb3-4af5-86b5-5424f54cbecd.pdf,1H-25872 FULLY SIGNED REPORT.pdf,pdf,en,"The construction of Block F consisting of 80, two-bedroom units at SJ Smith CRU - Ward 75",0001-01-01T00:00:00Z,pdf,2024-11-07T09:45:27Z,ocds-9t57fa-69421,ocds-9t57fa-69421-2023-10-06T00:00:00Z,2557
86a615ff-cb4a-4f32-87fe-14f1fa1c4223.pdf,LCS DHA SBD 7.2 24 Nov 23.pdf,pdf,en,"PROCUREMENT OF ROUTERS AND SWITCHES WITH SUPPORT AND MAINTENANCE FOR A PERIOD OF
THIRTY SIX (36) MONTHS.",2026-02-13T09:24:36Z,pdf,2023-11-28T08:27:00Z,ocds-9t57fa-69516,ocds-9t57fa-69516-2023-10-06T00:00:00Z,1380
