id,title,dateSigned,description,status,awardID,value_amount,value_currency,period_endDate,period_startDate,period_maxExtentDate,period_durationInDays,main_ocid,main_id
1525,P1/AUX/CLN/05/23,2024-02-16T11:04:34Z,Appointment of Service Provider for Cleaning Service at EDTEA uMzinyathi District Office,active,22123,196500,ZAR,2024-05-31T00:00:00Z,2023-12-01T00:00:00Z,2024-05-31T00:00:00Z,182,ocds-9t57fa-80274,ocds-9t57fa-80274-2023-10-28T00:00:00Z
4936,CDC/179/23,2026-04-07T12:31:55Z,"CONSTRUCTION OF MTHWANE SECONDARY SCHOOL IN HARRY GWALA DISTRICT, KWAZULU-NATAL - 7 GB OR HIGHER",active,24645,77177666,ZAR,2026-05-26T00:00:00Z,2023-10-31T00:00:00Z,2026-05-26T00:00:00Z,938,ocds-9t57fa-57634,ocds-9t57fa-57634-2023-06-15T00:00:00Z
4983,CDC/496/23,2026-04-13T16:56:01Z,PROFESSIONAL CONSULTANCY SERVICES FOR THE CONSTRUCTION THE RETURN EFFLUENT SCHEME FROM THE FWF WASTE WATER TREATMENT WORKS TO THE COEGA SEZ,active,29650,30430062,ZAR,2029-03-31T00:00:00Z,2024-05-03T00:00:00Z,2029-03-31T00:00:00Z,1793,ocds-9t57fa-77150,ocds-9t57fa-77150-2023-12-14T00:00:00Z
4435,SCMU5-23/24-0058,2026-02-18T09:54:22Z,PROCUREMENT OF ARCHITECTURAL SERVICE AND PRINCIPAL AGENT FOR CONSTRUCTION OF EMAXESIBENI OFFICE PRECINCT BLOCK A IN ALFRED NZO DISTRICT,active,61768,4916895,ZAR,2028-02-06T00:00:00Z,2024-02-05T00:00:00Z,2028-02-06T00:00:00Z,1462,ocds-9t57fa-145004,ocds-9t57fa-145004-2023-08-04T00:00:00Z
5315,SSP 3454,2026-05-12T10:57:30Z,SharePoint Storage Expansion (Additional 10TB),active,68461,14549316,ZAR,2026-01-31T00:00:00Z,2023-02-01T00:00:00Z,2026-01-31T00:00:00Z,1095,ocds-9t57fa-155611,ocds-9t57fa-155611-2023-01-27T00:00:00Z
2928,DARD 19/2022,2025-01-22T14:44:39Z,Appointment of the Panel of Service Providers for the Rehabilitation and Construction of dams in various Districts of KwaZulu Natal for the period of 24 months,active,34347,1,ZAR,2025-10-06T00:00:00Z,2024-10-07T00:00:00Z,2025-10-06T00:00:00Z,364,ocds-9t57fa-48096,ocds-9t57fa-48096-2023-03-03T00:00:00Z
1936,SCMO-22/23-002,2024-06-21T08:50:34Z,"APPOINTMENT OF A PANEL OF SERVICE PROVIDERS FOR THE SUPPLY, DELIVERY AND INSTALLATION OF WATER TANKS FOR THE EASTERN CAPE PROVINCIAL GOVERNMENT FOR A PERIOD OF THIRTY - SIX (36) MONTHS AS AND WHEN REQUIRED",active,21016,0,ZAR,2027-01-01T00:00:00Z,2024-01-02T00:00:00Z,2027-01-01T00:00:00Z,1095,ocds-9t57fa-51739,ocds-9t57fa-51739-2023-04-14T00:00:00Z
3611,SCMU10-23/24-0001,2025-07-30T12:28:08Z,APPOINTMENT OF CIVIL ENGINEERING CONTRACTOR FOR THE UPGRADING OF ROAD DR08034 FROM N2 TO R61 VIA CLARKEBURY (20KM) PHASE 1,active,29194,327629259,ZAR,0001-01-01T00:00:00Z,0001-01-01T00:00:00Z,0001-01-01T00:00:00Z,0,ocds-9t57fa-54112,ocds-9t57fa-54112-2023-05-12T00:00:00Z
4807,CDC/139/23,2026-03-27T10:03:43Z,"UPGRADE AND ADDITIONS AT MZINGEZWI SECONDARY SCHOOL IN NDWEDWE, ILEMBE DISTRICT, KWAZULU-NATAL - 7GB ",active,24690,64451199,ZAR,2026-02-12T00:00:00Z,2023-10-27T00:00:00Z,2026-02-12T00:00:00Z,839,ocds-9t57fa-55438,ocds-9t57fa-55438-2023-05-26T00:00:00Z
2901,1H-23557,2025-01-17T14:14:50Z,"Construction of 40m² top structure units at 
Emaphephetheni Phase 3 Rural Housing Project (284 units per contractor): Ward 02
",active,40785,37333646,ZAR,2027-12-10T00:00:00Z,2024-09-11T00:00:00Z,2027-12-10T00:00:00Z,1185,ocds-9t57fa-56048,ocds-9t57fa-56048-2023-06-02T00:00:00Z
5341,3417-30/07/2026,2026-05-12T14:14:02Z,Request for Proposals (RFP) The provision of specialised ocean engineering and R&D services to CSIR,active,27798,9369957,ZAR,2026-07-30T00:00:00Z,2024-08-01T00:00:00Z,2026-07-30T00:00:00Z,728,ocds-9t57fa-56288,ocds-9t57fa-56288-2023-06-02T00:00:00Z
1360,NNRSCM-02-2023,2023-11-17T12:59:44Z,"APPOINTMENT OF A SERVICE PROVIDER FOR THE DESIGN, REPLACEMENT, SERVICE, REPAIRS, AND MAINTENANCE OF HVAC/AIR CONDITION SYSTEM TO THE NNR FOR A PERIOD OF THREE (3) YEARS",active,16690,6334890,ZAR,2026-10-31T00:00:00Z,2023-11-01T00:00:00Z,2026-10-31T00:00:00Z,1095,ocds-9t57fa-57019,ocds-9t57fa-57019-2023-06-09T00:00:00Z
3897,SCMU5-23/24-0019,2025-10-23T16:07:35Z,"Appointment of service providers to render Offsite Travel Management Services in respect of Air Travel, Car Hire,
Accommodation, Venues and Conference Facilities for the Department of Public Works & Infrastructure: Head Office for a period of three (3) years",active,53238,0,ZAR,2027-03-01T00:00:00Z,2024-02-23T00:00:00Z,2027-03-01T00:00:00Z,1102,ocds-9t57fa-58110,ocds-9t57fa-58110-2023-06-23T00:00:00Z
1878,ACDP 22/09,2024-06-13T10:52:38Z,TERM CONTRACT FOR CAPACITY BUILDING PROGRAMME OF FARMERS AND BENEFICIARIES ON SOFT AND TECHNICAL SKILLS IN THE LIMPOPO DEPARTMENT OF AGRICULTURE AND RURAL DEVELOPMENT (LDARD) FOR A PERIOD OF THREE (3) YEARS,pending,22707,5926603,ZAR,2027-01-08T00:00:00Z,2024-01-10T00:00:00Z,2027-01-08T00:00:00Z,1094,ocds-9t57fa-61471,ocds-9t57fa-61471-2023-07-28T00:00:00Z
4712,CDC-285-23,2026-03-24T10:05:01Z,"CONSTRUCTION OF GRADE R CLASSROOMS AT UMBULWANE PRIMARY SCHOOL IN LADYSMITH, UTHUKELA DISTRICT, KWAZULU-NATAL - 5GB or HIGHER
",active,29778,9434859,ZAR,2026-01-30T00:00:00Z,2024-07-30T00:00:00Z,2026-01-30T00:00:00Z,549,ocds-9t57fa-62339,ocds-9t57fa-62339-2023-08-04T00:00:00Z
1785,CON0027/2023/24,2024-04-30T17:02:02Z,THE APPOINTMENT OF A SERVICE PROVIDER TO ASSIST THE NATIONAL ENERGY REGULATOR WITH TRANSLATION SERVICES FOR A PERIOD OF THREE (3) YEARS ,active,20863,1102500,ZAR,2027-05-31T00:00:00Z,2024-06-01T00:00:00Z,2027-05-31T00:00:00Z,1094,ocds-9t57fa-66621,ocds-9t57fa-66621-2023-09-08T00:00:00Z
2322,WS-7715,2024-10-02T10:45:35Z,Rehabilitation to Umbilo Wastewater Treatment Works and Upstream Catchment Network – Ward 18,active,36038,246337539,ZAR,2026-07-31T00:00:00Z,2024-08-19T00:00:00Z,2026-07-31T00:00:00Z,711,ocds-9t57fa-68107,ocds-9t57fa-68107-2023-09-22T00:00:00Z
4054,DTP01625,2025-11-21T16:54:11Z,Appointment of a transaction advisor for an energy utility management centre  for Dube TradePort Corporation,active,37248,16999998,ZAR,2029-09-12T00:00:00Z,2025-03-25T00:00:00Z,2029-09-12T00:00:00Z,1632,ocds-9t57fa-68292,ocds-9t57fa-68292-2023-09-22T00:00:00Z
2663,SCMU3023/24-0158-NMM,2024-11-28T14:41:20Z,Provision of cleaning services to Emergency Medical Services in Nelson Mandela Bay Health District for a period of 36 months.,active,32056,2020644,ZAR,2027-02-28T00:00:00Z,2024-03-01T00:00:00Z,2027-02-28T00:00:00Z,1094,ocds-9t57fa-68791,ocds-9t57fa-68791-2023-09-29T00:00:00Z
4957,CDC/399/23,2026-04-09T13:37:37Z,"CONSTRUCTION OF NEW ECDC EDUCATIONAL FACILITIES  AT E.MACEMBE PRIMARY SCHOOL
",active,29415,13226904,ZAR,2026-03-31T00:00:00Z,2024-06-06T00:00:00Z,2026-03-31T00:00:00Z,663,ocds-9t57fa-69517,ocds-9t57fa-69517-2023-10-06T00:00:00Z
3616,SCMU10-23/24-0021,2025-07-30T14:48:00Z,"UPGRADING OF ROAD, DR08303, DR08329, DR08308 AND DR08309 FROM R61 AT ST BARNABAS HOSPITAL TO HLULEKA NATURE RESERVE PHASE 2 (32km)",active,29176,546677296,ZAR,0001-01-01T00:00:00Z,0001-01-01T00:00:00Z,0001-01-01T00:00:00Z,0,ocds-9t57fa-70320,ocds-9t57fa-70320-2023-10-13T00:00:00Z
2439,4V-27358,2024-10-15T15:06:32Z,"Construction of incremental services – Roads, footpaths, and stormwater in Bhambayi (Ward 57) (RFS)",active,36794,21745967,ZAR,2025-09-30T00:00:00Z,2024-06-05T00:00:00Z,2025-09-30T00:00:00Z,482,ocds-9t57fa-74470,ocds-9t57fa-74470-2023-11-17T00:00:00Z
4587,SCMU3-23/24-0632-HO,2026-03-12T15:46:56Z,"SCHEDULE MAINTENANCE OF LAUNDRY & ASSOCIATED EQUIPMENT AT CLUSTER FOUR (4) – NELSON MANDELA AND SARAH BAARTMANT DISTRICT – HEALTH FACILITIES  (36 MONTHS)
",active,64803,13870021,ZAR,2027-07-31T00:00:00Z,2024-08-01T00:00:00Z,2027-07-31T00:00:00Z,1094,ocds-9t57fa-74610,ocds-9t57fa-74610-2023-11-18T00:00:00Z
3340,NHC/07/11/2023,2025-04-23T15:05:40Z,"RENTAL OF OFFICE ACCOMMODATION FOR THE NATIONAL HERITAGE COUNCIL FOR A PERIOD OF FIVE (5) YEARS (Date extended)
Proposals for Heritage buildings are welcome",active,29062,33885748,ZAR,2027-06-30T00:00:00Z,2024-07-01T00:00:00Z,2027-06-30T00:00:00Z,1094,ocds-9t57fa-75088,ocds-9t57fa-75088-2023-11-23T00:00:00Z
4343,DHA16-2023,2026-02-09T10:53:12Z,Appointment of a service provider for the provision of media monitoring services for a period of thirty-six (36) months,active,23820,1132839,ZAR,2027-03-31T00:00:00Z,2024-04-01T00:00:00Z,2027-03-31T00:00:00Z,1094,ocds-9t57fa-76119,ocds-9t57fa-76119-2023-12-01T00:00:00Z
2113,0659205326,2024-08-14T09:38:27Z,"Supply, delivery and construction of a shearing shed with small stock dipping tank, shearing shed equipment and ablution facilities at Zweliyazuza/Colose in Mbashe local municipality, Amathole District ",active,23517,0,ZAR,2024-08-25T00:00:00Z,2024-04-25T00:00:00Z,2024-08-25T00:00:00Z,122,ocds-9t57fa-76902,ocds-9t57fa-76902-2023-12-08T00:00:00Z
