id,title,dateSigned,description,status,awardID,value_amount,value_currency,period_endDate,period_startDate,period_maxExtentDate,period_durationInDays,main_ocid,main_id
2014,DSDP29/23,2024-07-19T11:39:45Z,Supply and delivery of food parcels to destitute individuals and families in Capricorn District of the Limpopo Province for a period of thirty-six (36) months,active,31100,6520700,ZAR,2027-06-30T00:00:00Z,2024-07-01T00:00:00Z,2027-06-30T00:00:00Z,1094,ocds-9t57fa-67494,ocds-9t57fa-67494-2023-09-15T00:00:00Z
1203,3100034416,2023-09-26T12:33:00Z,"RFX: 6000022934 SUPPLY AND DELIVER OFFICE CHAIRS, BROOKLYN",active,16895,150000,ZAR,2024-03-25T00:00:00Z,2023-09-06T00:00:00Z,2024-03-25T00:00:00Z,201,ocds-9t57fa-68390,ocds-9t57fa-68390-2023-08-04T00:00:00Z
1541,ENG017/2023,2024-02-26T15:47:41Z,ENG017 OF 2023 :SUPPLY AND DELIVERY OF ARC FLASH SUIT ATPV,active,23833,200000,ZAR,2025-02-07T00:00:00Z,2024-02-07T00:00:00Z,2025-02-07T00:00:00Z,366,ocds-9t57fa-69607,ocds-9t57fa-69607-2023-10-06T00:00:00Z
3913,CON008/2024/25,2025-10-28T09:12:34Z,"The appointment of a service provider to provide the National Energy Regulator of South Africa (NERSA) with National, international Electronic Newspapers, and Magazines for a period of four (4) years.",active,23960,2684800,ZAR,2028-06-29T00:00:00Z,2024-06-30T00:00:00Z,2028-06-29T00:00:00Z,1460,ocds-9t57fa-69656,ocds-9t57fa-69656-2023-10-06T00:00:00Z
1571,T6/2024,2024-03-14T11:18:24Z,"SUPPLY, REPLACE AND SERVICE OF FIRE EXTINGUISHERS S FOR A PERIOD OF 3 YEARS",active,24899,194905,ZAR,2027-02-26T00:00:00Z,2024-03-01T00:00:00Z,2027-02-26T00:00:00Z,1092,ocds-9t57fa-72032,ocds-9t57fa-72032-2023-10-27T00:00:00Z
1575,T10/2024,2024-03-14T11:25:20Z,CONSTRUCTION OF A NEW ABLUTION UNIT AND EXTENTION OF EXISTING PAVILION AT THE GLASKASTEEL IN BREDASDORP,active,24911,1505695,ZAR,2024-06-28T00:00:00Z,2024-02-20T00:00:00Z,2024-06-28T00:00:00Z,129,ocds-9t57fa-73578,ocds-9t57fa-73578-2023-11-10T00:00:00Z
3951,SCMU6-22/23-0019,2025-10-31T14:41:06Z,"PROVISIONING OF PROJECT MANAGEMENT SERVICE(S) WHICH SHALL INCLUDE
PROCUREMENT, WAREHOUSING, INVENTORY MANAGEMENT (FURNITURE) AND DELIVERY OF 
BOTH ELECTRONIC AND PAPER LEARNING AND TEACHING SUPPORT MATERIAL (LTSM AND E-
LTSM) FOR A PERIOD OF THREE (3) YEARS WITH AN OPTION TO RENEW THE CONTRACT FOR
A PERIOD NOT LONGER THAN TWO YEARS AT THE DISCRETION OF THE EASTERN CAPE
DEPARTMENT OF EDUCATION “ECDoE” INFORMED BY BUDGET AVAILABILITY, THE NEED
INCLUDING THE PERFORMANCE OF THE SERVICE PROVIDER.
",active,47700,253976661,ZAR,2026-08-02T00:00:00Z,2023-08-02T00:00:00Z,2026-08-02T00:00:00Z,1096,ocds-9t57fa-122839,ocds-9t57fa-122839-2023-02-03T00:00:00Z
1028,FIN010/2023,2023-06-23T10:47:54Z,"SUPPLY AND DELIVERY OFFICE FURNITURE FOR COMMITTEE ROOM, FINANCIAL SERVICES, GEORGE MUNICIPALITY",active,12829,172454,ZAR,2023-06-30T00:00:00Z,2023-06-08T00:00:00Z,2023-06-30T00:00:00Z,22,ocds-9t57fa-51888,ocds-9t57fa-51888-2023-04-14T00:00:00Z
3004,SCMU3-23/24-0048,2025-02-06T11:16:24Z,"CALL FOR EXPRESSION OF INTEREST FOR THE ESTABLISHMENT OF A PANEL OF BUILT ENVIRONMENT PROFESSIONAL SERVICE PROVIDERS AND CONTRACTORS FOR THE DESIGN, MANUFACTURE, SUPPLY, DELIVERY, ERECTION, INSTALLATION AND COMMISSIONING OF HEALTH FACILITIES IN EIGHT (8) DISTRICTS IN THE EASTERN CAPE PROVINCE UTILIZING ALTERNATIVE BUILDING TECHNOLOGIES(ABT) FOR A PERIOD OF THIRTY-SIX (36) MONTHS",active,42656,0,ZAR,2027-02-28T00:00:00Z,2024-03-01T00:00:00Z,2027-02-28T00:00:00Z,1094,ocds-9t57fa-52595,ocds-9t57fa-52595-2023-04-22T00:00:00Z
2383,P1/AUX/06/23,2024-10-08T17:06:15Z,"SUPPLY, DELIVERY, REMOVAL AND INSTALLATION OF LED LIGHT BULBS @ LADYSMITH, NEWCASTLE, VRYHEID & DUNDEE",active,31176,50000,ZAR,2024-07-31T00:00:00Z,2023-08-01T00:00:00Z,2024-07-31T00:00:00Z,365,ocds-9t57fa-53585,ocds-9t57fa-53585-2023-05-06T00:00:00Z
1315,P3/ID/01/23,2023-10-25T11:26:52Z,"APPOINTMENT OF A SERVICE PROVIDER TO CONDUCT TRAINING IN THE INSTALLATION, MAINTENANCE, AND MONITORING OF SOLAR PHOTOVOLTAIC (PV) PANELS",active,18387,985096,ZAR,2023-12-31T00:00:00Z,2023-10-01T00:00:00Z,2023-12-31T00:00:00Z,91,ocds-9t57fa-57137,ocds-9t57fa-57137-2023-06-10T00:00:00Z
2898,1M-25714,2025-01-17T13:26:40Z,"Surface repairs to roads, sidewalks, and trench reinstatements as and when required in the West Region of eThekwini Municipality for 24 months",active,40871,10291620,ZAR,0001-01-01T00:00:00Z,0001-01-01T00:00:00Z,0001-01-01T00:00:00Z,0,ocds-9t57fa-62874,ocds-9t57fa-62874-2023-08-11T00:00:00Z
1844,FIN023/2023q,2024-05-17T13:39:53Z,"PURCHASE OF OFFICE CONTAINERS AND STORAGE CONTAINERS, AS AND WHEN REQUIRED, FROM DATE OF APPOINTMENT UNTIL 30 JUNE 2026",active,28416,350000,ZAR,2026-06-30T00:00:00Z,2024-04-18T00:00:00Z,2026-06-30T00:00:00Z,803,ocds-9t57fa-64674,ocds-9t57fa-64674-2023-08-24T00:00:00Z
2003,OR-001338,2024-07-16T10:14:35Z,"APPOINTMENT OF SERVICE PROVIDER TO UNDERTAKE RESEARCH ON CHALLENGES, BUSINESS OPPORTUNITIES, AND SUPPORT REQUIRED BY MSMEs AND CO-OPERATIVES IN THE NATIONAL PRIORITY SECTORS FOCUSING ON THE SHORT, MEDIUM AND LONG TERMS.",active,30538,726480,ZAR,2024-10-31T00:00:00Z,2024-04-01T00:00:00Z,2024-10-31T00:00:00Z,213,ocds-9t57fa-65703,ocds-9t57fa-65703-2023-09-01T00:00:00Z
4340,DHA13-2023,2026-02-09T10:27:43Z,"The appointment of a service provider for the supply of backup generators, uninterrupted power supply units (ups), air conditioners, solar system, inverters, general electrical works and water tanks in the Department of Home Affairs (DHA) offices including health facilities, digitisation sites, ports of entry of the Border Management Authority (BMA), and refugee centres in all nine (9) provinces for a period of three (3) years, as and when required, with an option to extend and /renew the contract for further two (2) years subject to satisfactory performance and availability of funds.",active,20193,0,ZAR,2027-01-01T00:00:00Z,2024-01-02T00:00:00Z,2027-01-01T00:00:00Z,1095,ocds-9t57fa-66461,ocds-9t57fa-66461-2023-09-08T00:00:00Z
2592,SCMU15-23/24-004,2024-11-12T09:58:09Z,Rendering of printing service and specific promotional items for the Eastern Cape Department of Community Safety over a period of three (3) years (Re-advertisement) ,active,20538,3000000,ZAR,2026-12-31T00:00:00Z,2024-01-01T00:00:00Z,2026-12-31T00:00:00Z,1095,ocds-9t57fa-69639,ocds-9t57fa-69639-2023-10-06T00:00:00Z
1442,BA064/2023q,2023-12-19T15:59:53Z,"BA064/2023q – Supply, Delivery and Installation of Wall and Floor Tiles and Related Work for the Upgrading of Restrooms at Blanco Community Hall, George",active,20541,123871,ZAR,2024-06-30T00:00:00Z,2023-12-12T00:00:00Z,2024-06-30T00:00:00Z,201,ocds-9t57fa-72053,ocds-9t57fa-72053-2023-10-27T00:00:00Z
2623,01,2024-11-15T09:38:22Z,"CONSTRUCTION OF ZWELIHLE MULTIPURPOSE COMMUNITY CENTRE AT GOSS HILL
REQUIRED GRADING 6GB OR HIGHER
",active,25792,16120238,ZAR,2025-04-21T00:00:00Z,2024-05-22T00:00:00Z,2025-04-21T00:00:00Z,334,ocds-9t57fa-76828,ocds-9t57fa-76828-2023-12-08T00:00:00Z
4818,NC/SOC/010/2023,2026-03-27T12:26:23Z,"RENDERING OF CLEANING,CAR WASH & GARDEN SERVICES AT THE JOHN TAOLO GAETSEWE DISTRICT,FOR A PERIOD OF 36 MONTHS",active,66070,5534718,ZAR,2027-02-28T00:00:00Z,2024-03-01T00:00:00Z,2027-02-28T00:00:00Z,1094,ocds-9t57fa-50119,ocds-9t57fa-50119-2023-03-24T00:00:00Z
1763,1R-24551,2024-04-26T15:20:24Z,"Flood damage remediation - Str 120183, Phoenix Industrial Park, roadworks and bridge superstructure: Ward 46 & 48",active,27087,49695024,ZAR,2024-09-27T00:00:00Z,2023-10-12T00:00:00Z,2024-09-27T00:00:00Z,351,ocds-9t57fa-56045,ocds-9t57fa-56045-2023-06-02T00:00:00Z
4254,460001645,2026-01-28T11:55:03Z,"PROVISION TO PROVIDE HOUSEKEEPING, HYGIENE, AND LAUNDRY SERVICES AT DIDIMA RESORT FOR A PERIOD OF FIVE (05) YEARS",active,19910,15663000,ZAR,2029-02-01T00:00:00Z,2024-02-01T00:00:00Z,2029-02-01T00:00:00Z,1827,ocds-9t57fa-56228,ocds-9t57fa-56228-2023-06-02T00:00:00Z
3058,SCMU3-23/24-0219-CMH,2025-02-12T14:58:12Z,"Appointment of service providers for the provision of Security Services at Cecilia Makiwane Regional Hospital, in the Eastern Cape Department of Health for a period of 36 months",active,43300,71609286,ZAR,2027-01-31T00:00:00Z,2024-02-01T00:00:00Z,2027-01-31T00:00:00Z,1095,ocds-9t57fa-60302,ocds-9t57fa-60302-2023-07-14T00:00:00Z
4901,4660017108,2026-03-31T19:07:09Z,TERMS OF REFERENCE TO APPOINT A SERVICE PROVIDER TO CONDUCT A TECHNICAL AND APPLICATION ASSESSMENT AND MAINTENANCE FOR THE GAUTENG LIQUOR BOARD AUTOMATION SYSTEM FOR A PERIOD OF THIRTY SIX (36) MONTHS ,pending,20320,7416000,ZAR,2027-02-23T00:00:00Z,2024-02-24T00:00:00Z,2027-02-23T00:00:00Z,1095,ocds-9t57fa-60424,ocds-9t57fa-60424-2023-07-21T00:00:00Z
4938,CDC/299/23,2026-04-07T15:15:56Z,"REPAIRS & RENOVATIONS AT IZIKO PRIMARY SCHOOL IN AMAJUBA DISTRICT, KWAZULU-NATAL",active,21304,23044101,ZAR,2026-02-04T00:00:00Z,2023-12-13T00:00:00Z,2026-02-04T00:00:00Z,784,ocds-9t57fa-61627,ocds-9t57fa-61627-2023-07-28T00:00:00Z
1232,3100033991,2023-10-04T09:43:48Z,Installation of Blinds,active,17265,310442,ZAR,2023-10-15T00:00:00Z,2023-07-31T00:00:00Z,2023-10-15T00:00:00Z,76,ocds-9t57fa-61791,ocds-9t57fa-61791-2023-07-28T00:00:00Z
1918,1C-25098,2024-06-18T11:57:31Z,Supply and delivery of x70 pistols for eThekwini Metro Police Services,active,29572,999810,ZAR,2025-02-28T00:00:00Z,2024-02-28T00:00:00Z,2025-02-28T00:00:00Z,366,ocds-9t57fa-67998,ocds-9t57fa-67998-2023-09-22T00:00:00Z
1808,WS-7740,2024-05-06T14:38:37Z,"Southern Aqueduct Upgrade: Work package #01
Southern Aqueduct Upgrade: Work package #02",active,27481,220000000,ZAR,2027-01-31T00:00:00Z,2024-01-31T00:00:00Z,2027-01-31T00:00:00Z,1096,ocds-9t57fa-68111,ocds-9t57fa-68111-2023-09-22T00:00:00Z
2215,WS-7424,2024-09-11T08:38:39Z,Helen Joseph Sewer Replacement,active,34518,2773945,ZAR,2024-12-31T00:00:00Z,2024-08-01T00:00:00Z,2024-12-31T00:00:00Z,152,ocds-9t57fa-69435,ocds-9t57fa-69435-2023-10-06T00:00:00Z
5371,13427,2026-05-14T10:07:17Z,APPOINTMENT OF A SERVICE PROVIDER FOR THE PROVISION OF ADOBE LICENSES FOR TCTA (TRANS CALEDON TUNNEL AUTHORITY) FOR A PERIOD OF 36 MONTHS,active,20628,3872352,ZAR,2026-12-21T00:00:00Z,2023-12-22T00:00:00Z,2026-12-21T00:00:00Z,1095,ocds-9t57fa-72742,ocds-9t57fa-72742-2023-11-03T00:00:00Z
2211,1T-26451,2024-09-11T08:25:45Z,Pinetown Transit Oriented Development (TOD) Implementation Plan,active,34515,6433215,ZAR,2026-06-30T00:00:00Z,2024-07-01T00:00:00Z,2026-06-30T00:00:00Z,729,ocds-9t57fa-74489,ocds-9t57fa-74489-2023-11-17T00:00:00Z
3339,NHC/08/11/2023,2025-04-23T15:03:22Z,"PROVISION OF TRAVEL MANAGEMENT SERVICES FOR THE NATIONAL HERITAGE COUNCIL FOR A PERIOD OF 36 MONTHS (Date extended)
Pricing schedule added.",active,28051,12000000,ZAR,2027-05-19T00:00:00Z,2024-05-20T00:00:00Z,2027-05-19T00:00:00Z,1094,ocds-9t57fa-75089,ocds-9t57fa-75089-2023-11-23T00:00:00Z
1723,4400004560,2024-04-10T18:10:20Z,Appointment of a Service Provider for the Provision of Digital Forensics Review Platform Software Solution,active,26090,2315537,ZAR,2025-03-31T00:00:00Z,2024-03-27T00:00:00Z,2025-03-31T00:00:00Z,369,ocds-9t57fa-77436,ocds-9t57fa-77436-2023-12-14T00:00:00Z
1931,SCMU1-23/24-0001,2024-06-20T12:12:11Z,"APPOINTMENT OF A SERVICE PROVIDER FOR THE PROVISION OF LIVESTREAMING & AUDIOVISUAL
SERVICES FOR A PERIOD OF TWENTY-FOUR (24) MONTHS
",active,29770,7439600,ZAR,2025-06-06T00:00:00Z,2023-06-07T00:00:00Z,2025-06-06T00:00:00Z,730,ocds-9t57fa-91682,ocds-9t57fa-91682-2023-04-06T00:00:00Z
1930,SCMU1-23/24-0001,2024-06-20T11:23:49Z,"APPOINTMENT OF A SERVICE PROVIDER FOR THE PROVISION OF LIVESTREAMING & AUDIOVISUAL
SERVICES FOR A PERIOD OF TWENTY-FOUR (24) MONTHS
",active,29770,0,ZAR,2025-06-06T00:00:00Z,2023-06-07T00:00:00Z,2025-06-06T00:00:00Z,730,ocds-9t57fa-91682,ocds-9t57fa-91682-2023-04-06T00:00:00Z
2321,1R-26966,2024-10-02T10:43:09Z,Old Richmond Road Sidewalk: Wards 13 and 17,active,36037,982928,ZAR,0001-01-01T00:00:00Z,0001-01-01T00:00:00Z,0001-01-01T00:00:00Z,0,ocds-9t57fa-77592,ocds-9t57fa-77592-2023-12-18T00:00:00Z
3000,SCMU6-23/24-0003,2025-02-05T12:37:40Z,"Supply of expert Mathematics and Physical Science Grade 10, 11 and 12 teachers to teach in the identified schools and provide tutoring and revision classes. The teacher will equally be of use to support vacation classes and incubation centers until the completion of the NSC Grade12final examinations in the Eastern Cape Department of Education (ECDoE) for a period contract of three (3) years. The model of support will be resident based.
",active,31227,0,ZAR,2027-07-09T00:00:00Z,2024-07-10T00:00:00Z,2027-07-09T00:00:00Z,1094,ocds-9t57fa-77672,ocds-9t57fa-77672-2023-12-19T00:00:00Z
2294,P1/AUX/04/23,2024-09-19T15:39:21Z,Fumigation & Pest Control services,active,35537,105979,ZAR,2026-07-31T00:00:00Z,2023-08-01T00:00:00Z,2026-07-31T00:00:00Z,1095,ocds-9t57fa-102213,ocds-9t57fa-102213-2023-06-15T00:00:00Z
3149,SCMU6-22/23-0019,2025-03-06T13:34:24Z,"SCMU6_22/23-0019: REQUEST FOR PROPOSAL FROM REPUTABLY QUALIFIED SERVICE PROVIDER FOR PROVISIONING OF PROJECT MANAGEMENT SERVICES, WHICH SHALL INCLUDE PROCUREMENT, WAREHOUSING, INVENTORY MANAGEMENT (FURNITURE) AND DELIVERY OF BOTH ELECTRONIC AND PAPER LEARNING AND TEACHING SUPPORT MATERIAL (LTSM AND ELTSM) FOR A PERIOD OF THREE(3) YEARS WITH AN OPTION TO EXTEND THE CONTRACT FOR A PERIOD OF NOT MORE THAN 2 YEARS AT THE DESCRETION OF THE EASTERN CAPE DEPARTMENT OF EDUCATION,INFORMED BY THE BUDGET AVAILABILITY , THE NEED , INCLUDING THE PERFOMANCE OF THE SERVICE PROVIDER.",active,44487,253976661,ZAR,2026-08-03T00:00:00Z,2023-08-02T00:00:00Z,2026-08-03T00:00:00Z,1097,ocds-9t57fa-116690,ocds-9t57fa-116690-2023-03-03T00:00:00Z
995,T23/2023,2023-05-29T07:14:36Z,UPGRADING OF BREDASDORP WATER TREATMENT WORKS,active,11829,3220464,ZAR,2023-06-30T00:00:00Z,2023-05-29T00:00:00Z,2023-06-30T00:00:00Z,32,ocds-9t57fa-45250,ocds-9t57fa-45250-2023-01-26T00:00:00Z
1127,AI-457867,2023-08-24T13:46:12Z,APPOINTMENT OF A SERVICE PROVIDER FOR THE DEVELOPMENT OF AN AUTOMATED JOB EVALUATION AND JOB GRADING SYSTEM FOR THE PUBLIC SERVICE.,active,11033,12610258,ZAR,2028-08-09T00:00:00Z,2023-08-10T00:00:00Z,2028-08-09T00:00:00Z,1826,ocds-9t57fa-45295,ocds-9t57fa-45295-2023-01-27T00:00:00Z
1089,T29/2023,2023-07-27T08:20:16Z,THE PROVISION OF SOFTWARE LICENCES AND RENTAL OF EQUIPMENT FOR TRAFFIC- AND LAW ENFORCEMENT CONTRAVENTION SYSTEM,active,14272,5680219,ZAR,2026-06-30T00:00:00Z,2023-07-01T00:00:00Z,2026-06-30T00:00:00Z,1095,ocds-9t57fa-50753,ocds-9t57fa-50753-2023-03-30T00:00:00Z
873,3100033357,2023-04-05T11:13:59Z,"Supply and delivery of Eco pole legs, link plates and self tapping screws ",active,10206,301750,ZAR,2023-07-03T00:00:00Z,2023-03-29T00:00:00Z,2023-07-03T00:00:00Z,96,ocds-9t57fa-51264,ocds-9t57fa-51264-2023-02-24T00:00:00Z
1043,BA076/2022,2023-07-03T10:13:55Z,RENTING OF OFF-SITE STORAGE FOR GEORGE MUNICIPALITY FOR A PERIOD OF SIX (6) MONTHS FROM DATE OF APPOINTMENT,active,13061,177604,ZAR,2023-12-20T00:00:00Z,2023-06-21T00:00:00Z,2023-12-20T00:00:00Z,182,ocds-9t57fa-51893,ocds-9t57fa-51893-2023-04-14T00:00:00Z
960,6000021118,2023-04-25T11:55:50Z,Day To Day Maintenace H-Vac,active,10901,849528,ZAR,2025-03-17T00:00:00Z,2023-03-17T00:00:00Z,2025-03-17T00:00:00Z,731,ocds-9t57fa-52451,ocds-9t57fa-52451-2023-02-10T00:00:00Z
1979,SCMU12-23/24-0001,2024-07-11T16:21:33Z,Provision of ICT Audits and automated vulnerability risk assessments ( IT infrastructure and network discovery) for a period of five (5) years for various Eastern Cape Departments,active,15623,0,ZAR,2028-03-31T00:00:00Z,2023-08-28T00:00:00Z,2028-03-31T00:00:00Z,1677,ocds-9t57fa-53952,ocds-9t57fa-53952-2023-05-12T00:00:00Z
1231,T45/2023,2023-10-03T07:44:59Z,UPGRADING OF SUIDERSTRAND ROAD PHASE 3,active,17168,2196758,ZAR,2023-12-30T00:00:00Z,2023-10-03T00:00:00Z,2023-12-30T00:00:00Z,88,ocds-9t57fa-57660,ocds-9t57fa-57660-2023-06-15T00:00:00Z
3624,SCMU10-23/24-0011,2025-08-05T12:34:40Z,PROVISION OF PROFESSIONAL SECURITY SERVICES OF CANZIBE HOSPITAL ROAD FOR A PERIOD OF 36 MONTHS,active,29207,14059351,ZAR,2027-02-28T00:00:00Z,2024-03-01T00:00:00Z,2027-02-28T00:00:00Z,1094,ocds-9t57fa-64106,ocds-9t57fa-64106-2023-08-18T00:00:00Z
1639,BS/2023/CON497,2024-03-19T09:57:46Z,"APPOINTMENT OF SERVICE PROVIDER TO PROVIDE SERVICES FOR MIGRATION OF ON-PREMISES FILE SERVER TO MICROSOFT SHAREPOINT ONLINE AND 
IMPLEMENTATION OF MICROSOFT SHAREPOINT ONLINE FOR DOCUMENT MANAGEMENT AND SUPPORT",active,23232,392610,ZAR,2025-03-07T00:00:00Z,2024-03-08T00:00:00Z,2025-03-07T00:00:00Z,364,ocds-9t57fa-64580,ocds-9t57fa-64580-2023-08-25T00:00:00Z
1141,4400004419,2023-08-25T10:31:56Z,D2D Electrical maintenance to Sars KZN Northern offices.,active,15509,250000,ZAR,2024-07-24T00:00:00Z,2023-07-25T00:00:00Z,2024-07-24T00:00:00Z,365,ocds-9t57fa-64825,ocds-9t57fa-64825-2023-06-15T00:00:00Z
3002,SCMU3-23/24-0397-HO,2025-02-06T10:47:40Z,"PROCUREMENT OF A PROJECT MANAGEMENT UNIT (PMU) SERVICE PROVIDER TO 
PROVIDE PROGRAM & PROJECT MANAGEMENT SERVICES FOR 
PLANNED AND UNPLANNED BUILDINGS RELATED MAINTENANCE 
SERVICES",active,39252,118551491,ZAR,2029-04-15T00:00:00Z,2024-04-16T00:00:00Z,2029-04-15T00:00:00Z,1825,ocds-9t57fa-64937,ocds-9t57fa-64937-2023-08-25T00:00:00Z
1143,3100033704,2023-08-29T05:47:18Z,Day to day Plumbing maintenance,active,15566,250100,ZAR,2023-08-31T00:00:00Z,2023-06-06T00:00:00Z,2023-08-31T00:00:00Z,86,ocds-9t57fa-65132,ocds-9t57fa-65132-2023-05-05T00:00:00Z
1777,ZNB101/2023/24HSE,2024-04-30T10:26:10Z,"PROVISION OF 24-HOUR SECURITY GUARDING SERVICES TO THE DEPARTMENT OF HUMAN SETTLEMENTS, KING CETSHWAYO DISTRICT OFFICE, 17 TURNBULL STREET EMPANGENI, FOR A PERIOD OF THIRTY-SIX (36) MONTHS.  ",active,25719,0,ZAR,2027-05-31T00:00:00Z,2024-06-01T00:00:00Z,2027-05-31T00:00:00Z,1094,ocds-9t57fa-67460,ocds-9t57fa-67460-2023-09-15T00:00:00Z
3046,SCMU5-23/24-0085,2025-02-11T15:51:28Z,"WATER INFRASTRUCTURE AUGMENTATION, BOREHOLE DRILLING AND EQUIPPING AT BEDFORD ORTHOPEDIC HOSPITAL, MTHATHA",active,43173,4116721,ZAR,2026-06-02T00:00:00Z,2024-06-03T00:00:00Z,2026-06-02T00:00:00Z,729,ocds-9t57fa-68153,ocds-9t57fa-68153-2023-09-22T00:00:00Z
1245,58118,2023-10-05T13:30:29Z,Placement Fee for Portfolio Head Municipal Services ,active,17349,269545,ZAR,2023-08-14T00:00:00Z,2023-08-11T00:00:00Z,2023-08-14T00:00:00Z,3,ocds-9t57fa-69371,ocds-9t57fa-69371-2023-08-11T00:00:00Z
1247,56512,2023-10-09T08:51:56Z,Hygiene services for National Office : 1 May 2023 to 31 October 2025 (18 Months),active,17356,702010,ZAR,2025-10-31T00:00:00Z,2022-05-01T00:00:00Z,2025-10-31T00:00:00Z,1279,ocds-9t57fa-69397,ocds-9t57fa-69397-2023-04-28T00:00:00Z
1371,COM035/2023,2023-11-23T11:03:01Z,COM035 OF 2023 : the SUPPLY AND DELIVERY OF VARIOUS FIRE FIGHTING AND RESCUE EQUIPMENT FOR OPERATIONAL PURPOSES,active,19678,92367,ZAR,2024-06-30T00:00:00Z,2023-11-22T00:00:00Z,2024-06-30T00:00:00Z,221,ocds-9t57fa-69619,ocds-9t57fa-69619-2023-10-06T00:00:00Z
3634,SCMU10-23/24-0022,2025-08-05T14:43:16Z,"APPOINTMENT OF A PROFESSIONAL SECURITY SERVICE PROVIDER FOR THE PROVISION OF SECURITY SERVICES AT MTHATHA AIRPORT FOR A CONTRACT PERIOD OF 36
MONTHS.",active,45339,26036118,ZAR,2027-07-30T00:00:00Z,2024-08-01T00:00:00Z,2027-07-30T00:00:00Z,1093,ocds-9t57fa-69658,ocds-9t57fa-69658-2023-10-06T00:00:00Z
1573,T14/2024,2024-03-14T11:23:51Z,UPGRADING OF EXISTING WATER & SEWER INFRASTRUCTURE,active,24909,3821452,ZAR,2024-06-28T00:00:00Z,2024-03-25T00:00:00Z,2024-06-28T00:00:00Z,95,ocds-9t57fa-72035,ocds-9t57fa-72035-2023-10-27T00:00:00Z
2443,7E-23409,2024-10-16T09:57:55Z,Request for Proposals for the leasing of a building (kiosk) situated on Proposed Lease on Remainder of Erf 1 Durban as depicted on SJ Plan No. 4769/3 measuring 56m² for commercial purposes for a period of nine years and eleven months with no right of renewal,active,36769,2380000,ZAR,2033-06-30T00:00:00Z,2024-07-31T00:00:00Z,2033-06-30T00:00:00Z,3256,ocds-9t57fa-73518,ocds-9t57fa-73518-2023-11-10T00:00:00Z
2056,Infra20,2024-07-24T14:55:03Z,Upgrade And Renovation Of ECDC Office In Queenstown,active,22241,1837022,ZAR,2024-09-18T00:00:00Z,2024-03-19T00:00:00Z,2024-09-18T00:00:00Z,183,ocds-9t57fa-73618,ocds-9t57fa-73618-2023-11-10T00:00:00Z
2058,Infra22,2024-07-24T15:02:43Z,"REPAIRS, REFURBISHMENT OF SITE 8, 12 AND 21 IN DIMBAZA INDUSTRIAL PARK.",active,25561,27516777,ZAR,2024-12-04T00:00:00Z,2024-06-18T00:00:00Z,2024-12-04T00:00:00Z,169,ocds-9t57fa-75381,ocds-9t57fa-75381-2023-11-24T00:00:00Z
3083,SCMU5-23/24-0089,2025-02-19T11:15:39Z,RENOVATIONS AND UPGRADE OF OFFICE SPACE AND COMMON AREAS IN BOTHA SIGCAU,active,43175,35735555,ZAR,2026-04-30T00:00:00Z,2024-04-30T00:00:00Z,2026-04-30T00:00:00Z,730,ocds-9t57fa-76770,ocds-9t57fa-76770-2023-12-08T00:00:00Z
1756,FIN032/2023,2024-04-25T22:09:27Z,"APPOINTMENT OF A SERVICE PROVIDER TO MANAGE, RENEW AND PURCHASE SOFTWARE LICENSING AND HARDWARE ON AN AD-HOC BASIS FROM DATE OF APPOINTMENT UNTIL 30 JUNE 2026",active,27353,12744520,ZAR,2027-06-30T00:00:00Z,2024-04-11T00:00:00Z,2027-06-30T00:00:00Z,1175,ocds-9t57fa-77303,ocds-9t57fa-77303-2023-12-14T00:00:00Z
1503,P2/CO-OPS/03/23,2024-02-04T13:20:04Z,APPOINTMENT A SERVICE PROVIDER TO PROVIDE BAKERY MENTORSHIP AND COACHING TO VUKA UYIBAMBE BAKERY,active,22105,219971,ZAR,2023-11-22T00:00:00Z,2023-10-23T00:00:00Z,2023-11-22T00:00:00Z,30,ocds-9t57fa-80254,ocds-9t57fa-80254-2023-09-15T00:00:00Z
1690,59873,2024-04-02T13:09:04Z,Appointment of a service provider for the provision Municipal assistance: Joe Marolong,active,25790,149932,ZAR,2024-03-31T00:00:00Z,2023-12-14T00:00:00Z,2024-03-31T00:00:00Z,108,ocds-9t57fa-85264,ocds-9t57fa-85264-2023-09-15T00:00:00Z
4270,RFQ 01/09/2023,2026-01-29T13:26:47Z,REQUEST FOR QUOTATION (RFQ): HYGIENE SERVIRCES AT DCS OFFICE BLOCK,active,59701,785100,ZAR,2026-10-13T00:00:00Z,2023-10-13T00:00:00Z,2026-10-13T00:00:00Z,1096,ocds-9t57fa-143807,ocds-9t57fa-143807-2023-09-15T00:00:00Z
2167,P1/AUX/03/23,2024-08-27T11:20:58Z,"SUPPLY, DELIVERY, REMOVAL AND INSTALLATION LED LIGHT BULBS @IXOPO AND PORT SHEPSTONE",active,31179,200000,ZAR,2024-07-31T00:00:00Z,2023-08-01T00:00:00Z,2024-07-31T00:00:00Z,365,ocds-9t57fa-53580,ocds-9t57fa-53580-2023-05-06T00:00:00Z
4260,4600001623,2026-01-28T13:16:29Z,HIRE OF HELICOPTER COMPLETE WITH PILOT FOR THE CAPTURE AND MANAGEMENT OF GAME FOR FIVE (5) YEAR PERIOD,active,27024,15803875,ZAR,2029-01-01T00:00:00Z,2024-01-01T00:00:00Z,2029-01-01T00:00:00Z,1827,ocds-9t57fa-59614,ocds-9t57fa-59614-2023-07-07T00:00:00Z
1439,RFP 19/2023,2023-12-19T08:41:54Z,Provision of Graph Database Management Software Tool with Maintenance and Support,active,20520,51357284,ZAR,2029-01-31T00:00:00Z,2024-02-01T00:00:00Z,2029-01-31T00:00:00Z,1826,ocds-9t57fa-59701,ocds-9t57fa-59701-2023-07-07T00:00:00Z
1786,CON0024/2023/24,2024-04-30T17:10:51Z,The appointment of a service provider to assist the National Energy Regulator with the Production of Promotional material for a period of three (3) years,active,20864,1830000,ZAR,2027-03-31T00:00:00Z,2024-04-01T00:00:00Z,2027-03-31T00:00:00Z,1094,ocds-9t57fa-61809,ocds-9t57fa-61809-2023-07-28T00:00:00Z
2899,1M-25713,2025-01-17T13:37:59Z,"Surface repairs to roads, sidewalks, and trench reinstatements as and when required in the South Central Region of eThekwini Municipality for 24 months",active,40868,15081310,ZAR,0001-01-01T00:00:00Z,0001-01-01T00:00:00Z,0001-01-01T00:00:00Z,0,ocds-9t57fa-62872,ocds-9t57fa-62872-2023-08-11T00:00:00Z
1125,EX 21/2023,2023-08-24T10:46:08Z,"Maintenance and support services of Erwin Enterprise Architecture (EA) Software Suite, for a period of five (5) years effective from 01 January 2024 to 31 December 2028 for an estimated amount of R 17 882 022.14 at 15% VAT inclusive.",active,15471,17882022,ZAR,2028-12-31T00:00:00Z,2024-01-01T00:00:00Z,2028-12-31T00:00:00Z,1826,ocds-9t57fa-64614,ocds-9t57fa-64614-2023-08-11T00:00:00Z
2535,1M-25291,2024-11-05T10:28:03Z,Maintenance repairs to roads and stormwater infrastructure as and when required in the ABM areas located within the North Region of eThekwini Municipality for a period of 24 months,active,37872,16069502,ZAR,2025-07-31T00:00:00Z,2024-08-12T00:00:00Z,2025-07-31T00:00:00Z,353,ocds-9t57fa-64746,ocds-9t57fa-64746-2023-08-25T00:00:00Z
1223,4400004456,2023-09-27T12:04:12Z,"The renewal of the Enterprise License Agreement for the current VMWARE software support, subscription and the procurement of additional VMWARE software licenses through the SITA/DELL Framework Agreement",active,16997,43462326,ZAR,2026-08-24T00:00:00Z,2023-09-20T00:00:00Z,2026-08-24T00:00:00Z,1069,ocds-9t57fa-68494,ocds-9t57fa-68494-2023-09-23T00:00:00Z
2557,1H-25872,2024-11-07T09:45:27Z,"The construction of Block F consisting of 80, two-bedroom units at SJ Smith CRU - Ward 75",active,37912,30033656,ZAR,2027-11-24T00:00:00Z,2024-07-24T00:00:00Z,2027-11-24T00:00:00Z,1218,ocds-9t57fa-69421,ocds-9t57fa-69421-2023-10-06T00:00:00Z
1380,DHA15-2023,2023-11-28T08:27:00Z,"PROCUREMENT OF ROUTERS AND SWITCHES WITH SUPPORT AND MAINTENANCE FOR A PERIOD OF
THIRTY SIX (36) MONTHS.",active,19778,26291915,ZAR,2027-02-14T00:00:00Z,2024-02-15T00:00:00Z,2027-02-14T00:00:00Z,1095,ocds-9t57fa-69516,ocds-9t57fa-69516-2023-10-06T00:00:00Z
1570,T5/2024,2024-03-14T11:14:27Z,"REPAIRS, MAINTENANCE, REPLACEMENT & SUPPLY OF NEW AIR CONDITIONERS FOR A PERIOD OF 3 YEARS",active,24896,495568,ZAR,2027-02-26T00:00:00Z,2024-03-01T00:00:00Z,2027-02-26T00:00:00Z,1092,ocds-9t57fa-72030,ocds-9t57fa-72030-2023-10-27T00:00:00Z
2227,7E-22666,2024-09-11T14:42:38Z,"Request for bids for the long-term leasing and development of Erf 11414, 11415, 11416 situated on a Portion of the Remainder of Erf 1 Durban Proposed Erf A and Erf 11418 and 11419 ",active,35023,3750000,ZAR,2040-02-01T00:00:00Z,2024-08-01T00:00:00Z,2040-02-01T00:00:00Z,5662,ocds-9t57fa-73509,ocds-9t57fa-73509-2023-11-10T00:00:00Z
2115,SCMU8-23/24-0100,2024-08-14T10:19:33Z,"Supply, delivery and construction of a shearing shed with small stock dipping tank, shearing shed equipment and ablution facilities at Mbanga in Mbashe local municipality, Amathole District",active,23963,0,ZAR,2024-08-23T00:00:00Z,2024-04-23T00:00:00Z,2024-08-23T00:00:00Z,122,ocds-9t57fa-76901,ocds-9t57fa-76901-2023-12-08T00:00:00Z
