id,title,format,language,description,dateModified,documentType,datePublished,main_ocid,main_id,contracts_id
2a1bdf0e-9892-481f-a044-4eb92f898684.pdf,SCM15-2023-24 GANSBAAI AIRCON FINAL LETTER.pdf,pdf,en,"REPAIRS, MAINTENANCE, REPLACEMENT & SUPPLY OF NEW AIR CONDITIONERS FOR A PERIOD OF 3 YEARS",2024-03-14T11:22:06Z,pdf,2024-03-14T11:14:27Z,ocds-9t57fa-72030,ocds-9t57fa-72030-2023-10-27T00:00:00Z,1570
5f6b2d13-9ab1-463a-a0b6-96a91a0a5d51.pdf,7E-22666 FULLY SIGNED REPORT.pdf,pdf,en,"Request for bids for the long-term leasing and development of Erf 11414, 11415, 11416 situated on a Portion of the Remainder of Erf 1 Durban Proposed Erf A and Erf 11418 and 11419 ",0001-01-01T00:00:00Z,pdf,2024-09-11T14:42:38Z,ocds-9t57fa-73509,ocds-9t57fa-73509-2023-11-10T00:00:00Z,2227
6b12764f-720c-43ff-841f-e775c99a271e.pdf,CCF_000529.pdf,pdf,en,"Supply, delivery and construction of a shearing shed with small stock dipping tank, shearing shed equipment and ablution facilities at Mbanga in Mbashe local municipality, Amathole District",0001-01-01T00:00:00Z,pdf,2024-08-14T10:19:33Z,ocds-9t57fa-76901,ocds-9t57fa-76901-2023-12-08T00:00:00Z,2115
02b4ff3b-68e7-4672-a2c7-3759535c9302.pdf,SLA.pdf,pdf,en,Appointment of Service Provider for Cleaning Service at EDTEA uMzinyathi District Office,0001-01-01T00:00:00Z,pdf,2024-02-16T11:04:34Z,ocds-9t57fa-80274,ocds-9t57fa-80274-2023-10-28T00:00:00Z,1525
74290a7e-287b-4707-8677-bb051679f2da.pdf,CDC-179-23 LOA.pdf,pdf,en,"CONSTRUCTION OF MTHWANE SECONDARY SCHOOL IN HARRY GWALA DISTRICT, KWAZULU-NATAL - 7 GB OR HIGHER",0001-01-01T00:00:00Z,pdf,2026-04-07T12:31:55Z,ocds-9t57fa-57634,ocds-9t57fa-57634-2023-06-15T00:00:00Z,4936
fde8389e-278e-44a4-91e4-a3e459a03d40.pdf,CDC-496-23_Appointment Letter - 03May2024.pdf,pdf,en,PROFESSIONAL CONSULTANCY SERVICES FOR THE CONSTRUCTION THE RETURN EFFLUENT SCHEME FROM THE FWF WASTE WATER TREATMENT WORKS TO THE COEGA SEZ,0001-01-01T00:00:00Z,pdf,2026-04-13T16:56:01Z,ocds-9t57fa-77150,ocds-9t57fa-77150-2023-12-14T00:00:00Z,4983
d9031405-7630-4127-bfe4-31a355cdf9fd.pdf,23 24 0058.pdf,pdf,en,PROCUREMENT OF ARCHITECTURAL SERVICE AND PRINCIPAL AGENT FOR CONSTRUCTION OF EMAXESIBENI OFFICE PRECINCT BLOCK A IN ALFRED NZO DISTRICT,0001-01-01T00:00:00Z,pdf,2026-02-18T09:54:22Z,ocds-9t57fa-145004,ocds-9t57fa-145004-2023-08-04T00:00:00Z,4435
cfdf4e41-2059-425b-9c74-6ba195fc3eec.pdf,CSIR CPS for one-year renewal - signed (1).pdf,pdf,en,SharePoint Storage Expansion (Additional 10TB),0001-01-01T00:00:00Z,pdf,2026-05-12T10:57:30Z,ocds-9t57fa-155611,ocds-9t57fa-155611-2023-01-27T00:00:00Z,5315
75822730-9359-48df-9065-b5ed76567416.pdf,Award - DARD 07-2024.pdf,pdf,en,Appointment of the Panel of Service Providers for the Rehabilitation and Construction of dams in various Districts of KwaZulu Natal for the period of 24 months,0001-01-01T00:00:00Z,pdf,2025-01-22T14:44:39Z,ocds-9t57fa-48096,ocds-9t57fa-48096-2023-03-03T00:00:00Z,2928
44ea2312-bd8f-4418-8aef-7a9a1ff22c80.pdf,COVERING LETTER TO DEPT FOR WATER TANKS.pdf,pdf,en,"APPOINTMENT OF A PANEL OF SERVICE PROVIDERS FOR THE SUPPLY, DELIVERY AND INSTALLATION OF WATER TANKS FOR THE EASTERN CAPE PROVINCIAL GOVERNMENT FOR A PERIOD OF THIRTY - SIX (36) MONTHS AS AND WHEN REQUIRED",0001-01-01T00:00:00Z,pdf,2024-06-21T08:50:34Z,ocds-9t57fa-51739,ocds-9t57fa-51739-2023-04-14T00:00:00Z,1936
fea98b9f-7e2a-49e4-b585-e531edc9ce5a.pdf,Award Letter Zen JV.pdf,pdf,en,APPOINTMENT OF CIVIL ENGINEERING CONTRACTOR FOR THE UPGRADING OF ROAD DR08034 FROM N2 TO R61 VIA CLARKEBURY (20KM) PHASE 1,0001-01-01T00:00:00Z,pdf,2025-07-30T12:28:08Z,ocds-9t57fa-54112,ocds-9t57fa-54112-2023-05-12T00:00:00Z,3611
9fd90b4b-54aa-42ee-bd0f-1cf36ef470f0.pdf,CDC-139-23 LETTER OF APPOINTMENT.pdf,pdf,en,"UPGRADE AND ADDITIONS AT MZINGEZWI SECONDARY SCHOOL IN NDWEDWE, ILEMBE DISTRICT, KWAZULU-NATAL - 7GB ",0001-01-01T00:00:00Z,pdf,2026-03-27T10:03:43Z,ocds-9t57fa-55438,ocds-9t57fa-55438-2023-05-26T00:00:00Z,4807
7283a746-8de0-4fd1-84a4-6b763c1774d7.pdf,signed Addendum report -1H 23557.pdf,pdf,en,"Construction of 40m² top structure units at 
Emaphephetheni Phase 3 Rural Housing Project (284 units per contractor): Ward 02
",0001-01-01T00:00:00Z,pdf,2025-01-17T14:14:50Z,ocds-9t57fa-56048,ocds-9t57fa-56048-2023-06-02T00:00:00Z,2901
d8975592-e9d1-4ac9-bb6e-b017d9fd2979.pdf,SCARF - Sea Technology Services (Pty) Ltd.pdf Y2 and Y3 (1).pdf,pdf,en,Request for Proposals (RFP) The provision of specialised ocean engineering and R&D services to CSIR,0001-01-01T00:00:00Z,pdf,2026-05-12T14:14:02Z,ocds-9t57fa-56288,ocds-9t57fa-56288-2023-06-02T00:00:00Z,5341
0390791a-ec0a-48b4-807c-118f7ec211c0.pdf,7.2 CONTRACT FORM.pdf,pdf,en,"APPOINTMENT OF A SERVICE PROVIDER FOR THE DESIGN, REPLACEMENT, SERVICE, REPAIRS, AND MAINTENANCE OF HVAC/AIR CONDITION SYSTEM TO THE NNR FOR A PERIOD OF THREE (3) YEARS",0001-01-01T00:00:00Z,pdf,2023-11-17T12:59:44Z,ocds-9t57fa-57019,ocds-9t57fa-57019-2023-06-09T00:00:00Z,1360
de38a598-c460-4402-ab67-aedfdcbb693d.pdf,2324 0019 All.pdf,pdf,en,"Appointment of service providers to render Offsite Travel Management Services in respect of Air Travel, Car Hire,
Accommodation, Venues and Conference Facilities for the Department of Public Works & Infrastructure: Head Office for a period of three (3) years",0001-01-01T00:00:00Z,pdf,2025-10-23T16:07:35Z,ocds-9t57fa-58110,ocds-9t57fa-58110-2023-06-23T00:00:00Z,3897
79195a83-36dd-492c-9eb3-bef20a5ef284.PDF,SLA NANDZU 22 09.PDF,PDF,en,TERM CONTRACT FOR CAPACITY BUILDING PROGRAMME OF FARMERS AND BENEFICIARIES ON SOFT AND TECHNICAL SKILLS IN THE LIMPOPO DEPARTMENT OF AGRICULTURE AND RURAL DEVELOPMENT (LDARD) FOR A PERIOD OF THREE (3) YEARS,0001-01-01T00:00:00Z,PDF,2024-06-13T10:52:38Z,ocds-9t57fa-61471,ocds-9t57fa-61471-2023-07-28T00:00:00Z,1878
ced7b630-fc00-4e3e-8c36-7ef0d1c26b5d.pdf,1.  CDC-285-23 -  ZOBUYANE TRADING - LETTER OF APPOINTMENT.pdf,pdf,en,"CONSTRUCTION OF GRADE R CLASSROOMS AT UMBULWANE PRIMARY SCHOOL IN LADYSMITH, UTHUKELA DISTRICT, KWAZULU-NATAL - 5GB or HIGHER
",0001-01-01T00:00:00Z,pdf,2026-03-24T10:05:01Z,ocds-9t57fa-62339,ocds-9t57fa-62339-2023-08-04T00:00:00Z,4712
9bdd8b22-d676-4f93-b9c7-c9b6c1409485.pdf,MMJ Language Solutions MOA.pdf,pdf,en,THE APPOINTMENT OF A SERVICE PROVIDER TO ASSIST THE NATIONAL ENERGY REGULATOR WITH TRANSLATION SERVICES FOR A PERIOD OF THREE (3) YEARS ,0001-01-01T00:00:00Z,pdf,2024-04-30T17:02:02Z,ocds-9t57fa-66621,ocds-9t57fa-66621-2023-09-08T00:00:00Z,1785
aeb82f85-65d3-4213-b4bf-d4e83633ac9e.zip,WS 7715.zip,zip,en,Rehabilitation to Umbilo Wastewater Treatment Works and Upstream Catchment Network – Ward 18,0001-01-01T00:00:00Z,zip,2024-10-02T10:45:35Z,ocds-9t57fa-68107,ocds-9t57fa-68107-2023-09-22T00:00:00Z,2322
0f8109d7-eb8f-4535-8a7c-095548b86698.pdf,DTP01625 - Mahlako-A-Phala investments.pdf,pdf,en,Appointment of a transaction advisor for an energy utility management centre  for Dube TradePort Corporation,0001-01-01T00:00:00Z,pdf,2025-11-21T16:54:11Z,ocds-9t57fa-68292,ocds-9t57fa-68292-2023-09-22T00:00:00Z,4054
fe802270-60be-4060-8e81-e19fb4eb5f89.pdf,Acceptance letter 0158 Specialist.pdf,pdf,en,Provision of cleaning services to Emergency Medical Services in Nelson Mandela Bay Health District for a period of 36 months.,0001-01-01T00:00:00Z,pdf,2024-11-28T14:41:20Z,ocds-9t57fa-68791,ocds-9t57fa-68791-2023-09-29T00:00:00Z,2663
ab2da789-acb2-4e93-93ae-3fb745640a02.pdf,CDC-399-23 LETTER OF APPOINTMENT.pdf,pdf,en,"CONSTRUCTION OF NEW ECDC EDUCATIONAL FACILITIES  AT E.MACEMBE PRIMARY SCHOOL
",0001-01-01T00:00:00Z,pdf,2026-04-09T13:37:37Z,ocds-9t57fa-69517,ocds-9t57fa-69517-2023-10-06T00:00:00Z,4957
7db1cd9e-8ad3-44a4-87a7-d96369237fd4.pdf,WSM GROUP.pdf,pdf,en,"UPGRADING OF ROAD, DR08303, DR08329, DR08308 AND DR08309 FROM R61 AT ST BARNABAS HOSPITAL TO HLULEKA NATURE RESERVE PHASE 2 (32km)",0001-01-01T00:00:00Z,pdf,2025-07-30T14:48:00Z,ocds-9t57fa-70320,ocds-9t57fa-70320-2023-10-13T00:00:00Z,3616
e340b4ff-043b-4898-940e-d99233732b61.pdf,4V-27358 FULLY SIGNED REPORT.pdf,pdf,en,"Construction of incremental services – Roads, footpaths, and stormwater in Bhambayi (Ward 57) (RFS)",0001-01-01T00:00:00Z,pdf,2024-10-15T15:06:32Z,ocds-9t57fa-74470,ocds-9t57fa-74470-2023-11-17T00:00:00Z,2439
adb7d38b-9150-4264-b2c1-b2308d198982.pdf,0632 LOA.pdf,pdf,en,"SCHEDULE MAINTENANCE OF LAUNDRY & ASSOCIATED EQUIPMENT AT CLUSTER FOUR (4) – NELSON MANDELA AND SARAH BAARTMANT DISTRICT – HEALTH FACILITIES  (36 MONTHS)
",0001-01-01T00:00:00Z,pdf,2026-03-12T15:46:56Z,ocds-9t57fa-74610,ocds-9t57fa-74610-2023-11-18T00:00:00Z,4587
f5009002-790b-4748-a5dd-0c9384097383.pdf,Appointment letter - The Facilities Company - NHC-07-11-2023 - Office accommodation.pdf,pdf,en,"RENTAL OF OFFICE ACCOMMODATION FOR THE NATIONAL HERITAGE COUNCIL FOR A PERIOD OF FIVE (5) YEARS (Date extended)
Proposals for Heritage buildings are welcome",0001-01-01T00:00:00Z,pdf,2025-04-23T15:05:40Z,ocds-9t57fa-75088,ocds-9t57fa-75088-2023-11-23T00:00:00Z,3340
50ad7906-6f3b-42f8-9c23-8458c90e5de1.pdf,SBD7.2.pdf,pdf,en,Appointment of a service provider for the provision of media monitoring services for a period of thirty-six (36) months,0001-01-01T00:00:00Z,pdf,2026-02-09T10:53:12Z,ocds-9t57fa-76119,ocds-9t57fa-76119-2023-12-01T00:00:00Z,4343
88e085bd-b80d-4b97-a44e-68338fff9bbe.pdf,CCF_000528.pdf,pdf,en,"Supply, delivery and construction of a shearing shed with small stock dipping tank, shearing shed equipment and ablution facilities at Zweliyazuza/Colose in Mbashe local municipality, Amathole District ",0001-01-01T00:00:00Z,pdf,2024-08-14T09:38:27Z,ocds-9t57fa-76902,ocds-9t57fa-76902-2023-12-08T00:00:00Z,2113
