id,title,dateSigned,description,status,awardID,value_amount,value_currency,period_endDate,period_startDate,period_maxExtentDate,period_durationInDays,main_ocid,main_id
1219,58312,2023-09-27T09:20:31Z,SALGA court application for South African Municipal Workers UNION VS COGTA and SALGA CASE,active,16940,300000,ZAR,2023-09-01T00:00:00Z,2023-08-30T00:00:00Z,2023-09-01T00:00:00Z,2,ocds-9t57fa-68061,ocds-9t57fa-68061-2023-08-18T00:00:00Z
1234,57672,2023-10-05T06:04:01Z,ERA Gifts for Winners and Nominees,active,17063,330000,ZAR,2023-07-17T00:00:00Z,2023-07-14T00:00:00Z,2023-07-17T00:00:00Z,3,ocds-9t57fa-68359,ocds-9t57fa-68359-2023-07-14T00:00:00Z
1943,05/10/2023,2024-06-27T14:59:54Z,SUPPLY AND DELIVER A FIRE TRUCK FOR FIRE AND RESCUE SERVICES,active,22152,1998805,ZAR,0001-01-01T00:00:00Z,0001-01-01T00:00:00Z,0001-01-01T00:00:00Z,0,ocds-9t57fa-69402,ocds-9t57fa-69402-2023-10-05T00:00:00Z
1447,T/ING/042/2023q,2024-01-05T14:09:47Z,T/ING/042/2023q – Supply and Delivery of a New Pipe Inspection Camera,active,20724,114000,ZAR,2024-06-30T00:00:00Z,2024-01-05T00:00:00Z,2024-06-30T00:00:00Z,177,ocds-9t57fa-69571,ocds-9t57fa-69571-2023-10-06T00:00:00Z
3633,SCMU10-23/24-0023,2025-08-05T14:41:04Z,APPOINTMENT OF A PROFESSIONAL SECURITY SERVICEPR OVIDER FOR THE PROVISION OF SECURITY SERVICES AT BHISHO AIRPORT FOR A CONTRACT PERIOD OF 36 MONTHS.,active,41250,8143771,ZAR,2027-12-25T00:00:00Z,2024-12-26T00:00:00Z,2027-12-25T00:00:00Z,1094,ocds-9t57fa-69660,ocds-9t57fa-69660-2023-10-06T00:00:00Z
1572,T7/2024,2024-03-14T11:20:52Z,RENDERING OF SANITARY BINS TO THE CAPE AGULHAS MUNICIPALITY FOR A PERIOD OF 3 YEARS,active,24908,132084,ZAR,2027-02-26T00:00:00Z,2024-03-01T00:00:00Z,2027-02-26T00:00:00Z,1092,ocds-9t57fa-72034,ocds-9t57fa-72034-2023-10-27T00:00:00Z
1964,INFRA 19,2024-07-05T11:39:21Z,"REFURBISHMENT OF ECDC REGIONAL OFFICE WITHIN MTHATHA- EASTERN CAPE

Stage 1: Mandatory Tender Returnable including Local Content and Production
Stage2: Functionality
Stage3: Preferential Procurement Points",active,21163,5117258,ZAR,2024-08-08T00:00:00Z,2024-02-08T00:00:00Z,2024-08-08T00:00:00Z,182,ocds-9t57fa-73610,ocds-9t57fa-73610-2023-11-10T00:00:00Z
2059,Infra23,2024-07-24T15:05:49Z,"REPAIRS & REFURBISHMENT OF SITE 3, IN DIMBAZA INDUSTRIAL PARK",active,25295,94901784,ZAR,2025-03-09T00:00:00Z,2024-03-15T00:00:00Z,2025-03-09T00:00:00Z,359,ocds-9t57fa-76147,ocds-9t57fa-76147-2023-12-01T00:00:00Z
1445,4400004486,2023-12-21T12:56:35Z,D2D PLUMBING,active,20617,650000,ZAR,2024-11-30T00:00:00Z,2023-12-01T00:00:00Z,2024-11-30T00:00:00Z,365,ocds-9t57fa-77693,ocds-9t57fa-77693-2023-10-05T00:00:00Z
1934,SCMU1-23/24-0003,2024-06-20T14:29:56Z,APPOINTMENT OF A SERVICE PROVIDER/S FOR EVENT MANAGEMENT AT OFFICE OF THE PREMIER FOR A PERIOD OF 24 MONTHS,active,29761,1988125,ZAR,2025-11-15T00:00:00Z,2023-11-16T00:00:00Z,2025-11-15T00:00:00Z,730,ocds-9t57fa-91679,ocds-9t57fa-91679-2023-06-16T00:00:00Z
1046,FIN007/2023,2023-07-04T06:43:37Z,FIN007/2023q – RENEWAL OF TREND MICRO APEX ONE LICENSES,active,13096,180000,ZAR,2024-05-01T00:00:00Z,2023-05-02T00:00:00Z,2024-05-01T00:00:00Z,365,ocds-9t57fa-48927,ocds-9t57fa-48927-2023-03-10T00:00:00Z
1522,HEDP003/23/24,2024-02-14T13:27:53Z,"SUPPLY , DELIVERY, INSTALLATION AND MAITANANCE OF A PET-CT SCANNER AND RELATED IMAGINGEQUIPMENT, BUILDING ALTERATION ON THE TERTIARY PLATFORM FOR THE LIMPOPO DEPARTMENT OF HEALTH FOR A PERIOD OF THREE YEARS(36 MONTHS)",active,19023,52262141,ZAR,2026-10-31T00:00:00Z,2023-11-01T00:00:00Z,2026-10-31T00:00:00Z,1095,ocds-9t57fa-53521,ocds-9t57fa-53521-2023-05-05T00:00:00Z
1313,P3/ID/02/23,2023-10-25T11:04:05Z,"APPOINTMENT OF A SERVICE PROVIDER TO DESIGN, SUPPLY, DELIVER, INSTALL, MAINTAIN AND COMMISSION 34.7kwp  GRID TIED SOLAR PHOTOVOLTAIC PANELS AT NATALIA BUILDING ROOFTOP IN PIETERMARITZBURG.",active,14965,853674,ZAR,2023-12-31T00:00:00Z,2023-10-01T00:00:00Z,2023-12-31T00:00:00Z,91,ocds-9t57fa-57139,ocds-9t57fa-57139-2023-06-10T00:00:00Z
3722,SCMU5-23/24-0032,2025-08-21T14:55:23Z,"APPOINTMENT OF SERVICE PROVIDER FOR THE SUPPLY AND DELIVERY OF FURNITURE FOR PRESTIGE HOUSES AS PER
SPECIFICATION TO THE EASTERN CAPE DEPARTMENT OF PUBLIC WORKS & INFRASTRUCTURE",active,53242,11150860,ZAR,2026-02-07T00:00:00Z,2024-02-08T00:00:00Z,2026-02-07T00:00:00Z,730,ocds-9t57fa-58711,ocds-9t57fa-58711-2023-06-30T00:00:00Z
1107,4400004353,2023-08-07T08:39:46Z,"The appointment of a service provider for the supply and delivery of DELL EMC Storage Equipment's at Gauteng, KZN and Western Cape, Free State Limpopo and Mpumalanga",active,14834,59781572,ZAR,2027-03-28T00:00:00Z,2023-03-29T00:00:00Z,2027-03-28T00:00:00Z,1460,ocds-9t57fa-62554,ocds-9t57fa-62554-2023-02-17T00:00:00Z
2906,1M-25711,2025-01-20T09:00:05Z,"Surface repairs to roads, sidewalks, and trench reinstatements as and when required in the North Central Region of eThekwini Municipality for 24 months",active,40869,11736041,ZAR,2027-02-05T00:00:00Z,2024-11-06T00:00:00Z,2027-02-05T00:00:00Z,821,ocds-9t57fa-62871,ocds-9t57fa-62871-2023-08-11T00:00:00Z
1555,E8/2023/2024,2024-03-12T08:25:19Z,SUPPLY AND DELIVERY OF (GRADE4-7) CODING AND ROBOTICS KITS FOR THE FREE STATE DEPARTMENT OF EDUCATION PRIMARY SCHOOLS,active,23645,5325224,ZAR,2026-12-04T00:00:00Z,2023-12-04T00:00:00Z,2026-12-04T00:00:00Z,1096,ocds-9t57fa-64738,ocds-9t57fa-64738-2023-08-25T00:00:00Z
1205,EX 31/2023,2023-09-26T14:00:59Z,"Deviation to appoint Hissco (Pty) Ltd for the maintenance and support services of Baggage and Air Cargo Scanners across the country in airports and border posts, for a period of five (5) years (01 April 2024 to 31 March 2029) with an option to extend for a further period of one (1) year (01 April 2029 to March 2030) at SARS’ discretion at an estimated amount of R 19 069 541.55 including VAT based on sole provider.",active,16904,19069542,ZAR,2030-03-31T00:00:00Z,2024-04-01T00:00:00Z,2030-03-31T00:00:00Z,2190,ocds-9t57fa-68406,ocds-9t57fa-68406-2023-09-23T00:00:00Z
1567,T26/2024,2024-03-14T11:11:44Z,APPOINTMENT OF VARIOUS SERVICE PROVIDERS FOR TRAINING PROGRAMMES ,active,24900,101938,ZAR,2024-06-28T00:00:00Z,2024-03-12T00:00:00Z,2024-06-28T00:00:00Z,108,ocds-9t57fa-72033,ocds-9t57fa-72033-2023-10-27T00:00:00Z
1443,BA100/2023q,2023-12-20T07:53:48Z,"BA100/2023q – Supply, Delivery and Installation of Wall and Floor Tiles and Related Work for the Upgrading of Restrooms at Thembalethu Thusong Centre, George",active,20544,82383,ZAR,2024-06-30T00:00:00Z,2023-12-12T00:00:00Z,2024-06-30T00:00:00Z,201,ocds-9t57fa-72051,ocds-9t57fa-72051-2023-10-27T00:00:00Z
1437,3100034903,2023-12-13T13:57:00Z,Resources required furniture / file relocation,active,20450,218703,ZAR,2024-03-29T00:00:00Z,2023-11-16T00:00:00Z,2024-03-29T00:00:00Z,134,ocds-9t57fa-77213,ocds-9t57fa-77213-2023-10-20T00:00:00Z
2619,DTP01594,2024-11-15T08:34:27Z,Appointment of a public relations agency to manage Dube TradePort public relations and communication requirements for a period of three (3) years,active,36408,3390054,ZAR,2027-11-30T00:00:00Z,2024-12-01T00:00:00Z,2027-11-30T00:00:00Z,1094,ocds-9t57fa-77535,ocds-9t57fa-77535-2023-12-14T00:00:00Z
1675,59412,2024-03-28T12:06:15Z,Procurement of (DRONES) Technology to improve services delivery within Local Government,active,25807,529103,ZAR,2023-11-30T00:00:00Z,2023-11-09T00:00:00Z,2023-11-30T00:00:00Z,21,ocds-9t57fa-86236,ocds-9t57fa-86236-2023-11-17T00:00:00Z
1683,59878,2024-04-02T12:26:28Z,Appointment of a service provider for the provision of  Municipal Assistance and Support: Sundays River LM,active,25791,134000,ZAR,2024-03-31T00:00:00Z,2023-12-18T00:00:00Z,2024-03-31T00:00:00Z,104,ocds-9t57fa-85269,ocds-9t57fa-85269-2023-03-09T00:00:00Z
5226,10402766,2026-05-02T11:06:41Z,RFP:RW10402766/22 REQUEST FOR PROPOSAL FOR THE APPOINTMENT OF IMPLEMENTATION PARTNERS FOR RAND WATER’S SOCIO-ECONOMIC DEVELOPMENT IMPLEMENTATION FOR A PERIOD OF FIVE YEARS (MULTIPLE AWARDS),active,19362,0,ZAR,2028-11-01T00:00:00Z,2023-11-02T00:00:00Z,2028-11-01T00:00:00Z,1826,ocds-9t57fa-44726,ocds-9t57fa-44726-2023-01-13T00:00:00Z
2314,DARD18/2022,2024-09-27T12:52:45Z, Panel of Service Providers for the Drilling and Equipping of Boreholes for the period of twenty-four (24) months. ,active,34469,0,ZAR,2026-05-15T00:00:00Z,2024-05-16T00:00:00Z,2026-05-15T00:00:00Z,729,ocds-9t57fa-48095,ocds-9t57fa-48095-2023-03-03T00:00:00Z
2149,DARD 18/2022,2024-08-22T21:00:20Z, Panel of Service Providers for the Drilling and Equipping of Boreholes for the period of twenty-four (24) months. ,active,30093,50,ZAR,2026-03-31T00:00:00Z,2024-05-16T00:00:00Z,2026-03-31T00:00:00Z,684,ocds-9t57fa-48095,ocds-9t57fa-48095-2023-03-03T00:00:00Z
1395,DHA03-2023,2023-12-01T14:10:34Z,Appointment of transaction advisor services to conduct a feasibility study and PPP procurement for visa & permit application centre services through a public private partnership (PPP) for a period of three (3) years.,active,11428,9850000,ZAR,2026-05-11T00:00:00Z,2023-05-12T00:00:00Z,2026-05-11T00:00:00Z,1095,ocds-9t57fa-48816,ocds-9t57fa-48816-2023-03-10T00:00:00Z
892,DPD027/2023q,2023-04-11T13:42:35Z,"DPD0272023q – APPOINTMENT OF A SERVICE PROVIDER FOR PROOF READING, EDITING, DESIGNING, LAYOUT, PRINTING AND BINDING OF GEORGE MUNICIPALITY’S ANNUAL REPORT 20212022 FINANCIAL YEAR",active,10404,199980,ZAR,2023-06-30T00:00:00Z,2023-04-01T00:00:00Z,2023-06-30T00:00:00Z,90,ocds-9t57fa-48941,ocds-9t57fa-48941-2023-03-10T00:00:00Z
4819,NC/SOC/012/2023,2026-03-27T12:29:21Z,"RENDERING OF CLEANING, CAR WASH & GARDEN SERVICES AT THE PROVINCIAL OFFICE- LATLHI MABILO COMPLEX & DU TOITSPAN BUILDING FLOORS 5, 6 & 9 FOR A PERIOD OF 36 MONTHS",active,66065,3034027,ZAR,2027-02-28T00:00:00Z,2024-02-01T00:00:00Z,2027-02-28T00:00:00Z,1123,ocds-9t57fa-50123,ocds-9t57fa-50123-2023-03-24T00:00:00Z
3006,SCMU3-23/24-0008-HO,2025-02-06T11:35:30Z,"SUPPLY, DELIVERY, OFF-LOADING AND TESTING FOR THE COAL OF THE BOILERS FOR THE POWER SYSTEMS at BHISHO, BUTTERWORTH, FRONTIER, KOMANI & TOWER HOSPITAL",active,64826,33032584,ZAR,2026-08-31T00:00:00Z,2023-09-01T00:00:00Z,2026-08-31T00:00:00Z,1095,ocds-9t57fa-50236,ocds-9t57fa-50236-2023-03-24T00:00:00Z
1383,DHA05-2023,2023-11-28T08:44:24Z,Appointment of a service provider for the provision of cash-in-transit services at offices of the Department of Home Affairs for a period of three (3) years.,active,12514,32400660,ZAR,2026-06-07T00:00:00Z,2023-06-08T00:00:00Z,2026-06-07T00:00:00Z,1095,ocds-9t57fa-52498,ocds-9t57fa-52498-2023-04-21T00:00:00Z
1196,E3/2023/2024,2023-09-21T07:43:50Z,"Supply and Delivery of Practical Assessment Task (PAT) Materials and Appropriate Workshop Clothing to Technical, Comprehensive and Agricultural Schools of Skills in the Free State for the Period of Three Years",active,16434,48039749,ZAR,2026-08-25T00:00:00Z,2023-08-25T00:00:00Z,2026-08-25T00:00:00Z,1096,ocds-9t57fa-52952,ocds-9t57fa-52952-2023-04-28T00:00:00Z
1434,BID/NC062/23/2022-2023,2023-12-12T15:40:16Z,OKIEP ROCKY RIDGE SEWER RETICULATION,active,20427,12523479,ZAR,2024-08-01T00:00:00Z,2023-11-02T00:00:00Z,2024-08-01T00:00:00Z,273,ocds-9t57fa-54116,ocds-9t57fa-54116-2023-05-12T00:00:00Z
5055,SLA-0233,2026-04-20T06:37:21Z,"NT002-2023: APPOINTMENT OF A SERVICE PROVIDER TO PROVIDE SWIFT BUREAU AND HOST DATA EXCHANGE SERVICES FOR A PERIOD OF THREE (3) YEARS
",active,19599,3335044,ZAR,2027-04-10T00:00:00Z,2024-04-11T00:00:00Z,2027-04-10T00:00:00Z,1094,ocds-9t57fa-54151,ocds-9t57fa-54151-2023-05-12T00:00:00Z
3621,COGTA03/2023/2024,2025-08-04T10:28:08Z,APPOINTMENT OF A SERVICE PROVIDER TO IMPLEMENT THE TURN-AROUND STRATEGY AND ITS SOFTWARES FOR ALL 22 MUNICIPALITIES WITHIN THE NORTH WEST PROVINCE FOR THE PERIOD OF 36 MONTHS,active,51723,168336130,ZAR,2026-08-31T00:00:00Z,2023-09-01T00:00:00Z,2026-08-31T00:00:00Z,1095,ocds-9t57fa-55604,ocds-9t57fa-55604-2023-05-27T00:00:00Z
1598,1R-23918,2024-03-16T13:32:05Z,Flood damage remediation – Construction of Umbilo Canal services and pedestrian bridge,active,25104,6971875,ZAR,2026-08-29T00:00:00Z,2023-08-30T00:00:00Z,2026-08-29T00:00:00Z,1095,ocds-9t57fa-56044,ocds-9t57fa-56044-2023-06-02T00:00:00Z
1768,WS-7451,2024-04-26T15:36:34Z,Buffelsdraai Landfill construction of Cell 1C and ancillary works,active,27088,37473238,ZAR,2025-01-13T00:00:00Z,2023-10-12T00:00:00Z,2025-01-13T00:00:00Z,459,ocds-9t57fa-56065,ocds-9t57fa-56065-2023-06-02T00:00:00Z
5298,CNT 4213,2026-05-09T21:59:37Z,Garden Services/ Maintenance for 30 months,pending,13969,625321,ZAR,2023-12-31T00:00:00Z,2023-08-01T00:00:00Z,2023-12-31T00:00:00Z,152,ocds-9t57fa-56240,ocds-9t57fa-56240-2023-06-02T00:00:00Z
4805,CDC/121/23,2026-03-27T09:13:38Z,"UPGRADES AND ADDITIONS TO MTHIYANE PRIMARY SCHOOL IN UTHUKELA DISTRICT, KWAZULU-NATAL - 7 GB or HIGHER",active,21305,48775397,ZAR,2026-03-09T00:00:00Z,2024-01-08T00:00:00Z,2026-03-09T00:00:00Z,791,ocds-9t57fa-56320,ocds-9t57fa-56320-2023-06-02T00:00:00Z
4913,RFP2023/16/NYDA,2026-04-01T11:08:43Z,THE APPOINTMENT OF A PANEL OF SERVICE PROVIDERS WITH CAPACITY TO PROVIDE E-COMMERCE PLATFORM AND WEB BASED ACCOUNTING SYSTEM FOR THE NYDA BUSINESS CONSULTANCY SERVICES (VOUCHER) PROGRAMME BENEFICIARIES IN EACH PROVINCE FOR THE PERIOD OF THREE (3) YEARS,active,41852,84600000,ZAR,2027-10-31T00:00:00Z,2024-11-01T00:00:00Z,2027-10-31T00:00:00Z,1094,ocds-9t57fa-57707,ocds-9t57fa-57707-2023-06-15T00:00:00Z
5211,10403046,2026-05-01T09:13:32Z,"RFB-RW10403046-23:PROVISION OF EMPLOYEE WELLNESS SERVICES AT RAND WATER FOR A DURATION OF (3) THREE YEARS.

",active,32319,9288184,ZAR,2027-11-17T00:00:00Z,2024-11-18T00:00:00Z,2027-11-17T00:00:00Z,1094,ocds-9t57fa-60296,ocds-9t57fa-60296-2023-07-14T00:00:00Z
1478,CON0018/2023/24,2024-01-31T13:58:30Z,THE APPOINTMENT OF A SERVICE PROVIDER TO ASSIST NERSA WITH THE PRODUCTION OF CORPORATE PUBLICATIONS FOR A PERIOD OF THREE (3) YEARS.,active,19288,2623118,ZAR,2027-03-31T00:00:00Z,2024-04-01T00:00:00Z,2027-03-31T00:00:00Z,1094,ocds-9t57fa-61027,ocds-9t57fa-61027-2023-07-21T00:00:00Z
1783,CON0018/2023/24,2024-04-30T16:50:13Z,THE APPOINTMENT OF A SERVICE PROVIDER TO ASSIST NERSA WITH THE PRODUCTION OF CORPORATE PUBLICATIONS FOR A PERIOD OF THREE (3) YEARS.,active,19289,2623118,ZAR,2027-03-31T00:00:00Z,2024-04-01T00:00:00Z,2027-03-31T00:00:00Z,1094,ocds-9t57fa-61027,ocds-9t57fa-61027-2023-07-21T00:00:00Z
2055,Infra12 ,2024-07-24T14:49:42Z,"150KVA OUTDOOR STANDBY GENERATOR INSTALLATION FOR ECDC HEAD OFFICES IN OCEAN TERRACE PARK, MOORE STREET, QUIGNEY, EAST LONDON

EVALUATION CRITERIA:
STAGE 1: LOCAL CONTENT
STAGE2: FUNCTIONALITY
STAGE3: PREFENTIAL PROCUREMENT POINTS",active,19342,1522521,ZAR,2023-12-16T00:00:00Z,2023-08-15T00:00:00Z,2023-12-16T00:00:00Z,123,ocds-9t57fa-63955,ocds-9t57fa-63955-2023-08-18T00:00:00Z
3915,SCMU5-23/24-0049,2025-10-28T14:48:16Z,"BID FOR THE APPOINTMENT OF A SERVICE PROVIDER(S) TO PROVIDE
SECURITY SERVICES FOR REGIONAL CLUSTERS FOR A PERIOD OF 36
MONTHS",active,44479,0,ZAR,2027-04-11T00:00:00Z,2024-04-12T00:00:00Z,2027-04-11T00:00:00Z,1094,ocds-9t57fa-64018,ocds-9t57fa-64018-2023-08-18T00:00:00Z
4380,NDOH 37-2023/2025,2026-02-10T15:37:12Z,The Establishment of a panel of registered medical practitioners for the certification and review committees at the Medical Bureau for Occupational diseases (MBOD) for a period of five (05) years,active,20923,1,ZAR,2028-12-04T00:00:00Z,2023-12-04T00:00:00Z,2028-12-04T00:00:00Z,1827,ocds-9t57fa-64040,ocds-9t57fa-64040-2023-08-18T00:00:00Z
1941,P5/EP/02/23,2024-06-27T11:46:00Z,APPOINTMENT OF SERVICE PROVIDER TO PROVIDE TECHNICAL CAPACITY IN THE DEVELOPMENT OF COMPUTABLE GENERAL EQUILIBRIUM (CGE) MODEL FOR KWAZULU-NATAL PROVINCE USING GENERAL ALGEBRAIC MODELING SYSTEM (GAMS),active,25868,1476180,ZAR,2025-10-31T00:00:00Z,2024-04-02T00:00:00Z,2025-10-31T00:00:00Z,577,ocds-9t57fa-64688,ocds-9t57fa-64688-2023-08-24T00:00:00Z
2277,CON009/2024/26,2024-09-17T10:26:48Z,"THE APPOINTMENT OF SERVICE PROVIDER TO CONDUCT A TECHNICAL AUDIT OF MADIBENG, UMSUNDUZI AND EMFULENI LOCAL MUNICIPALITIES BUSINESS ASSESSMENT AND NETWORK INSPECTIONS FOR THE 2023/2024 FINANCIAL YEAR FOR A PERIOD OF SEVEN (7) MONTHS ",active,28281,2857175,ZAR,0001-01-01T00:00:00Z,0001-01-01T00:00:00Z,0001-01-01T00:00:00Z,0,ocds-9t57fa-65822,ocds-9t57fa-65822-2023-09-01T00:00:00Z
1381,DHA12-2023,2023-11-28T08:32:44Z,"Appointment of a service providers to conduct auctioneering services for disposal of assets for Head Office, North West, Kwazulu-Natal, Mpumalanga, Northern Cape, Free State, Eastern Cape, Western Cape, Limpopo, and Gauteng for a period of thirty-six (36) months.",active,19695,575,ZAR,2026-11-22T00:00:00Z,2023-11-23T00:00:00Z,2026-11-22T00:00:00Z,1095,ocds-9t57fa-66401,ocds-9t57fa-66401-2023-09-08T00:00:00Z
2135,ZNB104/2023/24HSE,2024-08-22T08:20:17Z,"APPOINTMENT OF SERVICE PROVIDERS TO UNDERTAKE CONSTRUCTION OF TOP-STRUCTURES USING ALTERNATIVE BUILDING TECHNOLOGY AS ADDITIONAL CAPACITY FOR THE REMAINDER OF THE EXISTING PANEL, AS AND WHEN THE NEED ARISES",active,22540,0,ZAR,2027-06-02T00:00:00Z,2024-05-01T00:00:00Z,2027-06-02T00:00:00Z,1127,ocds-9t57fa-67455,ocds-9t57fa-67455-2023-09-15T00:00:00Z
2219,WS-7398,2024-09-11T08:55:14Z,33 ML Sultan Sewer Pipeline upgrade,active,34520,2130892,ZAR,2024-12-31T00:00:00Z,2024-07-01T00:00:00Z,2024-12-31T00:00:00Z,183,ocds-9t57fa-68102,ocds-9t57fa-68102-2023-09-22T00:00:00Z
5185,013/09/2023 FIN,2026-04-30T12:06:04Z,"Appointment of a service provider for the provision of Travel Management 
Services for the Special Investigating Unit (SIU) for a period of five (5) years.",active,26624,0,ZAR,2029-05-31T00:00:00Z,2024-06-01T00:00:00Z,2029-05-31T00:00:00Z,1825,ocds-9t57fa-68856,ocds-9t57fa-68856-2023-09-29T00:00:00Z
3059,SCMU3-23/24-0077-NMM,2025-02-12T15:03:31Z,"Appointment of service provider for provision of Security
Services at Nelson Mandela Bay Health District,
Community Health Centres, Primary Health Care clinics
and supporting Health Care facilities in Nelson Mandela
Metro for a period of 36 months.",active,43301,142369241,ZAR,2027-03-31T00:00:00Z,2024-04-01T00:00:00Z,2027-03-31T00:00:00Z,1094,ocds-9t57fa-69567,ocds-9t57fa-69567-2023-10-06T00:00:00Z
4823,RFP2023/30/NYDA,2026-03-27T13:59:12Z,RE-ADVERTISEMENT OF THE LEASE OF CORPORATE OFFICE SPACE FOR NYDA JOHANNESBURG BRANCH OVER A PERIOD OF SEVEN (7) YEARS,active,66082,7332170,ZAR,2031-11-30T00:00:00Z,2024-10-01T00:00:00Z,2031-11-30T00:00:00Z,2616,ocds-9t57fa-71066,ocds-9t57fa-71066-2023-10-20T00:00:00Z
4991,CDC/571/23,2026-04-14T14:36:24Z,"
COFFEE BAY SAPS: CONDITION BASED MAINTENANCE ON BUILDING, CIVIL, STRUCTURAL AND ELECTRICAL ELEMENTS OF THE POLICE STATION 
",active,29329,15511551,ZAR,2025-10-30T00:00:00Z,2024-08-15T00:00:00Z,2025-10-30T00:00:00Z,441,ocds-9t57fa-74401,ocds-9t57fa-74401-2023-11-17T00:00:00Z
4622,SCMU3-23/24-0631-HO,2026-03-16T13:10:21Z,"SCHEDULE MAINTENANCE OF LAUNDRY & ASSOCIATED EQUIPMENT AT CLUSTER THREE (3) – BUFFALO CITY AND AMATHOLE DISTRICT – HEALTH FACILITIES (36
MONTHS)
",active,64804,16620622,ZAR,2027-07-31T00:00:00Z,2024-08-01T00:00:00Z,2027-07-31T00:00:00Z,1094,ocds-9t57fa-74609,ocds-9t57fa-74609-2023-11-18T00:00:00Z
4994,CDC/446/23,2026-04-14T16:19:36Z,"PROFESSIONAL CONSULTANCY SERVICES FOR CIVIL INFRASTRUCTURE FOR RETURN EFFLUENT DISTRIBUTION TO ZONE 3, 5, 6 AND 9 AND 15ML RETURN EFFLUENT RESERVOIR",active,45009,8183211,ZAR,2029-03-31T00:00:00Z,2024-05-27T00:00:00Z,2029-03-31T00:00:00Z,1769,ocds-9t57fa-75318,ocds-9t57fa-75318-2023-11-24T00:00:00Z
5271,G492/2023,2026-05-09T14:16:15Z,"THE APPOINTMENT OF A CONTRACTOR FOR THE REMOVAL OF THE EXISTING DAMAGED BOARDWALKS AND INSTALLATION OF NEW BOARDWALKS FOR THE SOUTH AFRICAN NATIONAL BIODIVERISTY INSTITUTE AT THE KIRSTENBOSCH NATIONAL BOTANICAL GARDEN, CAPE TOWN AND HAROLD PORTER NATIONAL BOTANICAL GARDEN, BETTYS BAY",pending,33775,4543833,ZAR,2025-03-05T00:00:00Z,2024-08-05T00:00:00Z,2025-03-05T00:00:00Z,212,ocds-9t57fa-75423,ocds-9t57fa-75423-2023-11-24T00:00:00Z
2184,4600003201,2024-09-02T11:16:24Z,IT Operations and Application Performance Monitoring Tools,active,28363,11971500,ZAR,2027-05-13T00:00:00Z,2024-05-14T00:00:00Z,2027-05-13T00:00:00Z,1094,ocds-9t57fa-76218,ocds-9t57fa-76218-2023-12-01T00:00:00Z
1711,RFB8078/23/24,2024-04-08T12:20:32Z,APPOINTMENT OF A PANEL OF SERVICE PROVIDERS TO SUPPLY AND DELIVER IT HARDWARE EQUIPMENT AND IT PERIPHERALS TO CCSA (AS AND WHE REQUIRED) FOR A PERIOD OF THREE (3) YEARS,active,24530,50,ZAR,2027-02-28T00:00:00Z,2024-03-01T00:00:00Z,2027-02-28T00:00:00Z,1094,ocds-9t57fa-76912,ocds-9t57fa-76912-2023-12-08T00:00:00Z
4609,SCMU3-23/24-0596-HO,2026-03-16T11:43:32Z,"SUPPLY AND DELIVERY OF HOSPITAL AND CLINIC WARD, DORM, THEATRE, KITCHEN AND OTHER LINEN, DOCTORS AND NURSES THEATRE CLOTHING AND CERTAIN MISCELLANEOUS PROTECTIVE CLOTHING IN THE EASTERN CAPE DEPARTMENT OF HEALTH OFFICES AND INSTITUTIONS FOR A PERIOD OF 36 MONTHS",active,64865,0,ZAR,2028-06-09T00:00:00Z,2025-06-10T00:00:00Z,2028-06-09T00:00:00Z,1095,ocds-9t57fa-77488,ocds-9t57fa-77488-2023-12-14T00:00:00Z
2403,1R-27430,2024-10-10T12:59:58Z,Construction of gravel to surface roads: Khoza Ave and 108828 Str in Inanda: Wards 54 and 55,active,35022,4105792,ZAR,2025-02-28T00:00:00Z,2024-07-24T00:00:00Z,2025-02-28T00:00:00Z,219,ocds-9t57fa-77594,ocds-9t57fa-77594-2023-12-18T00:00:00Z
2395,P1/AUX/14/23,2024-10-09T14:12:42Z,"Supply, Deliver, Removal & Installation of LED Lights Bulbs ",active,35639,350000,ZAR,2024-08-30T00:00:00Z,2023-08-31T00:00:00Z,2024-08-30T00:00:00Z,365,ocds-9t57fa-102504,ocds-9t57fa-102504-2023-04-06T00:00:00Z
852,T17/2023,2023-03-30T09:40:43Z,REVIEW OF THE ORGANISATIONAL STRUCTURE OF CAPE AGULHAS MUNICIPALITY,active,9887,963700,ZAR,2023-06-30T00:00:00Z,2023-04-17T00:00:00Z,2023-06-30T00:00:00Z,74,ocds-9t57fa-45662,ocds-9t57fa-45662-2023-02-03T00:00:00Z
1424,DHA02-2023,2023-12-06T12:05:18Z,"INVITATION OF BIDS FROM SUITABLE SERVICE PROVIDERS FOR THE SUPPLY AND DELIVERY OF BLACK HEAVY DUTY PLASTIC CHAIRS TO THE DEPARTMENT OF HOME AFFAIRS FOR A PERIOD OF THREE (3) YEARS, WITH AN OPTIONTO RENEW FOR TWO (2) YEARS, SUBJECT TO THE PERFOMANCE OF THE SERVICE PROVIDER AND THE AVAILABILTIY OF FUNDS.",terminated,19800,866859,ZAR,2026-04-27T00:00:00Z,2023-04-28T00:00:00Z,2026-04-27T00:00:00Z,1095,ocds-9t57fa-46068,ocds-9t57fa-46068-2023-02-10T00:00:00Z
848,BA010/2023q,2023-03-30T08:36:30Z,"BA010/2023q – APPOINTMENT OF A SERVICE PROVIDER FOR THE RECRUITMENT AND SELECTION PROCESS OF THE DIRECTOR: COMMUNITY SERVICES, IN LINE WITH THE REGULATIONS ON APPOINTMENT AND CONDITIONS OF EMPLOYMENT OF SENIOR MANAGERS, 2014",active,9872,46000,ZAR,2023-06-30T00:00:00Z,2023-03-10T00:00:00Z,2023-06-30T00:00:00Z,112,ocds-9t57fa-47487,ocds-9t57fa-47487-2023-02-24T00:00:00Z
1122,COM003 OF 2023,2023-08-23T13:57:54Z,"COM003 OF 2023: APPOINTMENT OF A CONTRACTOR FOR ADDITIONS AND ALTERATIONS TO THE CCTV COMMAND CENTRE, phase 2",active,15070,45502291,ZAR,2024-06-30T00:00:00Z,2023-08-16T00:00:00Z,2024-06-30T00:00:00Z,319,ocds-9t57fa-48046,ocds-9t57fa-48046-2023-03-03T00:00:00Z
992,PO3100033554,2023-05-22T10:38:38Z,"Supply of 2 x Labour Resources for a period of 55 days, on a as and when required basis",active,11675,139150,ZAR,2023-07-21T00:00:00Z,2023-05-22T00:00:00Z,2023-07-21T00:00:00Z,60,ocds-9t57fa-54974,ocds-9t57fa-54974-2023-05-05T00:00:00Z
1739,TETA23/RESEARCH/0005/PARTICIPATION,2024-04-11T15:46:01Z,REQUEST FOR PROPOSALS TO CONDUCT A COMPREHENSIVE STUDY ON INNOVATIVE APPROACHES TO ENHANCE INDUSTRY PARTICIPATION LEVELS IN THE SUBMISSION OF WORKPLACE SKILLS PLAN/ANNUAL TRAINING REPORT INFORMATION.,active,18162,862500,ZAR,2024-04-18T00:00:00Z,2023-10-18T00:00:00Z,2024-04-18T00:00:00Z,183,ocds-9t57fa-59506,ocds-9t57fa-59506-2023-07-07T00:00:00Z
1757,ZNB99/2023/24HSE,2024-04-26T10:51:04Z,"APPOINTMENT OF A SERVICE PROVIDER TO RENDER 24 HOUR SECURITY GUARDING SERVICES FOR THE KZN DEPARTMENT OF HUMAN SETTLEMENTS AT 71 KARELLANDMAN STREET, DUNDEE, FOR A PERIOD OF 36 MONTHS ",active,19036,0,ZAR,2026-11-30T00:00:00Z,2023-12-01T00:00:00Z,2026-11-30T00:00:00Z,1095,ocds-9t57fa-60186,ocds-9t57fa-60186-2023-07-14T00:00:00Z
1063,4400004408,2023-07-20T13:02:48Z,The appointment Impactful Specialist Solutions (Pty) Ltd for Maintenance and Support of Lectora Licenses for a period of 3 years (36 months) as from 14 July 2023 to 13 June 2026,active,13898,342937,ZAR,2026-07-13T00:00:00Z,2023-07-14T00:00:00Z,2026-07-13T00:00:00Z,1095,ocds-9t57fa-60804,ocds-9t57fa-60804-2023-07-14T00:00:00Z
1351,T52/2023,2023-11-15T14:48:39Z,UPGRADING OF STORMWATER MANAGEMENT SYSTEMS,active,19480,2105622,ZAR,2024-06-28T00:00:00Z,2024-01-08T00:00:00Z,2024-06-28T00:00:00Z,172,ocds-9t57fa-63078,ocds-9t57fa-63078-2023-08-11T00:00:00Z
3626,SCMU10-23/24-0013,2025-08-05T12:37:34Z,PROVISION OF PROFESSIONAL SECURITY SERVICES FOR A PERIOD OF TWENTY-FOUR (24) FOR COFIMVABA TO ASKEATON PROJECT,active,29213,9005235,ZAR,2026-04-30T00:00:00Z,2024-05-01T00:00:00Z,2026-04-30T00:00:00Z,729,ocds-9t57fa-64112,ocds-9t57fa-64112-2023-08-18T00:00:00Z
2148,DARD14/2023,2024-08-22T20:23:00Z,Appointment of a catering company to provide catering for Cedara College for a period of thirty-six (36) Months. ,active,24540,24561476,ZAR,2027-06-01T00:00:00Z,2024-06-01T00:00:00Z,2027-06-01T00:00:00Z,1095,ocds-9t57fa-64569,ocds-9t57fa-64569-2023-08-24T00:00:00Z
1169,MM013OF2023,2023-09-07T08:54:34Z,"
MM013 OF 2023 : SUPPLY OF VENUE & CATERING SERVICES FOR THE CHIEF AUDIT EXECUTIVES & CHIEF RISK OFFICERS FORUMS ON THE 19-20 SEPTEMBER 2023

",pending,16171,46850,ZAR,2023-09-07T00:00:00Z,2023-09-06T00:00:00Z,2023-09-07T00:00:00Z,1,ocds-9t57fa-64736,ocds-9t57fa-64736-2023-08-25T00:00:00Z
1963,INFRA14,2024-07-05T11:32:11Z,"REFURBISHMENT OF BUILDING, MECHANICAL AND ELECTRICAL INFRASTRUCTURE AT THE DIMBAZA WASTEWATER TREATMENT WORKS –PHASE 1
REQUIRED GRADING 6 GB OR HIGHER
The Evaluation Criteria is as follows:

MANDATORY REQUIREMENT
STAGE 1: LOCAL CONTENT
STAGE 2: FUNCTIONALITY
STAGE 3: PREFERENTIAL PROCUREMENT POINTS
",active,20422,17644178,ZAR,2025-01-06T00:00:00Z,2023-12-13T00:00:00Z,2025-01-06T00:00:00Z,390,ocds-9t57fa-64779,ocds-9t57fa-64779-2023-08-25T00:00:00Z
