id,title,dateSigned,description,status,awardID,value_amount,value_currency,period_endDate,period_startDate,period_maxExtentDate,period_durationInDays,main_ocid,main_id
2223,62619,2024-09-11T14:34:50Z,ERA CERTIFICATES AND TROPHIES,active,34989,130116,ZAR,0001-01-01T00:00:00Z,0001-01-01T00:00:00Z,0001-01-01T00:00:00Z,0,ocds-9t57fa-100398,ocds-9t57fa-100398-2024-07-12T00:00:00Z
3278,13 DARD 23/2024,2025-04-09T15:43:52Z,"13 DARD 23/2024: CONSTRUCTION OF COMPLETE AQUAPONICS GREENHOUSE STRUCTURE AT GREENIES FARM IN JERICHO VILLAGE,MADIBENG BOJANALA DISTRICT",pending,39135,1857641,ZAR,0001-01-01T00:00:00Z,0001-01-01T00:00:00Z,0001-01-01T00:00:00Z,0,ocds-9t57fa-101001,ocds-9t57fa-101001-2024-09-06T00:00:00Z
2458,4400004619,2024-10-17T13:45:15Z,Servicing of Fire Panels - ROR Building,active,36911,248090,ZAR,2025-07-31T00:00:00Z,2024-08-01T00:00:00Z,2025-07-31T00:00:00Z,364,ocds-9t57fa-105101,ocds-9t57fa-105101-2024-05-24T00:00:00Z
3844,DARD15/2024,2025-10-06T15:08:38Z," Supply, Deliver, Install and Train on HighPerformance Liquid Chromatograph and its Ultra-Pure Water Purifier for Analytical Services ",active,45891,2383520,ZAR,0001-01-01T00:00:00Z,0001-01-01T00:00:00Z,0001-01-01T00:00:00Z,0,ocds-9t57fa-105314,ocds-9t57fa-105314-2024-10-18T00:00:00Z
2878,PP09-24/25-04(1),2025-01-09T06:58:34Z,"APPOINTMENT OF A SUITABLE SERVICE PROVIDER(S) ON JUST IN TIME (JIT) CONTRACT TO DESIGN, MANUFACTURE, SUPPLY, DELIVERY AND PACKAGING PROTECTIVE CLOTHING, CORPORATE CLOTHING, UNIFORM AND FOOTWEAR FOR A PERIOD OF TWELVE(12) MONTHS",terminated,40455,0,ZAR,2027-12-19T00:00:00Z,2024-12-19T00:00:00Z,2027-12-19T00:00:00Z,1095,ocds-9t57fa-105384,ocds-9t57fa-105384-2024-10-18T00:00:00Z
3665,SCMU12-24/25-0007,2025-08-11T14:18:01Z,APPOINTMENT OF A COMPETENT EXTERNAL SERVICE PROVIDER TO ASSIST WITH THE 24 HOUR EMPLOYEE WELLNESS SUPPORT PROGRAMME FOR A PERIOD OF THIRTY-SIX (36) MONTHS.,active,40028,1168158,ZAR,2028-01-01T00:00:00Z,2025-01-02T00:00:00Z,2028-01-01T00:00:00Z,1094,ocds-9t57fa-107459,ocds-9t57fa-107459-2024-11-08T00:00:00Z
2816,Q15/2024/25,2024-12-10T10:59:21Z,SUPPLY AND DELIVERY OF COMPACTOR: LIGHT FOOT RAMMER,active,39737,25787,ZAR,0001-01-01T00:00:00Z,0001-01-01T00:00:00Z,0001-01-01T00:00:00Z,0,ocds-9t57fa-107617,ocds-9t57fa-107617-2024-11-08T00:00:00Z
2861,64494,2024-12-13T13:18:28Z,Procurement of office furniture for SALGA Western Cape Provincial Office.,active,39982,264502,ZAR,0001-01-01T00:00:00Z,0001-01-01T00:00:00Z,0001-01-01T00:00:00Z,0,ocds-9t57fa-111027,ocds-9t57fa-111027-2024-11-15T00:00:00Z
3777,DHS 20/2022,2025-09-09T09:16:27Z,Appointment of a service provider for the construction of 200 low cost housin8 units at Mmanokwana Village: Greater Taung Local Municipality,active,54561,43657600,ZAR,2026-10-31T00:00:00Z,2024-07-01T00:00:00Z,2026-10-31T00:00:00Z,852,ocds-9t57fa-133233,ocds-9t57fa-133233-2024-01-26T00:00:00Z
2159,T113/2024,2024-08-23T10:42:20Z,DEBT COLLECTION FOR A PERIOD OF 3 YEARS,active,31162,4660375,ZAR,2027-06-30T00:00:00Z,2024-07-01T00:00:00Z,2027-06-30T00:00:00Z,1094,ocds-9t57fa-78071,ocds-9t57fa-78071-2024-01-12T00:00:00Z
1565,T22/2024,2024-03-14T10:22:06Z,PROVISION OF PROFESSIONAL CONSULTANT FOR THE APPOINTMENT PROCESS OF DIRECTOR  FINANCIAL & MANAGEMENT SERVICES,active,24891,78750,ZAR,2024-06-28T00:00:00Z,2024-03-01T00:00:00Z,2024-06-28T00:00:00Z,119,ocds-9t57fa-78687,ocds-9t57fa-78687-2024-01-19T00:00:00Z
2490,LR-AGM-24-14,2024-10-25T13:33:11Z,"APPOINTMENT OF A SERVICE PROVIDER TO SUPPLY, DELIVER, INSTALL, CONFIGURE   AND PROVIDE MAINTENANCE OF AN AUDIO-VISUAL SOLUTION TO THE NNR NEW CAPE TOWN OFFICES FOR A PERIOD OF THREE (3) YEARS.",active,33646,1254271,ZAR,2027-09-30T00:00:00Z,2024-10-01T00:00:00Z,2027-09-30T00:00:00Z,1094,ocds-9t57fa-83527,ocds-9t57fa-83527-2024-03-01T00:00:00Z
2848,ZNB109/2023/24HSE,2024-12-10T14:42:01Z,"APPOINTMENT OF A SERVICE PROVIDER TO RENDER 24 HOUR SECURITY GUARDING SERVICES FOR THE KZN DEPARTMENT OF HUMAN SETTLEMENTS AT UTHUKELA DISTRICT OFFICE, LADYSMITH FOR A PERIOD OF 36 MONTHS. ",active,34501,0,ZAR,2027-09-30T00:00:00Z,2024-10-01T00:00:00Z,2027-09-30T00:00:00Z,1094,ocds-9t57fa-87361,ocds-9t57fa-87361-2024-04-12T00:00:00Z
1970,BA032/2024q,2024-07-10T15:30:15Z,"BA032/2024q – Supply, Delivery, And Installation Of Curtains And Blinds At The Conville Community Hall",active,31027,230488,ZAR,0001-01-01T00:00:00Z,0001-01-01T00:00:00Z,0001-01-01T00:00:00Z,0,ocds-9t57fa-88602,ocds-9t57fa-88602-2024-04-26T00:00:00Z
1985,T88/2024,2024-07-12T13:58:48Z,SUPPLY AND DELIVERY OF K53 MOTORCYCLE TEST TRACK EQUIPMENT,active,29302,207000,ZAR,0001-01-01T00:00:00Z,0001-01-01T00:00:00Z,0001-01-01T00:00:00Z,0,ocds-9t57fa-89758,ocds-9t57fa-89758-2024-05-10T00:00:00Z
3071,TETA24/RESEARCH/0003/QUALIFICATION PROCESSATION,2025-02-18T10:36:55Z,REQUEST FOR PROPOSALS FROM SERVICE PROVIDERS TO CONDUCT A COMPREHENSIVE STUDY TO INVESTIGATE THE ENHANCEMENT OF THE CURRENT PROCESSES FOR QUALIFICATION DEVELOPMENT AND ACCREDITATION.,active,35661,471500,ZAR,2025-03-18T00:00:00Z,2024-09-18T00:00:00Z,2025-03-18T00:00:00Z,181,ocds-9t57fa-93368,ocds-9t57fa-93368-2024-06-21T00:00:00Z
3074,TETA24/FIN/0006/INSURANCE,2025-02-18T10:45:06Z,REQUEST FOR PROPOSALS FROM SERVICE PROVIDERS FOR THE PROVISION OF INSURANCE SERVICES FOR TETA ASSETS FOR A PERIOD OF THIRTY-SIX (MONTHS) UNTIL 31ST MARCH 2027.,active,36364,1995779,ZAR,2027-03-31T00:00:00Z,2024-10-01T00:00:00Z,2027-03-31T00:00:00Z,911,ocds-9t57fa-93371,ocds-9t57fa-93371-2024-06-21T00:00:00Z
3989,LR-AGM-24-24,2025-11-07T13:28:10Z,APPOINTMENT OF A SERVICE PROVIDER TO CONDUCT THE OUTSOURCED INTERNAL AUDITS TO THE NNR FOR 2024/2025 – 2026/2027 FINANCIAL YEARS.,active,36689,579220,ZAR,2027-10-31T00:00:00Z,2024-11-01T00:00:00Z,2027-10-31T00:00:00Z,1094,ocds-9t57fa-94637,ocds-9t57fa-94637-2024-07-05T00:00:00Z
3041,SCMU7-2024/25-0005,2025-02-11T14:12:12Z,APPOINTMENT OF A PANEL OF SERVICE PROVIDERS FOR THE SUPPLY AND DELIVERY OF GOODS AND SERVICES FOR DISASTER RELIEF IN AMATHOLE DISTRICT AND BUFFALO CITY METROPOLITAN FOR THE PERIOD OF THREE (3) YEARS.,active,39765,0,ZAR,2028-01-23T00:00:00Z,2025-01-24T00:00:00Z,2028-01-23T00:00:00Z,1094,ocds-9t57fa-94666,ocds-9t57fa-94666-2024-07-05T00:00:00Z
2503,T225/2024,2024-10-29T13:52:42Z,SUPPLY & DELIVERY OF FESTIVE LIGHTS FOR A PERIOD OF 36 MONTHS,active,37408,6494182,ZAR,2027-06-30T00:00:00Z,2024-10-16T00:00:00Z,2027-06-30T00:00:00Z,987,ocds-9t57fa-95795,ocds-9t57fa-95795-2024-07-19T00:00:00Z
2683,COM027/2024,2024-12-03T10:48:54Z,"COM027 OF 2024 :Purchase, service, fitment and maintenance of fire extinguishers for the municipal buildings and  vehicles, for period of three years,from date of appointment.",active,39454,68780,ZAR,2027-12-02T00:00:00Z,2024-12-03T00:00:00Z,2027-12-02T00:00:00Z,1094,ocds-9t57fa-98539,ocds-9t57fa-98539-2024-08-15T00:00:00Z
3086,COM023/2024,2025-02-21T11:28:35Z,"COM023/2024: APPOINTMENT OF TWO CONTRACTORS FOR THE CLEANING OF PRIVATE PLOTS WITH “BOSSIEKAPPERS”, WEEDEATERS, BRUSHCUTTERS AND  OTHER MACHINERY , AS AND WHEN REQUIRED, FOR A PERIOD OF THREE YEARS FROM DATE OF APPOINTMENT",active,43491,9000,ZAR,2028-02-18T00:00:00Z,2025-02-20T00:00:00Z,2028-02-18T00:00:00Z,1093,ocds-9t57fa-98596,ocds-9t57fa-98596-2024-08-16T00:00:00Z
2468,Q4/2024/25,2024-10-18T17:39:03Z,SUPPLY AND DELIVERY OF CAMERA AND ACCESSORIES,active,35804,26845,ZAR,0001-01-01T00:00:00Z,0001-01-01T00:00:00Z,0001-01-01T00:00:00Z,0,ocds-9t57fa-98771,ocds-9t57fa-98771-2024-08-16T00:00:00Z
3273,MM014/2024,2025-04-08T12:28:36Z,"MM014/2024 - Appointment of a co-sourced internal audit service provider, for a  period from date of appointment until 30 June 2027.",active,46023,7183160,ZAR,2027-06-30T00:00:00Z,2025-03-01T00:00:00Z,2027-06-30T00:00:00Z,851,ocds-9t57fa-101659,ocds-9t57fa-101659-2024-09-12T00:00:00Z
2669,T246/2024,2024-12-02T10:26:33Z,WEB DEVELOPMENT AND MAINTENANCE FOR A PERIOD OF 36 MONTHS                  ,active,39245,743750,ZAR,2027-06-30T00:00:00Z,2024-12-09T00:00:00Z,2027-06-30T00:00:00Z,933,ocds-9t57fa-101906,ocds-9t57fa-101906-2024-09-13T00:00:00Z
3481,HEDP005/24/25,2025-06-17T11:34:28Z,SUPPLY AND DELIVERY OF MEDICAL MALE CIRCUMCISION (MMC) PACKS FOR A PERIOD OF THIRTY SIX (36) MONTHS IN THE DEPARTMENT OF HEALTH: LIMPOPO PROVINCE,active,48967,20000000,ZAR,2028-06-30T00:00:00Z,2025-07-01T00:00:00Z,2028-06-30T00:00:00Z,1095,ocds-9t57fa-105435,ocds-9t57fa-105435-2024-10-18T00:00:00Z
3541,SCMU7-24/25-0008,2025-07-10T12:12:29Z, Appointment of Professional Service Provider to Review the Provincial Spatial Development Framework -2020,active,46213,1483086,ZAR,2026-11-26T00:00:00Z,2025-05-27T00:00:00Z,2026-11-26T00:00:00Z,548,ocds-9t57fa-108471,ocds-9t57fa-108471-2024-11-16T00:00:00Z
2883,P1/AUX/CLN/03/24,2025-01-14T10:45:48Z,"Cleaning Service at 217 Burger Street, Pietermaritzburg EDTEA Office for Period of Six (06) Months
",pending,40237,174148,ZAR,2025-06-30T00:00:00Z,2025-01-01T00:00:00Z,2025-06-30T00:00:00Z,180,ocds-9t57fa-111321,ocds-9t57fa-111321-2024-11-22T00:00:00Z
4390,SCMU5-24/25-0074,2026-02-11T15:15:45Z,PROVISION OF QUANTITY SURVEYING SERVICES AND PRINCIPAL AGENCY FOR CONSTRUCTION OF GRAHAMSTOWN PRIMARY SCHOOL,active,61393,7981753,ZAR,2027-10-10T00:00:00Z,2024-10-10T00:00:00Z,2027-10-10T00:00:00Z,1095,ocds-9t57fa-144901,ocds-9t57fa-144901-2024-04-26T00:00:00Z
1850,C769,2024-05-27T11:32:19Z,UPGRADING OF A PARK NEXT TO NEW BOTSHABELO MALL.,active,28538,2066805,ZAR,2024-08-31T00:00:00Z,2024-06-01T00:00:00Z,2024-08-31T00:00:00Z,91,ocds-9t57fa-79474,ocds-9t57fa-79474-2024-01-27T00:00:00Z
2707,T114/2024,2024-12-04T09:49:47Z,ROAD CONSTRUCTION & BUILDING MATERIALS FOR A PERIOD OF 3 YEARS,active,39399,3284469,ZAR,2027-06-30T00:00:00Z,2024-07-01T00:00:00Z,2027-06-30T00:00:00Z,1094,ocds-9t57fa-84998,ocds-9t57fa-84998-2024-03-15T00:00:00Z
1692,4400004558 / 3600032060,2024-04-03T07:47:58Z,"To supply portable water to the SARS offices for 12 months period on “as” and “when” required basis.
Request for supply of portable water to the SARS offices, contractor to provide long extension hose pipe and pump water to the backup storage water tanks in the buildings.",active,25843,180000,ZAR,2024-12-31T00:00:00Z,2024-04-01T00:00:00Z,2024-12-31T00:00:00Z,274,ocds-9t57fa-86458,ocds-9t57fa-86458-2024-02-23T00:00:00Z
2657,EDUMT02/2024/25,2024-11-28T10:46:30Z,SECTION C EZINGADINI ACCESS ROAD,pending,37200,0,ZAR,0001-01-01T00:00:00Z,0001-01-01T00:00:00Z,0001-01-01T00:00:00Z,0,ocds-9t57fa-86744,ocds-9t57fa-86744-2024-04-06T00:00:00Z
2542,PP09-24/25-02,2024-11-05T20:52:38Z,APPOINTMENT OF A SUITABLE SERVICE PROVIDER TO REVIEW EASTEN CAPE COASTAL MANAGEMENT PROGRAMME,active,32215,1100000,ZAR,2026-03-31T00:00:00Z,2024-08-01T00:00:00Z,2026-03-31T00:00:00Z,607,ocds-9t57fa-88102,ocds-9t57fa-88102-2024-04-20T00:00:00Z
3610,SCMU6-24/25-0001,2025-07-30T12:15:26Z,"Appointment of service provider for the rendering of catering services at 01 ECDOE subsidized school with boarding facility (school hostel) Barkly East High School. 

 ",active,46055,0,ZAR,2027-04-07T00:00:00Z,2025-04-07T00:00:00Z,2027-04-07T00:00:00Z,730,ocds-9t57fa-88653,ocds-9t57fa-88653-2024-04-27T00:00:00Z
3436,4600003264,2025-05-28T11:23:26Z,MP306 DIPALESENG LOCAL OFFICE ACCOMMODATION,active,47983,4822072,ZAR,2032-08-31T00:00:00Z,2024-09-01T00:00:00Z,2032-08-31T00:00:00Z,2921,ocds-9t57fa-88982,ocds-9t57fa-88982-2024-05-03T00:00:00Z
3988,LR-AGM-24-22,2025-11-07T13:24:52Z,"APPOINTMENT OF A SERVICE PROVIDER TO PROVIDE ASSETS ACCOUNTING SOFTWARE, LICENSING, SUPPORT AND MAINTENANCE TO THE NNR FOR A PERIOD OF FOUR (4) YEARS.",active,36696,696838,ZAR,2028-10-31T00:00:00Z,2024-11-01T00:00:00Z,2028-10-31T00:00:00Z,1460,ocds-9t57fa-94611,ocds-9t57fa-94611-2024-07-05T00:00:00Z
3693,SK8/3/1-09/2024/2025,2025-08-14T10:25:35Z,APPOINTMENT OF A SERVICE PROVIDER TO DEVELOP DISASTER RECOVERY PLAN (ONCE OFF).,active,50501,1398400,ZAR,0001-01-01T00:00:00Z,0001-01-01T00:00:00Z,0001-01-01T00:00:00Z,0,ocds-9t57fa-99599,ocds-9t57fa-99599-2024-08-24T00:00:00Z
4590,SCMU3-23/24-0786-HO,2026-03-12T15:57:37Z,SCHEDULE MAINTENANCE OF KITCHEN EQUIPMENT AT CLUSTER 1 - OR TAMBO AND ALFRED NZO HEALTH FACILITIES FOR 36 MONTHS ,active,64820,16243717,ZAR,2028-02-17T00:00:00Z,2025-02-18T00:00:00Z,2028-02-17T00:00:00Z,1094,ocds-9t57fa-86209,ocds-9t57fa-86209-2024-03-28T00:00:00Z
4385,SCMU12-24/25-0006,2026-02-11T12:46:01Z,Rendering of printing services for statutory and ad-hoc documents for Eastern Cape Provincial Treasury (ECPT) for the period of thirty-six (36) months with an option to extend for twenty-four(24) months,active,38869,11948409,ZAR,2027-11-14T00:00:00Z,2024-11-15T00:00:00Z,2027-11-14T00:00:00Z,1094,ocds-9t57fa-102572,ocds-9t57fa-102572-2024-09-20T00:00:00Z
2953,CON015/2024/25,2025-01-29T09:13:53Z,"THE APPOINTMENT OF A SERVICE PROVIDER FOR THE SUPPLY, DELIVERY, INSTALLATION, CONFIGURATION, MAINTENANCE AND SUPPORT OF COMMUNICATION NETWORK INFRASTRUCTURE TO THE NATIONAL ENERGY REGULATOR OF SOUTH AFRICA (NERSA) FOR A PERIOD OF THREE (3) YEAR PERIOD",active,39926,2882534,ZAR,2028-01-15T00:00:00Z,2025-01-16T00:00:00Z,2028-01-15T00:00:00Z,1094,ocds-9t57fa-103166,ocds-9t57fa-103166-2024-09-27T00:00:00Z
4687,CDC/454/24,2026-03-20T20:35:13Z,APPOINTMENT OF A PROFESSIONAL SERVICE PROVIDER FOR THE PROVISION OF ENVIRONMENTAL MANAGEMENT SERVICES FOR THE COEGA SPECIAL ECONOMIC ZONE (SEZ) AND PORT OF NGQURA (PoN),active,46701,4994680,ZAR,2028-04-23T00:00:00Z,2025-04-23T00:00:00Z,2028-04-23T00:00:00Z,1096,ocds-9t57fa-107226,ocds-9t57fa-107226-2024-11-08T00:00:00Z
4700,CDC/454/24,2026-03-23T12:50:55Z,APPOINTMENT OF A PROFESSIONAL SERVICE PROVIDER FOR THE PROVISION OF ENVIRONMENTAL MANAGEMENT SERVICES FOR THE COEGA SPECIAL ECONOMIC ZONE (SEZ) AND PORT OF NGQURA (PoN),active,46701,4994680,ZAR,2028-04-23T00:00:00Z,2025-04-23T00:00:00Z,2028-04-23T00:00:00Z,1096,ocds-9t57fa-107226,ocds-9t57fa-107226-2024-11-08T00:00:00Z
4574,SCMU3-24/25-0471-JG,2026-03-12T10:34:41Z,"Appointment of service providers for the provision of security services at Joe Gqabi Health District Facilities, in the Eastern Cape Department of Health for a period of 36 months on a rate basis as and when required",active,64821,0,ZAR,2028-11-30T00:00:00Z,2025-12-01T00:00:00Z,2028-11-30T00:00:00Z,1095,ocds-9t57fa-109290,ocds-9t57fa-109290-2024-11-22T00:00:00Z
5283,G533/2024,2026-05-09T15:03:03Z,THE APPOINTMENT OF A SERVICE PROVIDER TO PROVIDE SECURITY GUARDING SERVICES FOR THE SOUTH AFRICAN NATIONAL BIODIVERSITY INSTITUTE (SANBI) AT THE KWELERA NATIONAL BOTANICAL GARDEN FOR A PERIOD OF THREE (3) YEARS,pending,62918,2916838,ZAR,2029-07-31T00:00:00Z,2026-08-01T00:00:00Z,2029-07-31T00:00:00Z,1095,ocds-9t57fa-111015,ocds-9t57fa-111015-2024-12-13T00:00:00Z
5313,SSP 3439,2026-05-12T10:17:58Z,Monthly statutory service of goods and passenger lifts for a period of five years,active,68517,4379872,ZAR,2028-04-01T00:00:00Z,2023-05-01T00:00:00Z,2028-04-01T00:00:00Z,1797,ocds-9t57fa-155775,ocds-9t57fa-155775-2024-05-24T00:00:00Z
1564,T12/2024,2024-03-14T10:21:25Z,APPOINTMENT OF SERVICE PROVIDER TO PREPARE 2 TOWN PLANNING APPLICATIONS: EXTENSION OF THE CEMETERY & CARAVAN PARK,active,24890,87860,ZAR,2024-06-28T00:00:00Z,2024-03-01T00:00:00Z,2024-06-28T00:00:00Z,119,ocds-9t57fa-78694,ocds-9t57fa-78694-2024-01-19T00:00:00Z
2343,SCMU8-24/25-0004,2024-10-04T10:12:21Z,"SUPPLY, DELIVERY AND CONSTRUCTION OF A SHEARING SHED AT UPPER TOKWANA VILLAGE IN ELUNDINI LOCAL MUNICIPALITY OF THE JOE GQABI DISTRICT",active,28072,0,ZAR,2024-09-26T00:00:00Z,2024-05-23T00:00:00Z,2024-09-26T00:00:00Z,126,ocds-9t57fa-79350,ocds-9t57fa-79350-2024-01-26T00:00:00Z
2347,SCMU8-24/25-0007,2024-10-04T10:30:47Z,"SUPPLY, DELIVERY AND CONSTRUCTION OF A MULTIPURPOSE SHED AT SCHOEMANSHOEK FARM IN THE WALTER SISULU LOCAL MUNICIPALITY OF THE JOE GQABI DISTRICT",active,27330,0,ZAR,2024-08-12T00:00:00Z,2024-05-10T00:00:00Z,2024-08-12T00:00:00Z,94,ocds-9t57fa-79370,ocds-9t57fa-79370-2024-01-26T00:00:00Z
4545,SCMU3-23/24-0684,2026-03-10T10:55:00Z,"Dora Nginza Hospital - Improvements to existing buildings - Phase 3: Upgrade and Additions to Block A & B for  Treatment of Cerebral Palsy Patients (Gqeberha, Nelson Mandela Bay Health District)",active,64776,64860917,ZAR,2026-06-10T00:00:00Z,2025-03-11T00:00:00Z,2026-06-10T00:00:00Z,456,ocds-9t57fa-80241,ocds-9t57fa-80241-2024-02-02T00:00:00Z
2675,T78/2024,2024-12-02T11:36:46Z,"SUPPLY, FITMENT & REPAIR OF TYRES IN THE CAPE AGULGAS AREA FOR A PERIOD OF 3 YEARS",active,39359,23664,ZAR,2027-06-30T00:00:00Z,2024-07-01T00:00:00Z,2027-06-30T00:00:00Z,1094,ocds-9t57fa-81889,ocds-9t57fa-81889-2024-02-16T00:00:00Z
2738,T219/2024,2024-12-04T10:23:26Z,PLANT HIRE FOR CONSTRUCTION PURPOSES,active,39429,165324,ZAR,2027-06-30T00:00:00Z,2024-10-07T00:00:00Z,2027-06-30T00:00:00Z,996,ocds-9t57fa-85010,ocds-9t57fa-85010-2024-03-15T00:00:00Z
4509,PWR 193/23,2026-03-02T14:46:43Z,Leasing of Office Accommodation (existing Building) measuring 1236m² with 23 covered parking bays through open tender on behalf of the Department of Social Development (Ditsobotla Service Point) in Lichtenburg for a period of 36 Months,active,61504,9646304,ZAR,2028-03-31T00:00:00Z,2025-04-01T00:00:00Z,2028-03-31T00:00:00Z,1095,ocds-9t57fa-85027,ocds-9t57fa-85027-2024-03-15T00:00:00Z
3375,HEDP019/23/24,2025-05-08T15:02:27Z,SUPPLY AND DELIVERY OF GROCERIES TO ALL INSTITUTIONS IN THE LIMPOPO DEPARTMENT OF HEALTH FOR A PERIOD OF THIRTY-SIX (36) MONTHS,active,46936,50000000,ZAR,2028-04-30T00:00:00Z,2025-05-01T00:00:00Z,2028-04-30T00:00:00Z,1095,ocds-9t57fa-85158,ocds-9t57fa-85158-2024-03-15T00:00:00Z
5053,SLA-0355,2026-04-20T06:22:31Z,APPOINTMENT OF AN INDIVIDUAL (SERVICE PROVIDER) TO SUPPORT THE LOCAL GOVERNMENT INFRASTRUCTURE UNIT OF THE INTERGOVERNMENTAL RELATIONS DIVISION OF THE NATIONAL TREASURY WITH THE IMPLEMENTATION AND IMPLEMENTATION OVERSIGHT OF THE LOCAL GOVERNMENT FRAMEWORK FOR INFRASTRUCTURE DELIVERY AND PROCUREMENT MANAGEMENT FOR A PERIOD OF THREE YEARS,active,58762,6284520,ZAR,2029-03-02T00:00:00Z,2026-03-03T00:00:00Z,2029-03-02T00:00:00Z,1095,ocds-9t57fa-86242,ocds-9t57fa-86242-2024-03-28T00:00:00Z
1699,4400004537,2024-04-04T10:42:20Z,"Service, install and maintain aluminum manual and automated doors and windows, Western Cape Offices",active,25859,999900,ZAR,2026-03-31T00:00:00Z,2024-04-01T00:00:00Z,2026-03-31T00:00:00Z,729,ocds-9t57fa-86346,ocds-9t57fa-86346-2024-01-26T00:00:00Z
3614,SCMU10-24/25-0003,2025-07-30T14:05:28Z,APPOINTMENT OF A PANEL OF ACCREDITED TRAINING SERVICE PROVIDERS FOR THE DEPARTMENT OF TRANSPORT FOR A PERIOD OF THREE YEARS,active,50664,1,ZAR,2028-03-13T00:00:00Z,2025-03-13T00:00:00Z,2028-03-13T00:00:00Z,1096,ocds-9t57fa-88078,ocds-9t57fa-88078-2024-04-19T00:00:00Z
3126,001/2024/25,2025-03-03T11:34:59Z,LEASING OF OFFICE ACCOMMODATION FOR THE EASTERN CAPE LIQUOR BOARD IN KOMANI FOR A PERIOD 5 YEARS WITH AN OPTION TO OPTION TO RENEW FOR A PERIOD OF TWO YEARS.,pending,34598,0,ZAR,2029-10-31T00:00:00Z,2024-11-01T00:00:00Z,2029-10-31T00:00:00Z,1825,ocds-9t57fa-90397,ocds-9t57fa-90397-2024-05-17T00:00:00Z
3254,001/2024/25,2025-04-02T13:08:54Z,LEASING OF OFFICE ACCOMMODATION FOR THE EASTERN CAPE LIQUOR BOARD IN KOMANI FOR A PERIOD 5 YEARS WITH AN OPTION TO OPTION TO RENEW FOR A PERIOD OF TWO YEARS.,active,34598,2061484,ZAR,2029-10-31T00:00:00Z,2024-11-01T00:00:00Z,2029-10-31T00:00:00Z,1825,ocds-9t57fa-90397,ocds-9t57fa-90397-2024-05-17T00:00:00Z
2306,SCMU8-24/25-0077,2024-09-25T14:30:31Z,"SUPPLY, DELIVERY AND ASSEMBLE OF SEWING MACHINES
",active,35837,2228461,ZAR,0001-01-01T00:00:00Z,0001-01-01T00:00:00Z,0001-01-01T00:00:00Z,0,ocds-9t57fa-92340,ocds-9t57fa-92340-2024-06-07T00:00:00Z
3062,HEDP 004/24/25,2025-02-13T15:43:23Z,RENDERING OF LAUNDRY SERVICES IN THE LIMPOPO DEPARTMENT OF HEALTH FOR A PERIOD OF THIRTY-SIX (36) MONTHS,active,40320,50000000,ZAR,2028-01-31T00:00:00Z,2025-02-01T00:00:00Z,2028-01-31T00:00:00Z,1094,ocds-9t57fa-95243,ocds-9t57fa-95243-2024-07-12T00:00:00Z
4904,4660019094,2026-03-31T19:23:47Z,"TERMS OF REFERENCE FOR THE APPOINTMENT OF A SERVICE PROVIDER FOR RECORDS SCANNING, INDEXING AND ONLINE ARCHIVING",pending,38438,1098837,ZAR,2025-06-30T00:00:00Z,2025-01-02T00:00:00Z,2025-06-30T00:00:00Z,179,ocds-9t57fa-96578,ocds-9t57fa-96578-2024-07-26T00:00:00Z
4902,4660019449,2026-03-31T19:10:52Z,"TERMS OF REFERENCE OF THE CLOTHING, TEXTILE, LEATHER AND FOOTWEAR SECTOR DEVELOPMENT PROGRAMME TO BE IMPLEMENTED OVER A THREE-YEAR PERIOD",pending,40039,4239867,ZAR,2028-01-31T00:00:00Z,2025-02-01T00:00:00Z,2028-01-31T00:00:00Z,1094,ocds-9t57fa-96596,ocds-9t57fa-96596-2024-07-26T00:00:00Z
4903,4660019208,2026-03-31T19:17:50Z,TERMS OF REFERENCE FOR THE REFURBISHMENT OF RECORDS MANAGEMENT CENTRE/ MAIN REGISTRY FOR GAUTENG DEPARTMENT OF ECONOMIC DEVELOPMENT (GDED) ,pending,38440,1374738,ZAR,2026-07-21T00:00:00Z,2025-01-22T00:00:00Z,2026-07-21T00:00:00Z,545,ocds-9t57fa-96630,ocds-9t57fa-96630-2024-07-26T00:00:00Z
4752,KZN07/2024,2026-03-24T15:20:39Z,36 MONTHS SECURITY SERVICE FOR PINETOWN LABOUR CENTRE,active,49186,1829272,ZAR,2028-08-31T00:00:00Z,2025-09-01T00:00:00Z,2028-08-31T00:00:00Z,1095,ocds-9t57fa-96686,ocds-9t57fa-96686-2024-07-26T00:00:00Z
4419,COGHSTAB10/2024-25FY,2026-02-16T09:36:30Z,THE APPOINTMENT OF SERVICE PROVIDER TO PROCURE GIS GPS’S AND SURVEY GPS’S.,active,44568,1219635,ZAR,2027-03-31T00:00:00Z,2025-03-11T00:00:00Z,2027-03-31T00:00:00Z,750,ocds-9t57fa-97286,ocds-9t57fa-97286-2024-08-02T00:00:00Z
4488,CSPS01/24-25,2026-02-26T11:23:02Z,BID NO: CSPS01/2024-2025: THE APPOINTMENT OF A TRAVEL AGENCY(S) TO RENDER TRAVEL MANAGEMENT SERVICES TO THE CIVILIAN SECRETARIAT FOR POLICE SERVICE (CSPS) FOR A PERIOD OF THREE (3) YEARS ,active,44604,955,ZAR,2028-03-31T00:00:00Z,2025-04-01T00:00:00Z,2028-03-31T00:00:00Z,1095,ocds-9t57fa-97393,ocds-9t57fa-97393-2024-08-02T00:00:00Z
3645,CON008/2025/26,2025-08-07T09:46:39Z,THE APPOINTMENT OF A PANEL OF ADVERTISING AND MEDIA BUYING SERVICE PROVIDERS TO ASSIST THE NATIONAL ENERGY REGULATOR OF SOUTH (NERSA) WITH ADVERTISING /MEDIA BUYING SERVICES FOR A PERIOD OF THREE (3) YEARS.,active,45768,30000000,ZAR,2028-06-18T00:00:00Z,2025-06-17T00:00:00Z,2028-06-18T00:00:00Z,1097,ocds-9t57fa-97448,ocds-9t57fa-97448-2024-08-02T00:00:00Z
3431,HEDP 011/24/25,2025-05-27T09:18:26Z,"ACCREDITATION OF SERVICE PROVIDERS FOR THE PROVISIONING OF SPECIALIZED CLINICAL,
SURGICAL AND DIAGNOSTIC SERVICES FOR THE LIMPOPO DEPARTMENT OF HEALTH FOR A PERIOD
OF 36 MONTHS.",active,47837,50000000,ZAR,2028-05-31T00:00:00Z,2025-06-01T00:00:00Z,2028-05-31T00:00:00Z,1095,ocds-9t57fa-98723,ocds-9t57fa-98723-2024-08-16T00:00:00Z
3676,SCMU15-24/25-001,2025-08-12T11:00:53Z,"RENDERING OF TRAVEL MANAGEMENT SERVICES IN RESPECT OF AIR TRAVEL, CAR HIRE, VENUES & FACILITIES, ACCOMMODATION AND REALTED SERVICES TO THE DEPARTMENT OF COMMUNITY SAFETY FOR A PERIOD OF THIRTY-SIX (36) MONTHS ",active,45399,15000000,ZAR,2028-03-31T00:00:00Z,2025-04-01T00:00:00Z,2028-03-31T00:00:00Z,1095,ocds-9t57fa-99423,ocds-9t57fa-99423-2024-08-23T00:00:00Z
3312,13 DARD 20/2024,2025-04-11T16:28:59Z,13 DARD 20/2024:CONSTRUCTION OF LOW ROOF STRUCTURE AND ABLUTION FACILITY AT MATUWANE ANIMAL FEED,pending,39637,1958027,ZAR,0001-01-01T00:00:00Z,0001-01-01T00:00:00Z,0001-01-01T00:00:00Z,0,ocds-9t57fa-101691,ocds-9t57fa-101691-2024-09-12T00:00:00Z
2668,T245/2024,2024-12-02T10:25:40Z,"SUPPLY, DELIVERY AND INSTALL OF 2-WAY RADIOS FOR A PERIOD OF 36 MONTHS",active,39244,813438,ZAR,2027-06-30T00:00:00Z,2024-12-09T00:00:00Z,2027-06-30T00:00:00Z,933,ocds-9t57fa-101905,ocds-9t57fa-101905-2024-09-13T00:00:00Z
2897,T278/2024,2025-01-16T12:52:18Z,MAINTENANCE & REPAIRS OF MUNICIPAL BUILDINGS (ELECTRICAL),active,40853,439758,ZAR,2027-06-30T00:00:00Z,2025-01-06T00:00:00Z,2027-06-30T00:00:00Z,905,ocds-9t57fa-103870,ocds-9t57fa-103870-2024-10-04T00:00:00Z
3647,CON007/2025/26,2025-08-07T09:55:00Z,THE APPOINTMENT OF A SERVICE PROVIDER TO PROVIDE AN INTEGRATED FACILITIES MANAGEMENT SERVICES (IFMS) FOR A PERIOD OF THREE (3) YEARS.,active,45366,13541252,ZAR,2028-05-31T00:00:00Z,2025-06-01T00:00:00Z,2028-05-31T00:00:00Z,1095,ocds-9t57fa-104519,ocds-9t57fa-104519-2024-10-11T00:00:00Z
2448,63217,2024-10-16T11:53:27Z,REQUEST FOR THE APPOINTMENT OF A SERVICE PROVIDER TO CONDUCT A REVIEW OF THE DISTRICT DEVELOPMENT MODEL/JOINT DISTRICT METRO APPROACH TOWARDS A SALGA POLICY POSITION.,active,36853,860448,ZAR,0001-01-01T00:00:00Z,0001-01-01T00:00:00Z,0001-01-01T00:00:00Z,0,ocds-9t57fa-104856,ocds-9t57fa-104856-2024-08-23T00:00:00Z
2565,63392,2024-11-07T20:41:51Z,Purchasing of Multi-function printer for FS office (Printer 2) for 36 Months - Kyocera Taskalfa 2254ci,active,38030,229803,ZAR,2026-10-02T00:00:00Z,2024-10-03T00:00:00Z,2026-10-02T00:00:00Z,729,ocds-9t57fa-107266,ocds-9t57fa-107266-2024-09-20T00:00:00Z
2664,64175,2024-11-29T12:12:21Z,APPOINTMENT OF A SERVICE PROVIDER FOR THE SUPPLY AND DELIVERY OF SALGA BRANDED PENS AND SALGA BRANDED VACUUM MUGS,active,39141,143685,ZAR,0001-01-01T00:00:00Z,0001-01-01T00:00:00Z,0001-01-01T00:00:00Z,0,ocds-9t57fa-109469,ocds-9t57fa-109469-2024-11-08T00:00:00Z
3418,P4/CONS/03/24,2025-05-20T11:06:20Z,APPOINTMENT OF A SUITABLE SERVICE PROVIDER TO FACILITATE THE CONSUMER EDUCATION AND AWARENESS PROGRAMMES IN COMMUNITY RADIO STATIONS FOR ALL 11 DISTRICTS OF KWAZULU-NATAL FOR 4 MONTHS,active,41993,889384,ZAR,2025-05-31T00:00:00Z,2025-02-01T00:00:00Z,2025-05-31T00:00:00Z,119,ocds-9t57fa-110349,ocds-9t57fa-110349-2024-12-05T00:00:00Z
2851,64104,2024-12-12T13:22:06Z,"Legal Services: Urgent Application -AfriForum VS NERSA, SALGA, Eskom & Others - Chaane Attorneys.",active,39883,2800000,ZAR,2024-11-29T00:00:00Z,2024-11-14T00:00:00Z,2024-11-29T00:00:00Z,15,ocds-9t57fa-110627,ocds-9t57fa-110627-2024-06-14T00:00:00Z
2914,3100036858,2025-01-22T12:16:58Z,PPE,active,41254,182775,ZAR,0001-01-01T00:00:00Z,0001-01-01T00:00:00Z,0001-01-01T00:00:00Z,0,ocds-9t57fa-112065,ocds-9t57fa-112065-2024-10-31T00:00:00Z
