id,title,dateSigned,description,status,awardID,value_amount,value_currency,period_endDate,period_startDate,period_maxExtentDate,period_durationInDays,main_ocid,main_id
2488,63741,2024-10-24T18:42:41Z,"Procurement of 20 X Dell Latitude 5440 i5 processor; 500GB SSD; 8GB memory; internal 4G & eSim enabled; 3-year warranty); 20 x 15 inches Turgus Laptop
Backpacks;50 x Dell USB Travel Mouse",active,37184,447825,ZAR,0001-01-01T00:00:00Z,0001-01-01T00:00:00Z,0001-01-01T00:00:00Z,0,ocds-9t57fa-105945,ocds-9t57fa-105945-2024-09-27T00:00:00Z
3666,8/2/1/25/57,2025-08-11T14:32:44Z,"RE-ADVERT - DESIGN, PRINT, SUPPLY AND DELIVER OF MARKETING BRANDING AND PROMOTIONAL MATERIAL",active,48133,300000,ZAR,0001-01-01T00:00:00Z,0001-01-01T00:00:00Z,0001-01-01T00:00:00Z,0,ocds-9t57fa-106722,ocds-9t57fa-106722-2024-10-31T00:00:00Z
2547,63766,2024-11-06T13:22:33Z,"Production for SALGA TV digital content development for the 8th Karoo Region Conference 29-30 October, Cradock-Eastern Cape",active,37957,428070,ZAR,0001-01-01T00:00:00Z,0001-01-01T00:00:00Z,0001-01-01T00:00:00Z,0,ocds-9t57fa-107069,ocds-9t57fa-107069-2024-10-11T00:00:00Z
2817,Q16/2024/25,2024-12-10T11:00:04Z,SUPPLY AND DELIVERY OF 2 STORAGE CONTAINERS ,active,39738,105165,ZAR,0001-01-01T00:00:00Z,0001-01-01T00:00:00Z,0001-01-01T00:00:00Z,0,ocds-9t57fa-107619,ocds-9t57fa-107619-2024-11-08T00:00:00Z
3224,SCMU 03 -2023/2024,2025-03-20T13:22:12Z,PROVISION OF SHARED INTERNAL AUDIT SERVICES FOR ECRDA AND MAGWA TEA ESTATE,pending,41226,1477421,ZAR,0001-01-01T00:00:00Z,0001-01-01T00:00:00Z,0001-01-01T00:00:00Z,0,ocds-9t57fa-109118,ocds-9t57fa-109118-2024-11-22T00:00:00Z
3150,P4/CONS/02/24,2025-03-06T14:25:51Z,"APPOINTMENT OF A SERVICE PROVIDER TO CONDUCT THE FINANCIAL LITERACY EDUTAINMENT SERVICES ON CONSUMER EDUCATION AND AWARENESS AT PRIMARY SCHOOLS, SECONDARY SCHOOLS, TERTIARY INSTITUTIONS, SHOPPING MALLS, TAXI RANKS IN ALL 11 DISTRICTS OF KWAZULU-NATAL FOR 4 MONTHS",active,41423,995000,ZAR,2025-05-31T00:00:00Z,2025-02-01T00:00:00Z,2025-05-31T00:00:00Z,119,ocds-9t57fa-110290,ocds-9t57fa-110290-2024-12-05T00:00:00Z
2925,3100036892,2025-01-22T14:29:23Z,Relocations ,active,41273,121359,ZAR,0001-01-01T00:00:00Z,0001-01-01T00:00:00Z,0001-01-01T00:00:00Z,0,ocds-9t57fa-112121,ocds-9t57fa-112121-2024-11-08T00:00:00Z
3039,64729,2025-02-11T12:45:31Z,REQUEST FOR PROPOSALS FOR THE APPOINTMENT OF SERVICE PROVIDER FOR BACK-END PHYSICAL NETWORK OVERHAUL AND UPGRADE - SALGA/03/2024,active,43172,2851655,ZAR,2025-05-30T00:00:00Z,2024-11-01T00:00:00Z,2025-05-30T00:00:00Z,210,ocds-9t57fa-114329,ocds-9t57fa-114329-2024-05-30T00:00:00Z
3442,7E-31151,2025-05-29T11:06:42Z,"Alienation of Erf 526 Lovu, located at 15-10070 street, by private Treaty to Illovo Assembly of God registration number 118-191 NPO ",active,48065,67000,ZAR,2025-03-12T00:00:00Z,2024-12-12T00:00:00Z,2025-03-12T00:00:00Z,90,ocds-9t57fa-123596,ocds-9t57fa-123596-2024-05-17T00:00:00Z
3776,DHS 18/2022,2025-09-09T09:01:04Z,"Appointment of a service provider for the construction of low-cost housing units at Dryharts Village: Greater Taung
Local Municipality",active,54557,20850700,ZAR,2026-10-31T00:00:00Z,2024-06-11T00:00:00Z,2026-10-31T00:00:00Z,872,ocds-9t57fa-133224,ocds-9t57fa-133224-2024-01-26T00:00:00Z
2116,SCMU8-24/25-0019,2024-08-14T10:50:00Z,"THE SUPPLY, DELIVERY AND CONSTRUCTION OF A SHEARING SHED WITH SMALL STOCK DIPPING TANK AT MIRELESS LOCATION IN MNQUMA LOCAL MUNICIPALITY OF THE AMATHOLE DISTRICT.",active,25576,1281468,ZAR,2024-08-15T00:00:00Z,2024-04-15T00:00:00Z,2024-08-15T00:00:00Z,122,ocds-9t57fa-80737,ocds-9t57fa-80737-2024-02-09T00:00:00Z
1645,60149,2024-03-19T11:57:49Z,ARBITRATION CASE MATTER: INVOICE REF 1097690 OF JAN 2023,active,25207,187154,ZAR,2024-02-09T00:00:00Z,2024-02-05T00:00:00Z,2024-02-09T00:00:00Z,4,ocds-9t57fa-84746,ocds-9t57fa-84746-2024-02-02T00:00:00Z
2691,T125/2024,2024-12-04T09:29:11Z,SUPPLY & DELIVERY OF BRICKS FOR A PERIOD OF 3 YEARS,active,39434,1236333,ZAR,2027-06-30T00:00:00Z,2024-07-01T00:00:00Z,2027-06-30T00:00:00Z,1094,ocds-9t57fa-85009,ocds-9t57fa-85009-2024-03-15T00:00:00Z
1874,T49/2024,2024-06-11T08:45:22Z,UPGRADING OF SPOOKDRAAI ACCESS ROAD IN L’AGULHAS,active,29306,776037,ZAR,2025-06-27T00:00:00Z,2024-06-03T00:00:00Z,2025-06-27T00:00:00Z,389,ocds-9t57fa-85666,ocds-9t57fa-85666-2024-03-22T00:00:00Z
3632,SCMU10-22/23-0030,2025-08-05T14:18:47Z,"
THE COMPLETION OF UPGRADING TO A SURFACE STANDARD DR08606
 (+/- 12Km) STERKSPRUIT TO MLAMLI 

",active,46724,282841532,ZAR,2028-08-18T00:00:00Z,2024-11-21T00:00:00Z,2028-08-18T00:00:00Z,1366,ocds-9t57fa-86237,ocds-9t57fa-86237-2024-03-28T00:00:00Z
2491,LR-AGM-24-13,2024-10-25T13:46:50Z,APPOINTMENT OF A SERVICE PROVIDER FOR THE PROVISION OF PHYSICAL SECURITY SERVICES AT THE NNR HEAD OFFICE IN CENTURION AND SITE OFFICE IN CAPE TOWN FOR A PERIOD OF THREE (3) YEARS.,active,32064,11978124,ZAR,2027-07-31T00:00:00Z,2024-08-01T00:00:00Z,2027-07-31T00:00:00Z,1094,ocds-9t57fa-87418,ocds-9t57fa-87418-2024-04-12T00:00:00Z
1984,T87/2024,2024-07-12T13:58:02Z,REPAIR AND PAINTING OF ARNISTON LIBRARY ,active,29303,71025,ZAR,0001-01-01T00:00:00Z,0001-01-01T00:00:00Z,0001-01-01T00:00:00Z,0,ocds-9t57fa-88490,ocds-9t57fa-88490-2024-04-26T00:00:00Z
3310,13 DARD 03/2024,2025-04-11T16:00:22Z,13 DARD 03/2024 : REPLACEMENT OF THE MAIN POWER STATION AT POTCHFESTROOM COLLEGE OF AGRICULTURE,active,31842,1162237,ZAR,0001-01-01T00:00:00Z,0001-01-01T00:00:00Z,0001-01-01T00:00:00Z,0,ocds-9t57fa-89760,ocds-9t57fa-89760-2024-05-10T00:00:00Z
3261,13 DARD 06/2024,2025-04-03T10:17:45Z,"13 DARD 06/2024 :SUPPLY,DELIVERY AND OFFLOADING OF SIX (6) INTER ROW SEEDER NO-TILL PLANTERS (3-POINT HITCH) EIGHT (8) ROW FINE SEED NO TILL PLANTERS (3-POINT HITCH) SIX (6) ROW TRAILED NO TILL PLANTER WITH HYDRAULIC MARKER AND 2000L TRAILED HYDRAULIC BOOMSPRAYER",active,32595,2155824,ZAR,0001-01-01T00:00:00Z,0001-01-01T00:00:00Z,0001-01-01T00:00:00Z,0,ocds-9t57fa-89774,ocds-9t57fa-89774-2024-05-10T00:00:00Z
1840,3100035808,2024-05-16T11:16:03Z,WATER TESTING: LIMPOPO; NORTHWEST AND MPUMALANGA,active,28312,130040,ZAR,2024-06-30T00:00:00Z,2024-04-29T00:00:00Z,2024-06-30T00:00:00Z,62,ocds-9t57fa-90181,ocds-9t57fa-90181-2024-04-19T00:00:00Z
3100,SCMU5-24/25-0082,2025-02-27T12:15:37Z,RENOVATIONS AND ADDITIONS TO SEYMOUR SERVICE OFFICE,active,43470,17800960,ZAR,2025-02-12T00:00:00Z,2025-02-11T00:00:00Z,2025-02-12T00:00:00Z,1,ocds-9t57fa-92967,ocds-9t57fa-92967-2024-06-14T00:00:00Z
3070,TETA24/RESEARCH/0002/OPPORTUNITIES,2025-02-18T10:34:26Z,REQUEST FOR PROPOSALS FROM SERVICE PROVIDERS TO CONDUCT A COMPREHENSIVE STUDY TO EXPLORE SKILLS DEVELOPMENT AND MARKET OPPORTUNITIES FOR SMMEs WITHIN THE TRANSPORT SECTOR.,active,35660,920000,ZAR,2025-03-18T00:00:00Z,2024-09-18T00:00:00Z,2025-03-18T00:00:00Z,181,ocds-9t57fa-93367,ocds-9t57fa-93367-2024-06-21T00:00:00Z
3073,TETA24/RESEARCH/0005/TRACER-LAST MILE,2025-02-18T10:41:54Z,REQUEST FOR PROPOSALS FROM SERVICE PROVIDERS TO CONDUCT A COMPREHENSIVE STUDY TO INVESTIGATE THE ENHANCEMENT OF THE CURRENT PROCESSES FOR QUALIFICATION DEVELOPMENT AND ACCREDITATION.,active,36366,396750,ZAR,2025-04-03T00:00:00Z,2024-10-03T00:00:00Z,2025-04-03T00:00:00Z,182,ocds-9t57fa-93370,ocds-9t57fa-93370-2024-06-21T00:00:00Z
2067,BA065/2024q,2024-07-24T16:32:58Z,"BA065/2024q – Appointment Of A Service Provider For The Recruitment And Selection Process Of The Municipal Manager And The Director: Human Settlements, Planning And Development, In Line With The Regulations On Appointment And Conditions Of Employment Of Senior Managers, 2014",active,31704,97750,ZAR,0001-01-01T00:00:00Z,0001-01-01T00:00:00Z,0001-01-01T00:00:00Z,0,ocds-9t57fa-93386,ocds-9t57fa-93386-2024-06-21T00:00:00Z
2355,BA057/2024,2024-10-04T15:00:35Z,"THE APPOINTMENT OF A SERVICE PROVIDER FOR THE RECRUITMENT AND SELECTION PROCESS FOR SENIOR MANAGERS IN TERMS OF THE SYSTEMS ACT 32 OF 2000 SECTION 56 & 57, IN LINE WITH THE REGULATIONS ON APPOINTMENT AND CONDITIONS OF EMPLOYMENT OF SENIOR MANAGERS, 2014 FROM DATE OF APPOINTMENT UNTIL 30 JUNE 2027 ",active,36273,163141,ZAR,2027-06-30T00:00:00Z,2024-10-01T00:00:00Z,2027-06-30T00:00:00Z,1002,ocds-9t57fa-93504,ocds-9t57fa-93504-2024-06-21T00:00:00Z
1948,3100036000,2024-06-29T17:21:10Z,National Management Forum event,active,30500,725950,ZAR,0001-01-01T00:00:00Z,0001-01-01T00:00:00Z,0001-01-01T00:00:00Z,0,ocds-9t57fa-94104,ocds-9t57fa-94104-2024-05-16T00:00:00Z
2125,62447,2024-08-16T10:13:37Z,Lawtons Africa Attorneys (Eskom & 12 Others MYPD Price Increase matter),active,32436,450000,ZAR,2024-08-05T00:00:00Z,2024-07-01T00:00:00Z,2024-08-05T00:00:00Z,35,ocds-9t57fa-97952,ocds-9t57fa-97952-2024-08-02T00:00:00Z
2866,COM025/2024q,2024-12-18T07:55:27Z,COM025 OF 2024q : Supply  and  Delivery  of  8 Heavy  Duty Brush cutters .,active,40096,126435,ZAR,0001-01-01T00:00:00Z,0001-01-01T00:00:00Z,0001-01-01T00:00:00Z,0,ocds-9t57fa-98592,ocds-9t57fa-98592-2024-08-16T00:00:00Z
2504,T231/2024,2024-10-29T13:54:16Z,"SUPPLY, DELIVERY & INSTALLATION OF OUTDOOR PLAYGROUND EQUIPMENT",active,37407,487094,ZAR,0001-01-01T00:00:00Z,0001-01-01T00:00:00Z,0001-01-01T00:00:00Z,0,ocds-9t57fa-99459,ocds-9t57fa-99459-2024-08-23T00:00:00Z
3458,4600003266,2025-06-06T18:10:09Z,CLEANING AND HYGIENE SERVICES - NATIONAL OFFICE,active,48682,4833738,ZAR,2028-05-31T00:00:00Z,2025-06-01T00:00:00Z,2028-05-31T00:00:00Z,1095,ocds-9t57fa-103117,ocds-9t57fa-103117-2024-09-27T00:00:00Z
2571,OLS001,2024-11-08T14:09:17Z,SPSS (Statistics package for social sciences) software subscription,pending,38059,543123,ZAR,2026-06-30T00:00:00Z,2024-07-01T00:00:00Z,2026-06-30T00:00:00Z,729,ocds-9t57fa-107542,ocds-9t57fa-107542-2024-05-03T00:00:00Z
4387,SCMU12-24/25-0008,2026-02-11T13:38:48Z,Appointment of  a competent service provider to facilitate Travel Management Services ( Full Online Booking System)  for the Eastern Cape Provincial Treasury (ECPT) for a period of thirty- six (36) months,active,45190,0,ZAR,2028-03-31T00:00:00Z,2025-04-01T00:00:00Z,2028-03-31T00:00:00Z,1095,ocds-9t57fa-109841,ocds-9t57fa-109841-2024-11-29T00:00:00Z
4284,SCMU5-24/25-0073,2026-01-30T11:27:53Z,PROVISION OF QUANTITY SURVEYING SERVICES AND PRINCIPAL AGENCY FOR CONSTRUCTION OF ADDO PRIMARY SCHOOL,active,61116,5728934,ZAR,2027-10-10T00:00:00Z,2024-10-10T00:00:00Z,2027-10-10T00:00:00Z,1095,ocds-9t57fa-144898,ocds-9t57fa-144898-2024-04-26T00:00:00Z
2096,BA015/2024,2024-08-05T14:59:44Z,"BA015/2024 - Supply, Delivery and Commissioning of a Sound and Recording System for the Council Chambers, George Municipality.",active,32186,546195,ZAR,0001-01-01T00:00:00Z,0001-01-01T00:00:00Z,0001-01-01T00:00:00Z,0,ocds-9t57fa-85674,ocds-9t57fa-85674-2024-03-22T00:00:00Z
2659,EDUMT03/2024/25,2024-11-28T10:58:36Z,KWAMADINSI ROAD WARD 6,pending,37211,0,ZAR,0001-01-01T00:00:00Z,0001-01-01T00:00:00Z,0001-01-01T00:00:00Z,0,ocds-9t57fa-86745,ocds-9t57fa-86745-2024-04-06T00:00:00Z
2524,DPD018/2024,2024-11-01T13:13:30Z,"PROVISION FOR PROCUREMENT AND MAINTENANCE OF AN AUTOMATED PERFOMANCE MANAGEMENT SYSTEM, RISK AND AUDIT SYSTEM FOR A PERIOD OF THREE (3) YEARS FROM DATE OF APPOINTMENT",active,37677,4220201,ZAR,2027-10-31T00:00:00Z,2024-11-01T00:00:00Z,2027-10-31T00:00:00Z,1094,ocds-9t57fa-90396,ocds-9t57fa-90396-2024-05-17T00:00:00Z
3421,SCMU6-24/25-0009,2025-05-21T12:53:42Z,"Printing, packaging, storage of high security examination and assessment material and other related examination learner support material – printed digital and in any other appropriate format for Grades 1 – 12, AET Level 4 and provisioning of examinations data related services.",active,46097,0,ZAR,2028-04-01T00:00:00Z,2025-04-02T00:00:00Z,2028-04-01T00:00:00Z,1095,ocds-9t57fa-91580,ocds-9t57fa-91580-2024-05-31T00:00:00Z
3128,002/2024/25,2025-03-03T13:06:38Z,LEASING OF AN OFFICE ACCOMODATION FOR THE EASTERN CAPE LIQUOR BOARD IN CRADOCK FOR A PERIOD OF FIVE YEARS WITH AN OPTION TO RENEW FOR A FURTHER PERIOD OF TWO YEARS,pending,34599,1335728,ZAR,2029-10-31T00:00:00Z,2024-11-01T00:00:00Z,2029-10-31T00:00:00Z,1825,ocds-9t57fa-92140,ocds-9t57fa-92140-2024-06-07T00:00:00Z
3255,CMC4-24/25-3360,2025-04-02T14:18:22Z,APPOINTMENT OF A SERVICE PROVIDER FOR CATERING SERVICES AT ENKUSELWENI CHILD AND YOUTH CARE CENTRE IN THE NELSON MANDELA METROPOLITAN FOR A PERIOD OF THREE (3) YEARS,active,38039,4120973,ZAR,2027-12-31T00:00:00Z,2025-01-01T00:00:00Z,2027-12-31T00:00:00Z,1094,ocds-9t57fa-96024,ocds-9t57fa-96024-2024-06-21T00:00:00Z
3091,SCMU14-24/25-0009,2025-02-24T11:26:57Z,Appointment of reputable panel of service providers to provide training and development intervention in the specified categories for a period of thirty-six (36) months.,active,41891,0,ZAR,2027-12-12T00:00:00Z,2024-12-13T00:00:00Z,2027-12-12T00:00:00Z,1094,ocds-9t57fa-98761,ocds-9t57fa-98761-2024-08-16T00:00:00Z
3597,4600003278,2025-07-24T15:55:38Z,SECURITY SERVICES FOR MPUMALANGA PROVINCIAL OFFICE AND WAREHOUSE,active,49281,5260266,ZAR,2028-06-30T00:00:00Z,2025-07-01T00:00:00Z,2028-06-30T00:00:00Z,1095,ocds-9t57fa-102645,ocds-9t57fa-102645-2024-09-20T00:00:00Z
5368,DSDP 53/24,2026-05-13T19:10:10Z,"PROVISION OF PHYSICAL SECURITY SERVICES AT BOTLOKWA ONE STOP CENTRE, EISLEBEN CLINIC, AGANANG ONE STOP CENTRE, SASELAMANI OFFICE ACCOMMODATION, SESHEGO ONE STOP CENTRE AND PHASHA SELATOLE ONE STOP CENTRE FOR A PERIOD OF TWELVE MONTHS (12).",active,49513,6896152,ZAR,2026-06-30T00:00:00Z,2025-07-01T00:00:00Z,2026-06-30T00:00:00Z,364,ocds-9t57fa-101173,ocds-9t57fa-101173-2024-09-07T00:00:00Z
4785,NC/SOC/001/2024,2026-03-26T13:07:38Z,"RENDERING OF SECURITY SERVICES AT THE PROVINCIAL OFFICE(LATLHI MABILO COMPLEX), FRANCES BAARD(KIMBERLEY),PIXLEY KA SEME(DE AAR),ZF MGCAWU(UPINGTON&POSTMASBURG), JOHN TAOLO GAETSEWE(KURUMAN) AND NAMAKWA(SPRINGBOK&CALVINIA), INCLUDING YOUTH CARE CENTRES(DE AAR,SPRINGBOK,UPINGTON), FOR PERIOD OF 36 MONTHS",active,48083,134130860,ZAR,2026-10-31T00:00:00Z,2023-11-01T00:00:00Z,2026-10-31T00:00:00Z,1095,ocds-9t57fa-102552,ocds-9t57fa-102552-2024-09-20T00:00:00Z
3318,COM032/2024,2025-04-15T12:48:35Z,COM032 OF 2024  SUPPLY  AND  DELIVERY OF  FIRE EQUIPMENT FOR  A  PERIOD OF  THREE YEARS FROM  DATE OF  APPOINTMENT .,active,46360,285000,ZAR,2028-04-14T00:00:00Z,2025-04-15T00:00:00Z,2028-04-14T00:00:00Z,1095,ocds-9t57fa-103148,ocds-9t57fa-103148-2024-09-27T00:00:00Z
5076,ACDP 23/11,2026-04-21T10:18:14Z,A 3-YEAR FRAMEWORK AGREEMENT FOR THE CONSTRUCTION AND EQUIPPING OF AGRICULTURAL BUILDINGS AND DEPARTMENTAL FACILITIES IN THE LIMPOPO PROVINCE FOR A PERIOD OF THREE (3) YEARS.,active,43669,0,ZAR,2028-02-18T00:00:00Z,2025-02-21T00:00:00Z,2028-02-18T00:00:00Z,1092,ocds-9t57fa-106046,ocds-9t57fa-106046-2024-10-25T00:00:00Z
3754,DHA13-2024,2025-08-28T14:26:47Z,THE APPOINTMENT OF A SERVICE PROVIDER  FOR THE PROVISION OF CLEANING SERVICES FOR SIXTEEN (16) DEPARTMENT OF HOME AFFAIRS’ (DHA) BUILDINGS FOR A PERIOD OF THIRTY-SIX (36) MONTHS.,terminated,45465,30403515,ZAR,2028-03-31T00:00:00Z,2025-04-01T00:00:00Z,2028-03-31T00:00:00Z,1095,ocds-9t57fa-107483,ocds-9t57fa-107483-2024-11-08T00:00:00Z
5325,W11497,2026-05-12T12:21:27Z,"APPOINTMENT OF A SERVICE PROVIDER TO RENDER CLEANING SERVICES WITHIN HEAD OFFICE BUILDINGS, GAUTENG REGIONAL OFFICE, PRAETOR, ROODEPLAAT AND PRETORIA WEST BUILDINGS FOR A PERIOD OF THIRTY – SIX (36) MONTHS AT DEPARTMENT OF WATER  AND SANITATION",pending,48894,54413175,ZAR,2028-06-21T00:00:00Z,2025-06-21T00:00:00Z,2028-06-21T00:00:00Z,1096,ocds-9t57fa-109280,ocds-9t57fa-109280-2024-11-22T00:00:00Z
4552,SCMU12-24/25-0010,2026-03-11T08:43:05Z,Appointment of a panel of reputable service providers to render forensic investigation capacity to the Eastern Cape Provincial Treasury (ECPT) for a period of three (3) years.,active,46596,1800000,ZAR,2028-04-12T00:00:00Z,2025-04-12T00:00:00Z,2028-04-12T00:00:00Z,1096,ocds-9t57fa-110958,ocds-9t57fa-110958-2024-12-13T00:00:00Z
5281,G534/2024,2026-05-09T14:55:55Z,THE APPOINTMENT OF A SERVICE PROVIDER TO PROVIDE SECURITY GUARDING SERVICES FOR THE SOUTH AFRICAN NATIONAL BIODIVERSITY INSTITUTE (SANBI) AT KIRSTENBOSCH NATIONAL BOTANICAL GARDEN FOR A PERIOD OF ONE (1) YEAR.,pending,62598,2625593,ZAR,2027-02-28T00:00:00Z,2026-03-01T00:00:00Z,2027-02-28T00:00:00Z,364,ocds-9t57fa-111017,ocds-9t57fa-111017-2024-12-13T00:00:00Z
4684,022/2024/25,2026-03-20T16:30:32Z,022/2024/25 THE APPOINTMENT OF A TRAVEL AND HOSPITALITY MANAGEMENT SERVICES COMPANY FOR A PERIOD OF THREE YEARS WITH AN OPTION TO EXTEND FOR A FURTHER PERIOD OF ONE YEAR,active,65756,870600,ZAR,2027-12-31T00:00:00Z,2025-01-02T00:00:00Z,2027-12-31T00:00:00Z,1093,ocds-9t57fa-123138,ocds-9t57fa-123138-2024-10-25T00:00:00Z
4679,DoCS.QN-23/24-011,2026-03-20T13:08:47Z,Provision of system upgrade and maintenance of CCTV surveillance cameras for the Department of Community Safety over a period of thirty-six (36) months ,active,65732,491215,ZAR,2027-03-14T00:00:00Z,2024-03-15T00:00:00Z,2027-03-14T00:00:00Z,1094,ocds-9t57fa-151615,ocds-9t57fa-151615-2024-01-26T00:00:00Z
4368,NDOH 35-2023/2024,2026-02-10T11:56:25Z,"SUPPLY AND DELIVERY OF POINT OF CARE TESTING DEVICES, SOFTWARE AND RELATED CONSUMABLES TO THE DEPARTMENT OF HEALTH FOR NON-COMMUNICABLE DISEASES AND PRIMARY HEALTH CARE FOR A PERIOD OF THREE YEARS.",active,42141,1,ZAR,2028-05-14T00:00:00Z,2025-05-14T00:00:00Z,2028-05-14T00:00:00Z,1096,ocds-9t57fa-78748,ocds-9t57fa-78748-2024-01-19T00:00:00Z
2342,SCMU8-24/25-0003,2024-10-04T10:08:44Z,"SUPPLY, DELIVERY AND CONSTRUCTION OF A SHEARING SHED AT TSOLOBENG VILLAGE IN ELUNDINI LOCAL MUNICIPALITY OF THE JOE GQABI DISTRICT",active,27898,0,ZAR,2024-09-26T00:00:00Z,2024-05-23T00:00:00Z,2024-09-26T00:00:00Z,126,ocds-9t57fa-79339,ocds-9t57fa-79339-2024-01-26T00:00:00Z
4998,CDC/23/24,2026-04-15T09:27:10Z,EPC/TURNKEY PROJECT FOR DESIGN AND CONSTRUCTION OF MOTHERWELL/BETHELSDORP EAST TO WEST BULK WATER TRANSFER PIPELINE (E-WP),active,31008,416390961,ZAR,2027-05-30T00:00:00Z,2024-07-25T00:00:00Z,2027-05-30T00:00:00Z,1039,ocds-9t57fa-80915,ocds-9t57fa-80915-2024-02-09T00:00:00Z
5057,SLA-0241,2026-04-20T06:44:09Z,NT009-1-2023 APPOINTMENT OF A SERVICE PROVIDER TO RENDER 24-HOUR SECURITY GUARDING SERVICES FOR THE NATIONAL TREASURY BUILDINGS AND CLOSE PROTECTION SERVICES FOR 36 MONTHS.,active,29688,45964025,ZAR,2027-06-30T00:00:00Z,2024-07-01T00:00:00Z,2027-06-30T00:00:00Z,1094,ocds-9t57fa-84320,ocds-9t57fa-84320-2024-03-08T00:00:00Z
4816,RFP2023/40/NYDA,2026-03-27T12:04:09Z,RE-ADVERTISEMENT OF THE LEASE OF CORPORATE OFFICE SPACE FOR NYDA HEAD OFFICE OVER A PERIOD OF SEVEN (7) YEARS.,active,27241,87479210,ZAR,2031-10-31T00:00:00Z,2024-09-01T00:00:00Z,2031-10-31T00:00:00Z,2616,ocds-9t57fa-85145,ocds-9t57fa-85145-2024-03-15T00:00:00Z
2761,T153/2024,2024-12-04T16:12:08Z,SUPPLY AND DELIVERY OF SAFETY AND PROTECTIVE CLOTHING FOR A PERIOD OF 3 YEARS,active,39408,403027,ZAR,2027-06-30T00:00:00Z,2024-08-19T00:00:00Z,2027-06-30T00:00:00Z,1045,ocds-9t57fa-85669,ocds-9t57fa-85669-2024-03-22T00:00:00Z
2766,T158/2024,2024-12-04T16:17:42Z,SUPPLY AND DELIVERY OF SAFETY AND PROTECTIVE CLOTHING FOR A PERIOD OF 3 YEARS,active,39410,58926,ZAR,2027-06-30T00:00:00Z,2024-08-19T00:00:00Z,2027-06-30T00:00:00Z,1045,ocds-9t57fa-85669,ocds-9t57fa-85669-2024-03-22T00:00:00Z
2760,T152/2024,2024-12-04T16:11:05Z,SUPPLY AND DELIVERY OF SAFETY AND PROTECTIVE CLOTHING FOR A PERIOD OF 3 YEARS,active,39410,166409,ZAR,2027-06-30T00:00:00Z,2024-07-01T00:00:00Z,2027-06-30T00:00:00Z,1094,ocds-9t57fa-85669,ocds-9t57fa-85669-2024-03-22T00:00:00Z
3392,4600003256,2025-05-16T10:10:03Z, MP301 CHIEF ALBERT LUTHULI (ELUKWATINI) LOCAL OFFICE ACCOMMODATION,active,47436,5053518,ZAR,2032-12-31T00:00:00Z,2025-01-01T00:00:00Z,2032-12-31T00:00:00Z,2921,ocds-9t57fa-88967,ocds-9t57fa-88967-2024-05-03T00:00:00Z
3695,EDU 03/24,2025-08-15T10:16:11Z," REQUEST FOR THE LEASING OF EQUIPMENT FOR THE PRINTING, PACKING, 
PACKAGING, STORAGE AS WELL AS, SCANNING AND SHREDDING MACHINES INCLUDING 
SECURE DISTRIBUTION FOR THE NATIONAL SENIOR CERTIFICATE (NSC), SENIOR CERTIFICATE 
(SC), GRADE 12 PREPARATORY EXAMINATIONS, GENERAL EDUCATION CERTIFICATE (GRADE 
9) QUESTION PAPERS AND OTHER EXAMINATIONS AND ASSESSMENT RELATED MATERIALS 
FOR A SPECIFIC CONTRACT TERM OF FIVE (5) YEARS.",active,47463,556376000,ZAR,2030-03-31T00:00:00Z,2025-04-01T00:00:00Z,2030-03-31T00:00:00Z,1825,ocds-9t57fa-89732,ocds-9t57fa-89732-2024-05-10T00:00:00Z
2819,T249/2024,2024-12-10T11:03:02Z,SUPPLY & DELIVERY OF ELECTRICAL MATERIAL FOR A PERIOD OF 3 YEARS,active,39707,87052928,ZAR,2027-06-30T00:00:00Z,2024-12-02T00:00:00Z,2027-06-30T00:00:00Z,940,ocds-9t57fa-89762,ocds-9t57fa-89762-2024-05-10T00:00:00Z
2821,T251/2024,2024-12-10T11:05:06Z,SUPPLY & DELIVERY OF ELECTRICAL MATERIAL FOR A PERIOD OF 3 YEARS,active,39707,933219,ZAR,2027-06-30T00:00:00Z,2024-12-02T00:00:00Z,2027-06-30T00:00:00Z,940,ocds-9t57fa-89762,ocds-9t57fa-89762-2024-05-10T00:00:00Z
2828,T258/2024,2024-12-10T11:19:36Z,SUPPLY & DELIVERY OF ELECTRICAL MATERIAL FOR A PERIOD OF 3 YEARS,active,39711,1478164,ZAR,2027-06-30T00:00:00Z,2024-12-02T00:00:00Z,2027-06-30T00:00:00Z,940,ocds-9t57fa-89762,ocds-9t57fa-89762-2024-05-10T00:00:00Z
2826,T256/2024,2024-12-10T11:17:39Z,SUPPLY & DELIVERY OF ELECTRICAL MATERIAL FOR A PERIOD OF 3 YEARS,active,39707,684409,ZAR,2027-06-30T00:00:00Z,2024-12-02T00:00:00Z,2027-06-30T00:00:00Z,940,ocds-9t57fa-89762,ocds-9t57fa-89762-2024-05-10T00:00:00Z
2845,T271/2024,2024-12-10T14:20:47Z,SUPPLY & DELIVERY OF ELECTRICAL MATERIAL FOR A PERIOD OF 3 YEARS,active,39710,1660284,ZAR,2027-06-30T00:00:00Z,2024-12-02T00:00:00Z,2027-06-30T00:00:00Z,940,ocds-9t57fa-89762,ocds-9t57fa-89762-2024-05-10T00:00:00Z
2825,T255/2024,2024-12-10T11:16:55Z,SUPPLY & DELIVERY OF ELECTRICAL MATERIAL FOR A PERIOD OF 3 YEARS,active,39712,26578380,ZAR,2027-06-30T00:00:00Z,2024-12-02T00:00:00Z,2027-06-30T00:00:00Z,940,ocds-9t57fa-89762,ocds-9t57fa-89762-2024-05-10T00:00:00Z
4569,SCMU8-24/25-0095,2026-03-12T09:51:01Z,"Supply, delivery and construction of Lelethu Shearing-Shed at kwaGcuda Village at Lusikisiki in Ingquza Hill local municipality of the OR Tambo District.",active,35890,1286244,ZAR,2025-03-31T00:00:00Z,2024-10-16T00:00:00Z,2025-03-31T00:00:00Z,166,ocds-9t57fa-95184,ocds-9t57fa-95184-2024-07-12T00:00:00Z
4747,KZN01/2024,2026-03-24T14:56:53Z,36 MONTHS CLEANING SERVICE FOR PROVINCIAL OFFICE DURBAN,active,49181,3170030,ZAR,2028-08-31T00:00:00Z,2025-09-01T00:00:00Z,2028-08-31T00:00:00Z,1095,ocds-9t57fa-96667,ocds-9t57fa-96667-2024-07-26T00:00:00Z
4651,SCMU8-24/25-0035,2026-03-18T12:44:42Z,Appointment of a service provider for security services for the period of three (03) years in Port St Johns Local Offices situated in Port St Johns Local Municipality -OR Tambo District.,active,41204,2163473,ZAR,2027-12-13T00:00:00Z,2024-12-13T00:00:00Z,2027-12-13T00:00:00Z,1095,ocds-9t57fa-97402,ocds-9t57fa-97402-2024-08-02T00:00:00Z
2513,PP09-24/25-10,2024-10-31T11:50:16Z,APPOINTMENT OF A SUITABLE SERVICE PROVIDER TO MAINTAIN THE SUPPORT TO MANUFACTURING ENTERPRISES IN DISTRESS PROGRAMME MULTI-YEAR -FY24/25 TO FY26/27,active,36955,1275000,ZAR,2027-10-31T00:00:00Z,2024-10-31T00:00:00Z,2027-10-31T00:00:00Z,1095,ocds-9t57fa-98752,ocds-9t57fa-98752-2024-08-16T00:00:00Z
3066,ZNB120/2024/25HSE,2025-02-14T09:56:44Z,"APPOINTMENT OF A SERVICE PROVIDER TO RENDER 24 HOUR SECURITY GUARDING SERVICES FOR THE KZN DEPARTMENT OF HUMAN SETTLEMENTS AT AMAJUBA DISTRICT OFFICE, NEWCASTLE FOR A PERIOD OF 36 MONTHS",active,40250,1184943,ZAR,2028-01-31T00:00:00Z,2025-02-01T00:00:00Z,2028-01-31T00:00:00Z,1094,ocds-9t57fa-101007,ocds-9t57fa-101007-2024-09-06T00:00:00Z
2206,3100033407,2024-09-09T11:53:06Z,Yard maintenance services for a period of twelve months.,active,34784,182850,ZAR,2025-08-31T00:00:00Z,2024-09-01T00:00:00Z,2025-08-31T00:00:00Z,364,ocds-9t57fa-101218,ocds-9t57fa-101218-2024-07-12T00:00:00Z
3048,T5/2025,2025-02-12T09:18:01Z,DEVELOPMENT OF A COMPREHENSIVE LED AND TOURISM STRATEGY,active,43228,525124,ZAR,0001-01-01T00:00:00Z,0001-01-01T00:00:00Z,0001-01-01T00:00:00Z,0,ocds-9t57fa-101904,ocds-9t57fa-101904-2024-09-13T00:00:00Z
2568,COM031/2024q,2024-11-08T10:59:36Z,"COM 031 OF 2024 : SUPPLY,DELIVERY AND INSTALLATION OF TWO CHEMICAL /HERBICIDE TANKS,MOTORS AND FITTINGS ONTO A BAKKIE",active,38051,99988,ZAR,0001-01-01T00:00:00Z,0001-01-01T00:00:00Z,0001-01-01T00:00:00Z,0,ocds-9t57fa-103765,ocds-9t57fa-103765-2024-10-04T00:00:00Z
2445,62948,2024-10-16T11:09:41Z,Request for proposals for the Appointment of a Service Provider to render services on behalf of SALGA to undertake a study on Municipal Fresh Produce Markets,active,36852,723800,ZAR,0001-01-01T00:00:00Z,0001-01-01T00:00:00Z,0001-01-01T00:00:00Z,0,ocds-9t57fa-104505,ocds-9t57fa-104505-2024-05-30T00:00:00Z
2603,OR-001366,2024-11-12T15:29:50Z,SITA Electronic Document Delivery (EDD) service,active,38260,4411,ZAR,2026-03-31T00:00:00Z,2024-04-01T00:00:00Z,2026-03-31T00:00:00Z,729,ocds-9t57fa-107975,ocds-9t57fa-107975-2024-03-01T00:00:00Z
4006,NCPT/02/2024/25,2025-11-12T09:54:29Z,REQUEST FOR PROPOSALS FOR THE APPOINTMENT OF AN INTERNAL AUDIT SERVICE PROVIDER TO SERVICE THE NORTHERN CAPE LISTED PUBLIC ENTITIES FOR THE PERIOD OF 3 YEARS,active,46156,3257145,ZAR,2028-04-30T00:00:00Z,2025-05-01T00:00:00Z,2028-04-30T00:00:00Z,1095,ocds-9t57fa-109248,ocds-9t57fa-109248-2024-11-22T00:00:00Z
3130,P6/TOUR/02/24,2025-03-03T15:36:52Z,"APPOINTMENT OF A SERVICE PROVIDER  TO PROVIDE CULTURE AND NATURE TRAINING OF TOURISTS GUIDES UNDER UMGUNGUNDLOVU, ETHEKWINI METRO, ZULULAND, ILEMBE AND UMZINYATHI DISTRICT MUNICIPALITIES",active,43955,701500,ZAR,2025-08-31T00:00:00Z,2025-03-01T00:00:00Z,2025-08-31T00:00:00Z,183,ocds-9t57fa-116300,ocds-9t57fa-116300-2024-11-29T00:00:00Z
3399,3600034619,2025-05-18T17:31:06Z, CURTAINS AND TABLECLOTH CLEANING: BROOKLYN,active,47569,150000,ZAR,0001-01-01T00:00:00Z,0001-01-01T00:00:00Z,0001-01-01T00:00:00Z,0,ocds-9t57fa-121531,ocds-9t57fa-121531-2024-11-22T00:00:00Z
