id,title,dateSigned,description,status,awardID,value_amount,value_currency,period_endDate,period_startDate,period_maxExtentDate,period_durationInDays,main_ocid,main_id
2970,64624,2025-02-03T12:29:16Z,"REQUEST FOR QUOTATIONS (RFQ) FOR THE SUPPLY, DELIVERY AND MAINTENANCE OF OFFICE PLANTS TO ENSURE THAT THE FACILITIES ARE MAINTAINED IN A CLEAN, HEALTHY, AND SAFE PLEASING APPEARANCE FROM 1 JANUARY 2025 UNTIL 31 DECEMBER 2027 (36 MONTHS) ",active,42276,231833,ZAR,2027-12-31T00:00:00Z,2025-01-10T00:00:00Z,2027-12-31T00:00:00Z,1085,ocds-9t57fa-113519,ocds-9t57fa-113519-2024-12-05T00:00:00Z
3108,64468,2025-02-28T00:46:41Z,"SUPPLY OF NEW TROPHIES, MEDALS , CERTIFICATE & ENGRAVING OF OLD TROPHIES ",active,43803,118756,ZAR,0001-01-01T00:00:00Z,0001-01-01T00:00:00Z,0001-01-01T00:00:00Z,0,ocds-9t57fa-114595,ocds-9t57fa-114595-2024-11-15T00:00:00Z
3282,64488,2025-04-09T17:24:54Z,"Request to renew SALGA Cloud based Human Capital Management System - ONERCY for 12months (January 2025 – December 2025)
",active,46120,7273017,ZAR,0001-01-01T00:00:00Z,0001-01-01T00:00:00Z,0001-01-01T00:00:00Z,0,ocds-9t57fa-119740,ocds-9t57fa-119740-2024-01-05T00:00:00Z
3785,DHS 16/2023 D,2025-09-10T10:28:04Z,APPOINTMENT OF A SERVICE PROVIDER FOR CONTRUCTION OF 300 HOUSING UNITS AT TSHING EXT 10 PHASE 2 JB MARKS LOCAL MUNICIAPALITY,active,54607,57387000,ZAR,2026-10-31T00:00:00Z,2024-06-13T00:00:00Z,2026-10-31T00:00:00Z,870,ocds-9t57fa-133196,ocds-9t57fa-133196-2024-01-26T00:00:00Z
3564,SCM/BID14/2023/2024,2025-07-14T14:24:15Z,APPOINTMENT OF A PANEL OF SIX (6) SERVICE PROVIDERS: SUPPLY AND DELIVERY OF PERSONAL PROTECTIVE EQUIPMENT FOR ALL MUNICIPAL DIVISION FOR A PERIOD OF ONE (1) YEAR,active,44745,0,ZAR,2025-03-13T00:00:00Z,2024-03-13T00:00:00Z,2025-03-13T00:00:00Z,365,ocds-9t57fa-77730,ocds-9t57fa-77730-2024-01-04T00:00:00Z
1846,T35/2024,2024-05-23T08:33:00Z,APPOINTMENT OF SERVICE PROVIDER TO PREPARE A HERITAGE STRATEGY AND PHASE 1 PRECINCT (PILOT PROJECT: NAPIER) ,active,28153,484587,ZAR,2024-06-28T00:00:00Z,2024-05-28T00:00:00Z,2024-06-28T00:00:00Z,31,ocds-9t57fa-78703,ocds-9t57fa-78703-2024-01-19T00:00:00Z
2060,Infra28,2024-07-24T15:09:04Z,COMPLETION OF CONSTRUCTION OF THE ZUURBERG PEACE MEMORIAL PROJECT – SUNDAYS RIVER,active,25795,30417069,ZAR,2025-06-06T00:00:00Z,2024-05-21T00:00:00Z,2025-06-06T00:00:00Z,381,ocds-9t57fa-80124,ocds-9t57fa-80124-2024-02-02T00:00:00Z
1625,60231,2024-03-18T14:12:20Z,Legal Opinion to Resolve the Question on the Legality of Cutting Water as a Credit Control Measure-Lawton's Africa,active,25200,197340,ZAR,2024-03-07T00:00:00Z,2024-02-28T00:00:00Z,2024-03-07T00:00:00Z,8,ocds-9t57fa-84874,ocds-9t57fa-84874-2024-02-02T00:00:00Z
1679,60385,2024-04-02T12:15:10Z,Appointment of a service provider for the Skilled Support and GRAP compliant Fixed Asset Register for Maluti-a-Phofung LM.,active,25802,195720,ZAR,2024-03-31T00:00:00Z,2024-02-20T00:00:00Z,2024-03-31T00:00:00Z,40,ocds-9t57fa-85851,ocds-9t57fa-85851-2024-01-26T00:00:00Z
2847,ZNB110/2023/24HSE,2024-12-10T14:39:42Z,"APPOINTMENT OF A SERVICE PROVIDER TO RENDER 24 HOUR SECURITY GUARDING SERVICES FOR THE KZN DEPARTMENT OF HUMAN SETTLEMENTS AT ILEMBE DISTRICT OFFICE, KWADUKUZA FOR A PERIOD OF 36 MONTHS",active,36896,1366696,ZAR,2027-11-30T00:00:00Z,2024-12-01T00:00:00Z,2027-11-30T00:00:00Z,1094,ocds-9t57fa-87367,ocds-9t57fa-87367-2024-04-12T00:00:00Z
2108,SCMU 01-2024 2025,2024-08-13T11:14:03Z,"SUPPLY, DELIVERY AND INSTALLATION OF UNIFIED COMMUNICATION SYSTEMS MPLS WAN AND HOSTED PBX TELEPHONY AND ASSOCIATED SERVICES FOR A PERIOD OF 3 YEARS [36 MONTHS] FOR THE EASTERN CAPE RURAL DEVELOPMENT AGENCY (ECRDA)",active,29201,3207572,ZAR,2027-07-31T00:00:00Z,2024-08-01T00:00:00Z,2027-07-31T00:00:00Z,1094,ocds-9t57fa-87952,ocds-9t57fa-87952-2024-04-19T00:00:00Z
1942,P1/AUX/01/24,2024-06-27T12:11:04Z,"Supply watercooler services and maintenance for Newcastle, UThukela and Dundee District Offices",active,27816,150000,ZAR,2026-06-30T00:00:00Z,2024-07-01T00:00:00Z,2026-06-30T00:00:00Z,729,ocds-9t57fa-89186,ocds-9t57fa-89186-2024-02-02T00:00:00Z
3705,SCMU6-24/25-0004,2025-08-20T10:09:55Z,"Appointment of service provider(s) for the rendering of co-sourced internal audit service (to provide technical capacity to the Eastern Cape Department of Education’s internal audit activity for a period of thirty-six (36) months with the option to extend for a period of not more than 24 (twenty-four) months subject to budget availability, the need of the department and supplier performance",active,47345,0,ZAR,2028-05-04T00:00:00Z,2025-05-05T00:00:00Z,2028-05-04T00:00:00Z,1095,ocds-9t57fa-89745,ocds-9t57fa-89745-2024-05-10T00:00:00Z
3262,13 DARD 05/2024,2025-04-03T10:26:37Z,13 DARD 05/2024 : SUPPLY AND DELIVERY OF 1X 180 KW 4WD TRACTOR WITH CLOSED CANOPY AND COMPATIBLE GPS,active,32624,3559825,ZAR,0001-01-01T00:00:00Z,0001-01-01T00:00:00Z,0001-01-01T00:00:00Z,0,ocds-9t57fa-89770,ocds-9t57fa-89770-2024-05-10T00:00:00Z
2312,COGTA10/2023/NW,2024-09-27T12:08:52Z,REQUEST FOR BIDS (RFB) FOR THE APPOINTMENT OF A SERVICE PROVIDER TO UNDERTAKE PHYSICAL SECURITY SERVICES FOR THE DEPARTMENT OF COOPERATIVE GOVERNANCE AND TRADITIONAL AFFAIRS FOR THE PERIOD OF 36 MONTHS,active,35640,19964099,ZAR,2027-09-30T00:00:00Z,2024-10-01T00:00:00Z,2027-09-30T00:00:00Z,1094,ocds-9t57fa-89843,ocds-9t57fa-89843-2024-05-10T00:00:00Z
1880,BA051/2024q,2024-06-13T12:18:16Z,"BA051/2024q – Appointment Of A Service Provider For The Recruitment And Selection Process Of The Director: Corporate Services, In Line With The Regulations On Appointment And Conditions Of Employment Of Senior Managers, 2014",active,29494,46000,ZAR,2025-06-11T00:00:00Z,2024-06-12T00:00:00Z,2025-06-11T00:00:00Z,364,ocds-9t57fa-91116,ocds-9t57fa-91116-2024-05-24T00:00:00Z
1865,61192,2024-06-05T12:28:20Z,CEILING REPAIRS FOR SALGA NORTH WEST,active,29071,201790,ZAR,2024-07-09T00:00:00Z,2024-05-09T00:00:00Z,2024-07-09T00:00:00Z,61,ocds-9t57fa-91962,ocds-9t57fa-91962-2024-05-02T00:00:00Z
3069,TETA24/RESEARCH/0001/REGULATORY,2025-02-18T10:30:16Z,REQUEST FOR PROPOSALS FROM SERVICE PROVIDERS TO CONDUCT A COMPREHENSIVE STUDY TO EXAMINE THE IMPACT OF REGULATORY CHANGES ON SKILLS DEMAND WITHIN THE TRANSPORT SECTOR.,active,35658,0,ZAR,2025-03-18T00:00:00Z,2024-09-18T00:00:00Z,2025-03-18T00:00:00Z,181,ocds-9t57fa-93366,ocds-9t57fa-93366-2024-06-21T00:00:00Z
2356,SCMU8-24/25-0049,2024-10-07T13:24:54Z,TRAVEL MANAGEMENT SERVICES MEC AND HOD OFFICES ,active,35879,121910,ZAR,2027-09-14T00:00:00Z,2024-09-15T00:00:00Z,2027-09-14T00:00:00Z,1094,ocds-9t57fa-93510,ocds-9t57fa-93510-2024-06-21T00:00:00Z
3032,ipid03/2425,2025-02-10T15:39:29Z,APPOINTMENT OF SERVICE PROVIDER TO RENDER QUALITY ASSUARANCE REVIEW ON THE INDEPENDENT POLICE INVESTIGATIVE DIRECTORATE ( IPID) INTERNAL AUDIT UNIT WITHIN A PERIOD OF SIX (6) WEEKS,active,38435,247020,ZAR,0001-01-01T00:00:00Z,0001-01-01T00:00:00Z,0001-01-01T00:00:00Z,0,ocds-9t57fa-94056,ocds-9t57fa-94056-2024-06-28T00:00:00Z
3129,003/2024/25,2025-03-03T15:18:32Z,LEASING OF OFFICE ACCOMMODATION FOR THE EASTERN CAPE LIQUOR BOARD IN GQEBERHA FOR A PERIOD OF FIVE YEARS WITH AN OPTION TO RENEW A FURTHER PERIOD OF TWO YEARS,pending,32302,2678751,ZAR,2029-10-31T00:00:00Z,2024-11-30T00:00:00Z,2029-10-31T00:00:00Z,1796,ocds-9t57fa-94256,ocds-9t57fa-94256-2024-04-12T00:00:00Z
3038,SCMU7-2024/25-0006,2025-02-11T12:14:42Z,APPOINTMENT OF A PANEL OF SERVICE PROVIDERS FOR THE SUPPLY AND DELIVERY OF GOODS AND SERVICES FOR DISASTER RELIEF IN CHRIS HANI DISTRICT FOR THE PERIOD OF THREE (3) YEARS.,active,39759,0,ZAR,2028-01-22T00:00:00Z,2025-01-23T00:00:00Z,2028-01-22T00:00:00Z,1094,ocds-9t57fa-94668,ocds-9t57fa-94668-2024-07-05T00:00:00Z
2587,T226/2024,2024-11-12T08:50:20Z,APPOINTMENT OF A SERVICES PROVIDER FOR THE CHIPPING OF GREEN WASTE FOR PERIOD OF 36 MONTHS,active,38207,0,ZAR,2027-06-30T00:00:00Z,2024-11-01T00:00:00Z,2027-06-30T00:00:00Z,971,ocds-9t57fa-95798,ocds-9t57fa-95798-2024-07-19T00:00:00Z
2072,P1/IT/01/24,2024-07-26T10:13:17Z,INMAGIC ANNUAL SOFTWARE SUBSCRIPTION RENEWAL AND TELEPHONE SUPPORT,active,31779,36881,ZAR,2025-05-31T00:00:00Z,2024-06-01T00:00:00Z,2025-05-31T00:00:00Z,364,ocds-9t57fa-96576,ocds-9t57fa-96576-2024-04-12T00:00:00Z
3441,CON023/2025/26,2025-05-29T10:07:53Z,The appointment of service providers to serve on the IT Hardware and Consumables Procurement Panel for the National Energy Regulator Of South Africa (NERSA) for a period of three (3) years.,active,45742,10000000,ZAR,2028-05-26T00:00:00Z,2025-05-27T00:00:00Z,2028-05-26T00:00:00Z,1095,ocds-9t57fa-96742,ocds-9t57fa-96742-2024-07-26T00:00:00Z
2102,62014,2024-08-06T10:49:28Z,PROCUREMNT OF ZOOM LICENSES FOR 12 MONTHS,active,32210,0,ZAR,2025-07-09T00:00:00Z,2024-07-08T00:00:00Z,2025-07-09T00:00:00Z,366,ocds-9t57fa-96892,ocds-9t57fa-96892-2024-06-28T00:00:00Z
2077,3100036290,2024-08-01T13:57:56Z,Casual workers for the removal of boxes furniture from one building to another.,active,32054,109760,ZAR,0001-01-01T00:00:00Z,0001-01-01T00:00:00Z,0001-01-01T00:00:00Z,0,ocds-9t57fa-97197,ocds-9t57fa-97197-2024-07-12T00:00:00Z
2473,Q8/2024/25,2024-10-18T17:46:03Z,SUPPLY & DELIVERY OF AUTOMOTIVE BATTERIES,active,35801,126918,ZAR,0001-01-01T00:00:00Z,0001-01-01T00:00:00Z,0001-01-01T00:00:00Z,0,ocds-9t57fa-99457,ocds-9t57fa-99457-2024-08-23T00:00:00Z
2667,T244/2024,2024-12-02T10:24:40Z,REHABILITATION OF STREETS IN STRUISBAAI NORTH,active,39246,9927110,ZAR,0001-01-01T00:00:00Z,0001-01-01T00:00:00Z,0001-01-01T00:00:00Z,0,ocds-9t57fa-101899,ocds-9t57fa-101899-2024-09-13T00:00:00Z
4275,4600003354,2026-01-29T16:34:43Z,GT421 – EMFULENI LOCAL OFFICE ACCOMMODATION,active,55102,4001026,ZAR,2033-12-31T00:00:00Z,2026-01-01T00:00:00Z,2033-12-31T00:00:00Z,2921,ocds-9t57fa-103944,ocds-9t57fa-103944-2024-10-05T00:00:00Z
3140,FIN044/2024q,2025-03-04T15:16:57Z,"FIN044/2024q – Supply, Delivery And Installation Of Office Furniture",active,44254,67850,ZAR,0001-01-01T00:00:00Z,0001-01-01T00:00:00Z,0001-01-01T00:00:00Z,0,ocds-9t57fa-110374,ocds-9t57fa-110374-2024-12-06T00:00:00Z
2865,61682,2024-12-17T16:39:31Z,Annual Renewal Fees with Go1 for SALGA Learner Management System LMS (Leadership Village),active,40091,2141932,ZAR,2025-07-31T00:00:00Z,2024-08-01T00:00:00Z,2025-07-31T00:00:00Z,364,ocds-9t57fa-111228,ocds-9t57fa-111228-2024-06-14T00:00:00Z
2693,T120/2024,2024-12-04T09:31:59Z,SUPPLY & DELIVERY OF STORM WATER PIPES FOR A PERIOD OF YEARS,active,39433,4267075,ZAR,2027-06-30T00:00:00Z,2024-07-01T00:00:00Z,2027-06-30T00:00:00Z,1094,ocds-9t57fa-85003,ocds-9t57fa-85003-2024-03-15T00:00:00Z
2660,EDUMT01/2024/25,2024-11-28T11:10:42Z,MANZAMNYAMA BRIDGE : CONSTRUCTION,pending,37357,4088554,ZAR,0001-01-01T00:00:00Z,0001-01-01T00:00:00Z,0001-01-01T00:00:00Z,0,ocds-9t57fa-86742,ocds-9t57fa-86742-2024-04-06T00:00:00Z
1968,DPD020/2024q,2024-07-10T12:30:44Z,DPD020/2024q – Supply And Delivery Of Gifts And Promotional Items,active,30998,22712,ZAR,0001-01-01T00:00:00Z,0001-01-01T00:00:00Z,0001-01-01T00:00:00Z,0,ocds-9t57fa-91124,ocds-9t57fa-91124-2024-05-24T00:00:00Z
2197,DSBD/TMS/001,2024-09-06T11:56:52Z,"APPOINTMENT OF A SERVICE PROVIDER TO PROVIDE TRAVEL, ACCOMMODATION AND CONFERENCE (VENUE AND FACILITIES) SERVICES FOR THE DEPARTMENT OF
SMALL BUSINESS DEVELOPMENT FOR A PERIOD OF 36 MONTHS",active,33537,529414,ZAR,2027-08-31T00:00:00Z,2024-09-01T00:00:00Z,2027-08-31T00:00:00Z,1094,ocds-9t57fa-93014,ocds-9t57fa-93014-2024-06-14T00:00:00Z
3040,409,2025-02-11T14:11:24Z,ADDENDUM - PROVISION OF PUBLIC RELATIONS AND MEDIA MANAGEMENT SERVICES FOR EASTERN CAPE DEVELOPMENT CORPORATION (ECDC) FOR A PERIOD OF THREE (3) YEARS,active,43201,2040000,ZAR,2028-12-31T00:00:00Z,2025-01-01T00:00:00Z,2028-12-31T00:00:00Z,1460,ocds-9t57fa-95946,ocds-9t57fa-95946-2024-07-20T00:00:00Z
2120,PO3600033196,2024-08-15T08:37:07Z,"Hire of Skips for 12 Months and Disposal of General Waste, as and when required",active,32628,206400,ZAR,2025-06-27T00:00:00Z,2024-08-15T00:00:00Z,2025-06-27T00:00:00Z,316,ocds-9t57fa-98457,ocds-9t57fa-98457-2024-06-07T00:00:00Z
4459,SCMU5-24/25-0015,2026-02-23T11:18:55Z,PROVISION OF PROFESSIONAL ARCHITECTURAL AND PRINCIPAL AGENCY SERVICES FOR COMPLETION OF MATERNITY WARD AT FRERE HOSPITAL FOR A PERIOD OF 36 MONTHS,active,62173,9105123,ZAR,2027-11-19T00:00:00Z,2024-11-21T00:00:00Z,2027-11-19T00:00:00Z,1093,ocds-9t57fa-142995,ocds-9t57fa-142995-2024-05-16T00:00:00Z
3538,48/2023,2025-07-09T15:32:17Z,To Form a Panel of Professional Service Providers for Water Meter Audits and Related Services,active,50327,12000000,ZAR,2027-06-11T00:00:00Z,2024-06-11T00:00:00Z,2027-06-11T00:00:00Z,1095,ocds-9t57fa-83320,ocds-9t57fa-83320-2024-02-29T00:00:00Z
2251,P7/ENV/03/25,2024-09-13T12:50:53Z,APPOINTMENT OF SERVICE PROVIDER OF A SERVICE PROVIDER TO DEVELOP ESTUARY MANAGEMENT PLAN FOR UMKHOMAZI ESTUARY: ETHEKWINI METROPOLITAN MUNICIPALITY,active,31623,412620,ZAR,2025-09-10T00:00:00Z,2024-09-11T00:00:00Z,2025-09-10T00:00:00Z,364,ocds-9t57fa-86682,ocds-9t57fa-86682-2024-04-04T00:00:00Z
3092,SCMU14-24/25-0010,2025-02-24T11:39:58Z,"Appointment of a panel of service providers for Leasing of Computers for a period of five (5) years to the department of Sport, Recreation, Arts and Culture Eastern Cape.",active,41889,0,ZAR,2029-12-15T00:00:00Z,2024-12-16T00:00:00Z,2029-12-15T00:00:00Z,1825,ocds-9t57fa-101126,ocds-9t57fa-101126-2024-09-06T00:00:00Z
5367,DSDP 35/24,2026-05-13T19:00:56Z,PROVISION OF PHYSICAL SECURITY SERVICES AT MAMVUKA COMMUNITY CARE CENTRE AND TAUEATSWALA COMMUNITY CARE CENTRE FOR A PERIOD OF TWELVE MONTHS (12),active,49512,2737553,ZAR,2026-06-30T00:00:00Z,2025-07-01T00:00:00Z,2026-06-30T00:00:00Z,364,ocds-9t57fa-101172,ocds-9t57fa-101172-2024-09-07T00:00:00Z
3120,P3/SD/01/24,2025-03-02T14:42:30Z,"APPOINTMENT OF A SERVICE PROVIDER TO CONDUCT SOLAR PHOTOVOLTAIC  INSTALLATION TRAINING
",active,43920,2979900,ZAR,2025-12-31T00:00:00Z,2024-07-01T00:00:00Z,2025-12-31T00:00:00Z,548,ocds-9t57fa-104914,ocds-9t57fa-104914-2024-06-07T00:00:00Z
4760,CDC/239/24,2026-03-25T09:28:57Z,CONSTRUCTION OF NEW ECDC EDUCATIONAL FACILITIES AT COBOSI PRIMARY JUNIOR SCHOOL (PJS),active,52625,7877538,ZAR,2026-05-30T00:00:00Z,2025-08-01T00:00:00Z,2026-05-30T00:00:00Z,302,ocds-9t57fa-105151,ocds-9t57fa-105151-2024-10-18T00:00:00Z
5001,CDC/329/24,2026-04-15T11:15:18Z,CONSTRUCTION OF NEW ECDC EDUCATIONAL FACILITIES AT COBOSI PRIMARY JUNIOR SCHOOL (PJS),active,52625,7877538,ZAR,2026-05-30T00:00:00Z,2025-08-01T00:00:00Z,2026-05-30T00:00:00Z,302,ocds-9t57fa-105151,ocds-9t57fa-105151-2024-10-18T00:00:00Z
2877,SCMU-Q4-PP09-24/25-14,2025-01-09T06:52:40Z,ESTABLISHMENT OF AN APPROVED PANEL OF SPECIALISTS FOR THE PROVISION OF  POWER PRODUCER PROCESSES IN THE EASTERN CAPE,active,40453,0,ZAR,2027-12-19T00:00:00Z,2024-12-19T00:00:00Z,2027-12-19T00:00:00Z,1095,ocds-9t57fa-105295,ocds-9t57fa-105295-2024-10-18T00:00:00Z
4544,4600003364,2026-03-10T10:54:34Z,Courier Services,active,51591,8901649,ZAR,2030-09-30T00:00:00Z,2025-10-01T00:00:00Z,2030-09-30T00:00:00Z,1825,ocds-9t57fa-109347,ocds-9t57fa-109347-2024-11-23T00:00:00Z
5282,G532/2024,2026-05-09T15:00:06Z,THE APPOINTMENT OF A SERVICE PROVIDER TO PROVIDE SECURITY GUARDING SERVICES FOR THE SOUTH AFRICAN NATIONAL BIODIVERSITY INSTITUTE (SANBI) AT THE WALTER SISULU NATIONAL BOTANICAL GARDEN FOR A PERIOD OF ONE (1) YEAR,pending,62592,3587117,ZAR,2027-02-28T00:00:00Z,2026-03-01T00:00:00Z,2027-02-28T00:00:00Z,364,ocds-9t57fa-111014,ocds-9t57fa-111014-2024-12-13T00:00:00Z
5245,CNT 4279,2026-05-07T14:49:17Z,PROVISION FOR AUTOMATION OF TWO PROCESSES: THE REGULATION DEVELOPMENT ACTIVITY SCHEDULE AND APPLICATION FOR EXEMPTION FROM STANDARD REGULATIONS,pending,47104,4306297,ZAR,2027-05-04T00:00:00Z,2025-05-05T00:00:00Z,2027-05-04T00:00:00Z,729,ocds-9t57fa-111146,ocds-9t57fa-111146-2024-12-13T00:00:00Z
4678,DoCS.QN-23/24-013,2026-03-20T12:14:16Z,Rendering of sanitizing services to the Eastern Cape Department of Community Safety's ablution facilities over a period of three (3) years ,active,65727,106201,ZAR,2027-03-31T00:00:00Z,2024-04-01T00:00:00Z,2027-03-31T00:00:00Z,1094,ocds-9t57fa-151602,ocds-9t57fa-151602-2024-01-26T00:00:00Z
2345,SCMU8-24/25-0001,2024-10-04T10:21:35Z,"SUPPLY, DELIVERY AND CONSTRUCTION OF A MULTIPURPOSE SHED AT FLETCHERVILLE VILLAGE IN THE ELUNDINI LOCAL MUNICIPALITY OF THE JOE GQABI DISTRICT",active,27325,0,ZAR,2024-09-19T00:00:00Z,2024-05-17T00:00:00Z,2024-09-19T00:00:00Z,125,ocds-9t57fa-79334,ocds-9t57fa-79334-2024-01-26T00:00:00Z
2339,SCMU8-24/25-0005,2024-10-04T09:58:36Z,"SUPPLY, DELIVERY AND CONSTRUCTION OF A MULTIPURPOSE SHED AT SPAMBO VILLAGE IN THE SENQU LOCAL MUNICIPALITY OF THE JOE GQABI DISTRICT",active,27326,0,ZAR,2024-09-18T00:00:00Z,2024-05-16T00:00:00Z,2024-09-18T00:00:00Z,125,ocds-9t57fa-79359,ocds-9t57fa-79359-2024-01-26T00:00:00Z
2344,SCMU8-24/25-0008,2024-10-04T10:15:53Z,"SUPPLY, DELIVERY AND CONSTRUCTION OF A MULTIPURPOSE SHED AT KOPPIESFONTEIN FARM IN THE WALTER SISULU LOCAL MUNICIPALITY OF THE JOE GQABI DISTRICT",active,28073,0,ZAR,2024-10-01T00:00:00Z,2024-05-28T00:00:00Z,2024-10-01T00:00:00Z,126,ocds-9t57fa-79372,ocds-9t57fa-79372-2024-01-26T00:00:00Z
2121,AJ-350192,2024-08-15T11:25:44Z,APPOINTMENT OF A SERVICE PROVIDER FOR THE AUTOMATION OF PUBLIC SERVICE AND ADMINISTRATION BUSINESS PROCESSES WITH MICROSOFT POWER PLATFORM.,active,29637,9949800,ZAR,2025-08-11T00:00:00Z,2024-08-12T00:00:00Z,2025-08-11T00:00:00Z,364,ocds-9t57fa-82648,ocds-9t57fa-82648-2024-02-23T00:00:00Z
3615,SCMU10-23/24-0026,2025-07-30T14:36:16Z,SUPPLY OF SPARES AND GENERAL REPAIR TO PLANT AND VEHICLES FOR A CONTRACT PERIOD OF 36 MONTHS,active,50591,1,ZAR,2028-05-26T00:00:00Z,2025-05-29T00:00:00Z,2028-05-26T00:00:00Z,1093,ocds-9t57fa-84362,ocds-9t57fa-84362-2024-03-08T00:00:00Z
2715,T123/2024,2024-12-04T09:58:32Z,SUPPLY & DELIVERY OF PRE-FAB CONCRETE PRODUCTS FOR A PERIOD OF 3 YEARS,active,39405,548895,ZAR,2027-06-30T00:00:00Z,2024-07-01T00:00:00Z,2027-06-30T00:00:00Z,1094,ocds-9t57fa-85007,ocds-9t57fa-85007-2024-03-15T00:00:00Z
2487,SCMU1-23/24-0006,2024-10-24T10:27:21Z,APPOINTMENT OF A SERVICE PROVIDER TO PROVIDE TRAVEL MANAGEMENT SERVICES TO EASTERN CAPE OFFICE OF THE PREMIER FOR A PERIOD OF 36 MONTHS,active,31576,1740240,ZAR,2027-10-04T00:00:00Z,2024-10-03T00:00:00Z,2027-10-04T00:00:00Z,1096,ocds-9t57fa-85164,ocds-9t57fa-85164-2024-03-15T00:00:00Z
2754,T141/2024,2024-12-04T16:00:56Z,"SUPPLY AND DELIVERY OF ROADSIGNS, PAINT AND HARDWARE FOR A PERIOD OF 3 YEARS",active,39421,645144,ZAR,2027-06-30T00:00:00Z,2024-07-01T00:00:00Z,2027-06-30T00:00:00Z,1094,ocds-9t57fa-85667,ocds-9t57fa-85667-2024-03-22T00:00:00Z
2751,T133/2024,2024-12-04T15:38:47Z,"SUPPLY AND DELIVERY OF ROADSIGNS, PAINT AND HARDWARE FOR A PERIOD OF 3 YEARS",active,39424,180696,ZAR,2027-06-30T00:00:00Z,2024-07-01T00:00:00Z,2027-06-30T00:00:00Z,1094,ocds-9t57fa-85667,ocds-9t57fa-85667-2024-03-22T00:00:00Z
2750,T132/2024,2024-12-04T15:36:54Z,"SUPPLY AND DELIVERY OF ROADSIGNS, PAINT AND HARDWARE FOR A PERIOD OF 3 YEARS",active,39423,167478,ZAR,2027-06-30T00:00:00Z,2024-07-01T00:00:00Z,2027-06-30T00:00:00Z,1094,ocds-9t57fa-85667,ocds-9t57fa-85667-2024-03-22T00:00:00Z
3635,SCMU10-24/25-0002,2025-08-05T14:47:15Z,APPOINTMENT OF A SERVICE PROVIDER FOR GARDENING SERVICES AT MTHATHA AIRPORT FOR A CONTRACT PERIOD OF 36 MONTHS,active,29216,4976301,ZAR,2027-12-01T00:00:00Z,2024-12-02T00:00:00Z,2027-12-01T00:00:00Z,1094,ocds-9t57fa-88065,ocds-9t57fa-88065-2024-04-19T00:00:00Z
4685,004/2024/25,2026-03-20T16:40:11Z,LEASING OF FLEET MANAGEMENT SERVICES FOR THE EASTERN CAPE LIQUOR BOARD FOR A PERIOD OF THREE YEARS WITH AN OPTION  TO RENEW FOR A FURTHER PERIOD OF TWO YEARD,pending,34605,12123625,ZAR,2027-12-31T00:00:00Z,2025-01-02T00:00:00Z,2027-12-31T00:00:00Z,1093,ocds-9t57fa-88951,ocds-9t57fa-88951-2024-05-03T00:00:00Z
3110,CON016/2024/25,2025-02-28T10:44:27Z,THE APPOINTMENT OF A SERVICE PROVIDER TO RENDER THE EMPLOYEE HEALTH AND WELLNESS PROGRAM (EHWP) SERVICES FOR THE NATIONAL ENERGY REGULATOR OF SOUTH AFRICA FOR A PERIOD OF THREE (3) YEARS.,active,34690,2446994,ZAR,2027-01-12T00:00:00Z,2025-01-13T00:00:00Z,2027-01-12T00:00:00Z,729,ocds-9t57fa-91630,ocds-9t57fa-91630-2024-05-31T00:00:00Z
5192,CON023/2025/26,2026-04-30T13:38:33Z,THE APPOINTMENT OF A PANEL OF LAW FIRMS TO PROVIDE LEGAL SUPPORT SERVICES TO NERSA FOR A PERIOD OF THREE (3) YEARS.,active,56689,60000000,ZAR,2028-11-30T00:00:00Z,2025-12-01T00:00:00Z,2028-11-30T00:00:00Z,1095,ocds-9t57fa-94558,ocds-9t57fa-94558-2024-07-05T00:00:00Z
3034,SCMU7-2024/25-0003,2025-02-11T11:29:52Z,APPOINTMENT OF A PANEL OF SERVICE PROVIDERS FOR THE SUPPLY AND DELIVERY OF GOODS AND SERVICES FOR DISASTER RELIEF IN OR TAMBO DISTRICT FOR THE PERIOD OF THREE (3) YEARS.,active,39805,0,ZAR,2028-01-30T00:00:00Z,2025-01-31T00:00:00Z,2028-01-30T00:00:00Z,1094,ocds-9t57fa-94658,ocds-9t57fa-94658-2024-07-05T00:00:00Z
2588,T227/2024,2024-11-12T08:51:15Z,TRANSPORTATION OF CONTAINERISED MUNICIPAL SOLID WASTE FROM DROP OFF FACILITIES TO KARWYDERSKRAAL LANDFILL SITE FOR A PERIOD OF 36 MONTHS,active,37410,0,ZAR,2027-06-30T00:00:00Z,2024-11-01T00:00:00Z,2027-06-30T00:00:00Z,971,ocds-9t57fa-95799,ocds-9t57fa-95799-2024-07-19T00:00:00Z
3064,HEDP 009/24/25,2025-02-13T15:53:06Z,ESTABLISHMENT OF AN ACCREDITATION PANEL FOR THE PROVISION OF SUPPLY CHAIN MANAGEMENT PROBITY AUDIT SERVICES TO THE LIMPOPO DEPARTMENT OF HEALTH FOR A PERIOD OF 36 MONTHS FOR USE AS AND WHEN REQUIRED.,active,40673,50000000,ZAR,2027-12-31T00:00:00Z,2025-01-01T00:00:00Z,2027-12-31T00:00:00Z,1094,ocds-9t57fa-95879,ocds-9t57fa-95879-2024-07-19T00:00:00Z
4765,KZN04/2024,2026-03-25T13:52:38Z,36 MONTHS SECURITY SERVICE FOR KOKSTAD LABOUR CENTRE,active,49183,1934713,ZAR,2028-08-31T00:00:00Z,2025-09-01T00:00:00Z,2028-08-31T00:00:00Z,1095,ocds-9t57fa-96674,ocds-9t57fa-96674-2024-07-26T00:00:00Z
4550,SCMU8-24/25-0037,2026-03-10T15:52:23Z,Appointment of a service provider for security services for the period of three (03) years in Flagstaff Local Offices situated in Ingquza Hill Local Municipality -OR Tambo District.,active,41140,2266542,ZAR,2027-12-12T00:00:00Z,2024-12-13T00:00:00Z,2027-12-12T00:00:00Z,1094,ocds-9t57fa-97397,ocds-9t57fa-97397-2024-08-02T00:00:00Z
4551,SCMU8-24/25-0034,2026-03-10T16:30:02Z,Appointment of a service provider for security services for the period of three (03) years in Lusikisiki College situated in Ingquza Hill Local Municipality -OR Tambo District,active,41202,0,ZAR,2027-12-12T00:00:00Z,2024-12-13T00:00:00Z,2027-12-12T00:00:00Z,1094,ocds-9t57fa-97406,ocds-9t57fa-97406-2024-08-02T00:00:00Z
3991,LR-AGM-24-26,2025-11-07T13:46:40Z,"APPOINTMENT OF A SERVICE PROVIDER FOR SUPPLY, DELIVERY AND INSTALLATION OF OFFICE FURNITURE AT NNR DUYNEFONTEIN OFFICE, MELKBOSSTRAND, CAPE TOWN",active,37708,2156500,ZAR,0001-01-01T00:00:00Z,0001-01-01T00:00:00Z,0001-01-01T00:00:00Z,0,ocds-9t57fa-97914,ocds-9t57fa-97914-2024-08-08T00:00:00Z
5356,DSDP 36/24,2026-05-13T14:56:41Z,PROVISION OF TRAVEL MANAGEMENT SERVICES FOR THE LIMPOPO DEPARTMENT OF SOCIAL DEVELOPMENT FOR A PERIOD OF THIRTY-SIX (36) MONTHS ,active,39641,9600000,ZAR,2027-12-31T00:00:00Z,2025-01-01T00:00:00Z,2027-12-31T00:00:00Z,1094,ocds-9t57fa-98020,ocds-9t57fa-98020-2024-08-08T00:00:00Z
3099,740/04/24,2025-02-26T12:16:10Z,"CALL FOR QUOTATION FROM A PROSPECTIVE SERVICE PROVIDERS TO SUBMIT QUOTATION FOR SUPPLY, DELIVERY, INSTALLATION AND MAINTAINANCE OF UPHONGOLO MUNICIPALITY VoIP TELECOMMUNICATION SOLUTIONS (PABX) FOR A PERIOD OF 36 MONTHS",active,43702,746618,ZAR,2027-12-11T00:00:00Z,2024-12-12T00:00:00Z,2027-12-11T00:00:00Z,1094,ocds-9t57fa-100259,ocds-9t57fa-100259-2024-08-30T00:00:00Z
3696,King,2025-08-18T10:56:29Z,TERMS OF REFERENCE FOR PROVISION OF SERVICES: ESTABLISHMENT OF AN INFRASTRUCTURE TECHNICAL AND MANAGEMENT SUPPORT UNIT (ITMSU) AT THE NORTH-WEST EDUCATION DEPARTMENT (NWED),active,47425,190757952,ZAR,2028-02-01T00:00:00Z,2025-02-01T00:00:00Z,2028-02-01T00:00:00Z,1095,ocds-9t57fa-101015,ocds-9t57fa-101015-2024-09-06T00:00:00Z
2474,Q12/2024/25,2024-10-18T17:56:34Z,TANSPORTATION SERVICES  ,active,36737,27000,ZAR,0001-01-01T00:00:00Z,0001-01-01T00:00:00Z,0001-01-01T00:00:00Z,0,ocds-9t57fa-101841,ocds-9t57fa-101841-2024-09-13T00:00:00Z
2895,T276/2024,2025-01-16T12:50:51Z,PROVISION OF SECURITY SERVICES AT ARNISTON RESORT ,active,40855,606875,ZAR,2027-06-30T00:00:00Z,2025-01-06T00:00:00Z,2027-06-30T00:00:00Z,905,ocds-9t57fa-101903,ocds-9t57fa-101903-2024-09-13T00:00:00Z
3600,4600003277,2025-07-25T12:18:19Z,SECURITY SERVICES FOR GAUTENG PROVINCIAL OFFICE AND WAREHOUSE,active,51832,5104526,ZAR,2028-05-31T00:00:00Z,2025-06-01T00:00:00Z,2028-05-31T00:00:00Z,1095,ocds-9t57fa-102650,ocds-9t57fa-102650-2024-09-20T00:00:00Z
3081,COM033/2024q,2025-02-19T09:28:28Z,COM033 OF 2024: CUTTING OF GRASS AT LYONVILLE CEMETERY UNIONDALE  FOR PERIOD ENDING 30 JUNE 2025.,active,43443,13989,ZAR,0001-01-01T00:00:00Z,0001-01-01T00:00:00Z,0001-01-01T00:00:00Z,0,ocds-9t57fa-103767,ocds-9t57fa-103767-2024-10-04T00:00:00Z
2453,4400004631,2024-10-17T13:04:05Z,Staff welfare - EC,active,36910,700000,ZAR,2025-07-31T00:00:00Z,2024-08-01T00:00:00Z,2025-07-31T00:00:00Z,364,ocds-9t57fa-105102,ocds-9t57fa-105102-2024-07-05T00:00:00Z
3381,MM017/2024,2025-05-13T10:53:20Z,MM017 OF 2024 :SUPPLY AND DELIVERY OF CAMERA.,active,47386,17814,ZAR,0001-01-01T00:00:00Z,0001-01-01T00:00:00Z,0001-01-01T00:00:00Z,0,ocds-9t57fa-105269,ocds-9t57fa-105269-2024-10-18T00:00:00Z
3139,DPD042/2024q,2025-03-04T14:27:18Z,"DPD042/2024q – Appointment Of A Service Provider For A Geotechnical Report Required To Support Development Planning Applications And Project Implementation For Erf 8491 And A Portion Of Erf 8259, George",active,44251,98750,ZAR,0001-01-01T00:00:00Z,0001-01-01T00:00:00Z,0001-01-01T00:00:00Z,0,ocds-9t57fa-105294,ocds-9t57fa-105294-2024-10-18T00:00:00Z
2670,T247/2024,2024-12-02T10:27:29Z,LIFESAVING SERVICES ,active,39243,606117,ZAR,0001-01-01T00:00:00Z,0001-01-01T00:00:00Z,0001-01-01T00:00:00Z,0,ocds-9t57fa-105396,ocds-9t57fa-105396-2024-10-18T00:00:00Z
