id,title,dateSigned,description,status,awardID,value_amount,value_currency,period_endDate,period_startDate,period_maxExtentDate,period_durationInDays,main_ocid,main_id
3774,DHS 39/2023,2025-09-09T08:46:38Z,Appointment of a Service Provider for the construction of 50O housing units at Bloemhof Ext 11: Lekwa Teemane Local Municipality.,active,54555,106176500,ZAR,2026-10-31T00:00:00Z,2024-06-07T00:00:00Z,2026-10-31T00:00:00Z,876,ocds-9t57fa-133228,ocds-9t57fa-133228-2024-01-26T00:00:00Z
2624,01,2024-11-15T09:43:03Z,"REFURBISHMENT OF OCEAN VIEW HOTEL, COFFEE BAY IN MTHATHA",active,28126,7559991,ZAR,2025-02-07T00:00:00Z,2024-05-10T00:00:00Z,2025-02-07T00:00:00Z,273,ocds-9t57fa-78673,ocds-9t57fa-78673-2024-01-19T00:00:00Z
1659,60135,2024-03-28T11:00:08Z,"Procurement of 13 IPADS, 13 Tripods, 6 Airpods max and vlogging stand",active,25759,519255,ZAR,2024-02-02T00:00:00Z,2024-02-02T00:00:00Z,2024-02-02T00:00:00Z,0,ocds-9t57fa-80873,ocds-9t57fa-80873-2024-01-19T00:00:00Z
1725,HS013/2024q,2024-04-11T10:40:42Z,HS013 OF 2023q :GEOTECHNICAL INVESTIGATIONS FOR SINGLE RESIDENTIAL PURPOSES ERVEN,active,26478,63221,ZAR,2025-04-10T00:00:00Z,2024-04-11T00:00:00Z,2025-04-10T00:00:00Z,364,ocds-9t57fa-81002,ocds-9t57fa-81002-2024-02-09T00:00:00Z
1626,60235,2024-03-18T14:14:59Z,Legal Opinion to Resolve the Question on the Legality of Cutting Water as a Credit Control Measure-Lawton's Africa,active,25201,196650,ZAR,2024-03-07T00:00:00Z,2024-02-28T00:00:00Z,2024-03-07T00:00:00Z,8,ocds-9t57fa-84876,ocds-9t57fa-84876-2024-02-02T00:00:00Z
1858,60916,2024-06-03T10:24:01Z,Provincial Branding material -Branded Banners X128.,active,28843,385380,ZAR,2024-03-25T00:00:00Z,2024-03-18T00:00:00Z,2024-03-25T00:00:00Z,7,ocds-9t57fa-86402,ocds-9t57fa-86402-2024-03-08T00:00:00Z
1855,BA041/2024q,2024-05-28T15:22:45Z,"BA041/2024q – Appointment Of A Service Provider For The Recruitment And Selection Process Of The Director: Electrotechnical Services, In Line With The Regulations On Appointment And Conditions Of Employment Of Senior Managers, 2014",active,28737,46000,ZAR,2025-05-27T00:00:00Z,2024-05-28T00:00:00Z,2025-05-27T00:00:00Z,364,ocds-9t57fa-89696,ocds-9t57fa-89696-2024-05-10T00:00:00Z
2492,NNRSCM-03-2024,2024-10-25T13:49:22Z,"APPOINTMENT OF A SERVICE PROVIDER TO PROVIDE SOFTWARE UPGRADE, LICENSING, SUPPORT AND MAINTENANCE FOR SAGE 300 ERP SYSTEM AND RELATED APPLICATIONS TO THE NNR FOR A PERIOD OF FOUR (4) YEARS.",active,32063,1740927,ZAR,2028-07-31T00:00:00Z,2024-08-01T00:00:00Z,2028-07-31T00:00:00Z,1460,ocds-9t57fa-90406,ocds-9t57fa-90406-2024-05-17T00:00:00Z
1953,61184,2024-07-02T14:04:31Z,Request for Multi-function Printer at 3rd Floor Cluster 1 - MFPC6 AltaLink C8135 Copy/Print/Scan; 3TM,active,29823,203923,ZAR,2024-06-14T00:00:00Z,2024-05-13T00:00:00Z,2024-06-14T00:00:00Z,32,ocds-9t57fa-90862,ocds-9t57fa-90862-2024-05-02T00:00:00Z
3072,TETA24/RESEARCH/0004/SSP,2025-02-18T10:39:04Z,REQUEST FOR PROPOSALS FROM SERVICE PROVIDERS TO CONDUCT RESEARCH AND UPDATE THE TETA 2026/27 SECTOR SKILLS PLAN (SSP).,active,36365,356500,ZAR,2025-10-03T00:00:00Z,2024-10-03T00:00:00Z,2025-10-03T00:00:00Z,365,ocds-9t57fa-93369,ocds-9t57fa-93369-2024-06-21T00:00:00Z
2311,SCMU8-23/24-0089,2024-09-26T09:24:50Z,"SUPPLY AND DELIVERY OF LAPTOPS AND ACCESSORIES FOR 152 EXTENSION OFFICERS & ADVISORY SERVICES OFFICIALS
 
",active,34978,3419585,ZAR,0001-01-01T00:00:00Z,0001-01-01T00:00:00Z,0001-01-01T00:00:00Z,0,ocds-9t57fa-93509,ocds-9t57fa-93509-2024-06-21T00:00:00Z
2095,PO987,2024-08-05T14:04:01Z,"APPOINTMENT OF A SERVICE PROVIDER FOR ICT NETWORK, ACCESS CONTROL AND TV INSTALLATIONS NEEDED AT SALGA FS OFFICE.",active,32169,0,ZAR,0001-01-01T00:00:00Z,0001-01-01T00:00:00Z,0001-01-01T00:00:00Z,0,ocds-9t57fa-95178,ocds-9t57fa-95178-2024-06-21T00:00:00Z
1997,3100035777,2024-07-15T10:25:59Z,Access cart consumables,active,31209,13533,ZAR,0001-01-01T00:00:00Z,0001-01-01T00:00:00Z,0001-01-01T00:00:00Z,0,ocds-9t57fa-95277,ocds-9t57fa-95277-2024-04-04T00:00:00Z
2529,P7/ENV/05/24,2024-11-04T15:56:47Z,APPOINTMENT OF A SERVICE PROVIDER TO RENDER TRAINING OF THREE ACCREDITED UNIT STANDARDS NAMELY: (A) DESCRIBE AND APPLY THE MANAGEMENT FUNCTIONS OF AN ORGANIZATION SAQA ID (14667); (B) DEMONSTRATE AN UNDERSTANDING OF AND PROVIDE ASSISTANCE FOR RISK ANALYSIS FUNCTIONS SAQA ID (123461); AND (C) CONDUCT BASIC FORESTRY MAP READING SAQA ID (117085).,active,35847,922530,ZAR,2025-03-27T00:00:00Z,2024-10-28T00:00:00Z,2025-03-27T00:00:00Z,150,ocds-9t57fa-96607,ocds-9t57fa-96607-2024-07-26T00:00:00Z
2533,COM026/2024q,2024-11-05T09:44:10Z,COM026 OF 2024q: Supply  and  Installation of Blinds and Security  Shutters.,active,37875,56510,ZAR,0001-01-01T00:00:00Z,0001-01-01T00:00:00Z,0001-01-01T00:00:00Z,0,ocds-9t57fa-98593,ocds-9t57fa-98593-2024-08-16T00:00:00Z
2467,Q5/2024/25,2024-10-18T17:33:26Z,SUPPLY AND DELIVERY OF COMBO DRONE KIT ,active,35805,63867,ZAR,0001-01-01T00:00:00Z,0001-01-01T00:00:00Z,0001-01-01T00:00:00Z,0,ocds-9t57fa-98772,ocds-9t57fa-98772-2024-08-16T00:00:00Z
3870,01HO2025/26,2025-10-16T15:15:12Z,Procurement of two (2) large-size Optical Marking Recognition (ORM) and colour imaging Scanners and maintenance support service agreement for the Department of Employment and Labour.,active,43487,3512969,ZAR,2031-03-31T00:00:00Z,2025-03-18T00:00:00Z,2031-03-31T00:00:00Z,2204,ocds-9t57fa-105421,ocds-9t57fa-105421-2024-10-18T00:00:00Z
4386,SCMU12-24/25-0009,2026-02-11T13:31:32Z,Appointment of a service provider to render Cleaning Services for Head Office (Bhisho) and Amathole District Office ( East London) for a period of thirty-six (36) months,active,45198,14346133,ZAR,2028-02-23T00:00:00Z,2025-02-24T00:00:00Z,2028-02-23T00:00:00Z,1094,ocds-9t57fa-109845,ocds-9t57fa-109845-2024-11-29T00:00:00Z
3371,T/ING/031/2024,2025-05-06T14:45:06Z,"TENDER FOR THE MANUFACTURE, SUPPLY AND DELIVERY OF 15 000L COMBINATION JET/VACUUM UNIT ",active,47117,5458332,ZAR,0001-01-01T00:00:00Z,0001-01-01T00:00:00Z,0001-01-01T00:00:00Z,0,ocds-9t57fa-110162,ocds-9t57fa-110162-2024-12-05T00:00:00Z
3030,FIN045/2024q,2025-02-10T11:10:05Z,"FIN045/2024q – Supply, Delivery, And Installation Of New Airconditioning Units At The Financial Services Department Of George Municipality",active,43055,298146,ZAR,0001-01-01T00:00:00Z,0001-01-01T00:00:00Z,0001-01-01T00:00:00Z,0,ocds-9t57fa-110375,ocds-9t57fa-110375-2024-12-06T00:00:00Z
2869,64460,2024-12-20T13:19:40Z,APPOINTMENT OF A SERVICE PROVIDER TO DEVELOP MUNICIPAL SOCIO-ECONOMIC PROFILES FOR ALL MUNICIPALITIES IN SOUTH AFRICA AND COLLECT MUNICIPAL VIOLENCE INCIDENTS DATA,active,40243,979999,ZAR,0001-01-01T00:00:00Z,0001-01-01T00:00:00Z,0001-01-01T00:00:00Z,0,ocds-9t57fa-111316,ocds-9t57fa-111316-2024-12-19T00:00:00Z
3447,1C-23260,2025-06-02T09:45:53Z,"SUPPLY AND DELIVERY OF ORIGINAL SPARES AND REPLACEMENT PARTS AND  THE PROVISION OF REPAIR SEVICES FOR JAWS OF LIFE,LUKAS SETS ",active,48063,6000000,ZAR,2027-12-03T00:00:00Z,2024-12-04T00:00:00Z,2027-12-03T00:00:00Z,1094,ocds-9t57fa-123413,ocds-9t57fa-123413-2024-08-17T00:00:00Z
4286,SCMU5-24/25-0075,2026-01-30T11:37:02Z,PROVISION OF PROFESSIONAL QUANTITY SURVEYING SERVICES FOR THE CONSTRUCTION OF NKOPANE JSS IN STERKSPRUIT,active,61117,5548108,ZAR,2026-04-01T00:00:00Z,2024-10-01T00:00:00Z,2026-04-01T00:00:00Z,547,ocds-9t57fa-144902,ocds-9t57fa-144902-2024-04-26T00:00:00Z
3613,SCMU10-24/25-0002,2025-07-30T13:53:00Z,APPOINTMENT OF A SERVICE PROVIDER FOR PROVISIONING OF CLEANING SERVICES AT MTHATHA AIRPORT FOR A CONTRACT PERIOD OF 36 MONTHS,active,45597,4862171,ZAR,2027-11-30T00:00:00Z,2024-12-02T00:00:00Z,2027-11-30T00:00:00Z,1093,ocds-9t57fa-88063,ocds-9t57fa-88063-2024-04-19T00:00:00Z
2140,ES/24/ROAD/01,2024-08-22T11:57:37Z,Provision of Maintenance and Repair services to ELIDZ Roads,active,33534,10247516,ZAR,0001-01-01T00:00:00Z,0001-01-01T00:00:00Z,0001-01-01T00:00:00Z,0,ocds-9t57fa-88368,ocds-9t57fa-88368-2024-04-26T00:00:00Z
3686,SCMU5-24/25-0072,2025-08-13T15:44:45Z,"CONSTRUCTION OF MVUMELWANO 
TRADITIONAL COUNCIL, PORT ST JOHNS",active,43499,2854655,ZAR,2025-11-26T00:00:00Z,2025-01-27T00:00:00Z,2025-11-26T00:00:00Z,303,ocds-9t57fa-90467,ocds-9t57fa-90467-2024-05-17T00:00:00Z
2507,BA063/2024,2024-10-30T10:50:36Z,TENDER FOR THE APPOINTMENT OF A SERVICE PROVIDER FOR THE UNDERWRITING OF THE MUNICIPALITY'S GROUP LIFE PORTFOLIO FROM DATE OF APPOINTMENT UNTIL 30 JUNE 2027,active,37536,8664,ZAR,2027-06-30T00:00:00Z,2024-10-28T00:00:00Z,2027-06-30T00:00:00Z,975,ocds-9t57fa-94031,ocds-9t57fa-94031-2024-06-28T00:00:00Z
2469,Q7/2024/25,2024-10-18T17:40:11Z,SUPPLY NEW FRONT HEAVY DUTY SPRING PACK CRONER PKE250 (NISSAN UD80),active,35800,43941,ZAR,0001-01-01T00:00:00Z,0001-01-01T00:00:00Z,0001-01-01T00:00:00Z,0,ocds-9t57fa-99456,ocds-9t57fa-99456-2024-08-23T00:00:00Z
4432,4660019233,2026-02-17T11:19:26Z,"TERMS OF REFERENCE FOR PROCUREMENT OF HYGIENE SERVICES FOR THE GAUTENG DEPARTMENT OF ECONOMIC DEVELOPMENT (GDED) 56 ELOFF STREET,
JOHANNESBURG FOR THE PERIOD OF THREE (3) YEARS",pending,40147,6355212,ZAR,2028-01-31T00:00:00Z,2025-02-01T00:00:00Z,2028-01-31T00:00:00Z,1094,ocds-9t57fa-97898,ocds-9t57fa-97898-2024-08-08T00:00:00Z
2567,DPD038/2024q,2024-11-08T10:53:44Z,"DPD038/2024q – Supply, Delivery And Installation Of Airconditioning Units At The Workers Collection Point Of George Municipality",active,38050,37950,ZAR,0001-01-01T00:00:00Z,0001-01-01T00:00:00Z,0001-01-01T00:00:00Z,0,ocds-9t57fa-98471,ocds-9t57fa-98471-2024-08-15T00:00:00Z
4726,CCB2025/01,2026-03-24T12:31:45Z,"
 Appoint a service provider to render internal audit services to the Castle Control Board for three (3) years.

",active,44455,648025,ZAR,2028-03-31T00:00:00Z,2025-02-21T00:00:00Z,2028-03-31T00:00:00Z,1134,ocds-9t57fa-99399,ocds-9t57fa-99399-2024-08-22T00:00:00Z
3452,KHM T001/011/2024C-DEJAGERS,2025-06-02T14:40:31Z,Sutherland Emergency Bulk Water Supply - Phase 2 CIVIL ENGINEERING,active,48424,23314695,ZAR,2026-06-30T00:00:00Z,2025-03-31T00:00:00Z,2026-06-30T00:00:00Z,456,ocds-9t57fa-106016,ocds-9t57fa-106016-2024-10-25T00:00:00Z
5284,G531/2024,2026-05-09T15:05:29Z,THE APPOINTMENT OF A SERVICE PROVIDER TO PROVIDE SECURITY GUARDING SERVICES FOR THE SOUTH AFRICAN NATIONAL BIODIVERSITY INSTITUTE (SANBI) AT THE PRETORIA NATIONAL BOTANICAL GARDEN FOR A PERIOD OF ONE (1) YEAR.,pending,65733,3622531,ZAR,2027-02-28T00:00:00Z,2026-03-01T00:00:00Z,2027-02-28T00:00:00Z,364,ocds-9t57fa-111013,ocds-9t57fa-111013-2024-12-13T00:00:00Z
4532,40,2026-03-06T09:32:12Z,"COMPLETION OF CIVIL, MECHANICAL AND ELECTRICAL INFRASTRUCTURE AT DIMBAZA WASTE  WATER TREATMENT WORKS, PHASE 1",active,54592,29800217,ZAR,2026-09-30T00:00:00Z,2025-10-01T00:00:00Z,2026-09-30T00:00:00Z,364,ocds-9t57fa-111030,ocds-9t57fa-111030-2024-12-13T00:00:00Z
3775,DHS16/2023(E),2025-09-09T08:46:52Z,APPOINTMENT OF SERVICE PROVIDER FOR CONTRUCTION OF 300 HOUSING UNITS AT TSHING EXT 10 PHASE  JB MARKS LOCAL  MUNICIAPLITY,terminated,58749,57387000,ZAR,2026-10-31T00:00:00Z,2024-06-07T00:00:00Z,2026-10-31T00:00:00Z,876,ocds-9t57fa-133204,ocds-9t57fa-133204-2024-01-26T00:00:00Z
4730,CCB2024/01,2026-03-24T12:47:14Z,The Castle Control Board would like to invite service providers to supply an Annual Financial Statements preparation tool for the Castle Control Board to enable preparation of GRAP compliant Annual Financial Statements and Working Papers.,active,25532,131640,ZAR,2027-03-31T00:00:00Z,2024-04-01T00:00:00Z,2027-03-31T00:00:00Z,1094,ocds-9t57fa-78631,ocds-9t57fa-78631-2024-01-19T00:00:00Z
2338,SCMU8-24/25-0002,2024-10-04T09:55:44Z,"SUPPLY, DELIVERY AND CONSTRUCTION OF A MULTIPURPOSE SHED AT ELUNYAWENI VILLAGE IN THE ELUNDINI LOCAL MUNICIPALITY OF THE JOE GQABI DISTRICT",active,27897,0,ZAR,2024-10-16T00:00:00Z,2024-06-12T00:00:00Z,2024-10-16T00:00:00Z,126,ocds-9t57fa-79337,ocds-9t57fa-79337-2024-01-26T00:00:00Z
2341,SCMU8-24/24-0006,2024-10-04T10:04:25Z,"SUPPLY, DELIVERY AND CONSTRUCTION OF A MULTIPURPOSE SHED AT ROCKLIFF VILLAGE IN THE SENQU LOCAL MUNICIPALITY OF THE JOE GQABI DISTRICT",active,27328,0,ZAR,2024-09-18T00:00:00Z,2024-05-16T00:00:00Z,2024-09-18T00:00:00Z,125,ocds-9t57fa-79367,ocds-9t57fa-79367-2024-01-26T00:00:00Z
2193,BS/2024/CON512,2024-09-05T11:16:30Z,APPOINTMENT OF A PANEL OF SERVICE PROVIDERS FOR THE PROVISION OF INTERNAL AUDIT SERVICES FOR A PERIOD OF 3 YEARS.,active,28147,5028770,ZAR,2027-06-03T00:00:00Z,2024-06-03T00:00:00Z,2027-06-03T00:00:00Z,1095,ocds-9t57fa-81086,ocds-9t57fa-81086-2024-02-09T00:00:00Z
2681,T91/2024,2024-12-02T15:26:32Z,SUPPLY & DELIVERY OF WATER PURIFICATION CHEMICALS & TESTING OF WATER & SEWER SAMPLES FOR A PERIOD OF 3 YEARS,active,39394,786700,ZAR,2027-06-30T00:00:00Z,2024-07-01T00:00:00Z,2027-06-30T00:00:00Z,1094,ocds-9t57fa-81891,ocds-9t57fa-81891-2024-02-16T00:00:00Z
2699,T97/2024,2024-12-04T09:42:43Z,SUPPLY & DELIVERY OF WATER PURIFICATION CHEMICALS & TESTING OF WATER & SEWER SAMPLES FOR A PERIOD OF 3 YEARS,active,39395,2400000,ZAR,2027-06-30T00:00:00Z,2024-07-01T00:00:00Z,2027-06-30T00:00:00Z,1094,ocds-9t57fa-81891,ocds-9t57fa-81891-2024-02-16T00:00:00Z
3063,HEDP 012/23/24,2025-02-13T15:47:41Z,"RE-ADVERT: ACCREDITATION OF SERVICE PROVIDERS FOR THE PROVISION OF SPECIALIZED CLINICAL, SURGICAL AND DIAGNOSTIC SERVICES FOR THE LIMPOPO DEPARTMENT OF HEALTH FOR A PERIOD OF THIRTY SIX (36) MONTHS",active,35291,50000000,ZAR,2027-09-30T00:00:00Z,2024-10-01T00:00:00Z,2027-09-30T00:00:00Z,1094,ocds-9t57fa-85160,ocds-9t57fa-85160-2024-03-15T00:00:00Z
2649,hedp012/23/24,2024-11-26T09:19:14Z,"RE-ADVERT: ACCREDITATION OF SERVICE PROVIDERS FOR THE PROVISION OF SPECIALIZED CLINICAL, SURGICAL AND DIAGNOSTIC SERVICES FOR THE LIMPOPO DEPARTMENT OF HEALTH FOR A PERIOD OF THIRTY SIX (36) MONTHS",active,35292,50000000,ZAR,2027-09-30T00:00:00Z,2024-10-01T00:00:00Z,2027-09-30T00:00:00Z,1094,ocds-9t57fa-85160,ocds-9t57fa-85160-2024-03-15T00:00:00Z
4761,CDC/58/24,2026-03-25T09:31:58Z,TURNKEY/ DESIGN AND CONSTRUCTION - PHASE 2 INTERNAL ENGINERRING SERVICES - TSHWANE AUTOMOTIVE SPECIAL ECONOMIC ZONE,active,33860,110786932,ZAR,2025-09-16T00:00:00Z,2024-09-16T00:00:00Z,2025-09-16T00:00:00Z,365,ocds-9t57fa-86797,ocds-9t57fa-86797-2024-04-05T00:00:00Z
4682,007/2024/25,2026-03-20T15:21:23Z,"
PROVISION OF SD WAN HOSTED IP PABX, WIFI SOLUTION AND SUPPORT SERVICES FOR THE EASTERN CAPE LIQUOR BOARD FOR A PERIOD OF THREE YEARS.
",active,34603,42311001,ZAR,2027-10-15T00:00:00Z,0001-01-01T00:00:00Z,2027-10-15T00:00:00Z,740268,ocds-9t57fa-92837,ocds-9t57fa-92837-2024-06-14T00:00:00Z
3424,BID NO. 005/2024/25,2025-05-23T11:50:10Z,PROVISION OF CLIENT SERVICES TOLL-FREE LINE FOR A PERIOD OF THREE (3) YEARS WITH AN OPTION TO EXTEND FOR TWO (2) YEARS,active,39658,907321,ZAR,2027-11-30T00:00:00Z,2024-12-01T00:00:00Z,2027-11-30T00:00:00Z,1094,ocds-9t57fa-94549,ocds-9t57fa-94549-2024-07-05T00:00:00Z
5010,T195/2024,2026-04-16T10:58:26Z,ICT ACCESS NETWORK AND VOIP SERVICES FOR A PERIOD OF 36 MONTHS,active,36730,13948709,ZAR,2027-06-30T00:00:00Z,2024-04-02T00:00:00Z,2027-06-30T00:00:00Z,1184,ocds-9t57fa-95189,ocds-9t57fa-95189-2024-07-12T00:00:00Z
4055,DTP01632,2025-11-21T16:57:38Z,"DTP/RFP/07/CAR/06/2024: Request for proposals for the supply, delivery, maintenance and repairs of forklifts with buy back of existing forklifts for Dube Cargo Terminal and Bonded Warehouse for a period of three (3) years",active,44783,6358547,ZAR,2028-06-27T00:00:00Z,2025-04-14T00:00:00Z,2028-06-27T00:00:00Z,1170,ocds-9t57fa-95236,ocds-9t57fa-95236-2024-07-12T00:00:00Z
4768,KZN06/2024,2026-03-25T14:06:57Z,36 MONTHS SECURITY SERVICE FOR DUNDEE LABOUR CENTRE,active,49185,1260519,ZAR,2028-06-30T00:00:00Z,2025-07-01T00:00:00Z,2028-06-30T00:00:00Z,1095,ocds-9t57fa-96682,ocds-9t57fa-96682-2024-07-26T00:00:00Z
4560,SCMU8-24/25-0036,2026-03-11T15:47:25Z,Appointment of a service provider for security services for the period of three (03) years in Vet Lab in Mthatha Local Offices situated in KSD Local Municipality -OR Tambo District.,active,41144,1477274,ZAR,2027-12-12T00:00:00Z,2024-12-13T00:00:00Z,2027-12-12T00:00:00Z,1094,ocds-9t57fa-97401,ocds-9t57fa-97401-2024-08-02T00:00:00Z
4619,SCMU3-24/25-0302-FRH,2026-03-16T12:55:56Z,"Provision of cleaning services at frontier hospital for the
period of 36 months.",active,64786,28900232,ZAR,2028-02-20T00:00:00Z,2025-02-21T00:00:00Z,2028-02-20T00:00:00Z,1094,ocds-9t57fa-97436,ocds-9t57fa-97436-2024-08-02T00:00:00Z
5288,CNT 4257,2026-05-09T20:21:46Z,2024 Salary Payscales benchmarks ,pending,36830,398590,ZAR,2025-10-20T00:00:00Z,2024-10-21T00:00:00Z,2025-10-20T00:00:00Z,364,ocds-9t57fa-97466,ocds-9t57fa-97466-2024-08-03T00:00:00Z
4333,DHA09-2024,2026-02-09T09:54:59Z,The appointment of a service provider for the provision of cleaning services for Gauteng Province for three (3) Metros and two (2) Districts for various buildings for a period of thirty-six (36) months.,active,43290,3508274,ZAR,2028-03-31T00:00:00Z,2025-04-01T00:00:00Z,2028-03-31T00:00:00Z,1095,ocds-9t57fa-97915,ocds-9t57fa-97915-2024-08-08T00:00:00Z
4767,KZN03/2024,2026-03-25T14:01:50Z,36 MONTHS SECURITY SERVICE FOR DURBAN LABOUR CENTRE,active,49190,5762640,ZAR,2028-08-31T00:00:00Z,2025-09-01T00:00:00Z,2028-08-31T00:00:00Z,1095,ocds-9t57fa-97963,ocds-9t57fa-97963-2024-08-08T00:00:00Z
4723,CCB2025/02,2026-03-24T11:39:36Z,Castle Control Board is looking to contract a media monitoring agency for a 3-year contract period. ,active,44454,339066,ZAR,2028-02-29T00:00:00Z,2025-03-01T00:00:00Z,2028-02-29T00:00:00Z,1095,ocds-9t57fa-99375,ocds-9t57fa-99375-2024-08-22T00:00:00Z
4746,CCB2025/2,2026-03-24T14:48:11Z,Castle Control Board is looking to contract a media monitoring agency for a 3-year contract period. ,active,44454,339066,ZAR,2028-02-29T00:00:00Z,2025-03-03T00:00:00Z,2028-02-29T00:00:00Z,1093,ocds-9t57fa-99375,ocds-9t57fa-99375-2024-08-22T00:00:00Z
